rt,stimulus,button_pressed,choices,ChosenStimulus,trial_type,trial_index,time_elapsed,internal_node_id,subject_id,study_id,session_id,subject,list,ppt_gender,url,key_press,sentence_type,verb,test_part,responses,question_order,left_part,right_part
2748.5,Welcome to the experiment. Press Continue to begin.,0,Continue,Continue,html-button-response,0,2753,0.0-0.0,anomymised,656582dc9140dccdaa20d120,65671a3fe8694e8502f0f142,18872,1C,woman,NA,NA,NA,NA,NA,NA,NA,NA,NA
14264.300000000047,NA,NA,NA,NA,external-html,1,18060,0.0-1.0,anomymised,656582dc9140dccdaa20d120,65671a3fe8694e8502f0f142,18872,1C,woman,consent.html,NA,NA,NA,NA,NA,NA,NA,NA
15452.699999999953,"<p>Welcome.</p><p>In this experiment we will ask you to imagine some situations.</p><p>Each trial starts with a description of an event.</p><p>Then you will see alternative descriptions of that event, and you will rate on a scale how best they match the original description.</p><p>You will give your answer by clicking a button on a rating scale.</p><p>To do this task, you will have to use your imagination to visualise these events.</p><br><p>Ready?</p>",0,Continue,Continue,html-button-response,2,33516,0.0-2.0,anomymised,656582dc9140dccdaa20d120,65671a3fe8694e8502f0f142,18872,1C,woman,NA,NA,NA,NA,NA,NA,NA,NA,NA
4732.5,"<p>Before the experiment starts, you will watch an example trial. Press 'Continue'.</p>",0,Continue,Continue,html-button-response,3,39252,0.0-3.0,anomymised,656582dc9140dccdaa20d120,65671a3fe8694e8502f0f142,18872,1C,woman,NA,NA,NA,NA,NA,NA,NA,NA,NA
null,The police officer is arresting the robber,NA,NA,NA,html-keyboard-response,4,42255,0.0-4.0,anomymised,656582dc9140dccdaa20d120,65671a3fe8694e8502f0f142,18872,1C,woman,NA,null,NA,NA,NA,NA,NA,NA,NA
15891,<img src='img/Example-trial.jpg' style='height:550px;''></img>,0,Continue,Continue,html-button-response,5,58147,0.0-5.0,anomymised,656582dc9140dccdaa20d120,65671a3fe8694e8502f0f142,18872,1C,woman,NA,NA,NA,NA,NA,NA,NA,NA,NA
3660.3000000000466,<p>Ready to start the experiment?</p><br><p><strong>Remember to give an answer by clicking a button on the rating scale.</strong></p><p>Press 'Continue' to begin.</p>,0,Continue,Continue,html-button-response,6,62812,0.0-6.0,anomymised,656582dc9140dccdaa20d120,65671a3fe8694e8502f0f142,18872,1C,woman,NA,NA,NA,NA,NA,NA,NA,NA,NA
null,Dave is being touched by Mike,NA,NA,NA,html-keyboard-response,7,65817,0.0-7.0-0.0,anomymised,656582dc9140dccdaa20d120,65671a3fe8694e8502f0f142,18872,1C,woman,NA,null,M4 is being touched by M2,touch2,sentence,NA,NA,NA,NA
9319,NA,NA,NA,NA,survey-likert-extra-labels,8,75142,0.0-7.0-1.0-0.0,anomymised,656582dc9140dccdaa20d120,65671a3fe8694e8502f0f142,18872,1C,woman,NA,NA,M4 is being touched by M2,touch2,rating_causation,"{""Q0"":3}",[0],M2 asked to touch M4,M4 asked to touch M2
38956.40000000002,NA,NA,NA,NA,survey-likert-extra-labels,9,114109,0.0-7.0-2.0,anomymised,656582dc9140dccdaa20d120,65671a3fe8694e8502f0f142,18872,1C,woman,NA,NA,M4 is being touched by M2,touch2,rating_volition,"{""Q0"":2}",[0],M2 wanted to touch M4,M4 wanted to touch M2
null,Jane is carrying Beth,NA,NA,NA,html-keyboard-response,10,116118,0.0-8.0-0.0,anomymised,656582dc9140dccdaa20d120,65671a3fe8694e8502f0f142,18872,1C,woman,NA,null,W2 is carrying W4,carry,sentence,NA,NA,NA,NA
17266.900000000023,NA,NA,NA,NA,survey-likert-extra-labels,11,133389,0.0-8.0-2.0,anomymised,656582dc9140dccdaa20d120,65671a3fe8694e8502f0f142,18872,1C,woman,NA,NA,W2 is carrying W4,carry,rating_volition,"{""Q0"":1}",[0],W2 is transporting W4,W4 is transporting W2
10102,NA,NA,NA,NA,survey-likert-extra-labels,12,143502,0.0-8.0-3.0-0.0,anomymised,656582dc9140dccdaa20d120,65671a3fe8694e8502f0f142,18872,1C,woman,NA,NA,W2 is carrying W4,carry,rating_causation,"{""Q0"":0}",[0],W2 is being moved by W4,W4 is being moved by W2
null,Kate is feeding Luke,NA,NA,NA,html-keyboard-response,13,145513,0.0-9.0-0.0,anomymised,656582dc9140dccdaa20d120,65671a3fe8694e8502f0f142,18872,1C,woman,NA,null,W3 is feeding M1,feed,sentence,NA,NA,NA,NA
17016.400000000023,NA,NA,NA,NA,survey-likert-extra-labels,14,162533,0.0-9.0-2.0,anomymised,656582dc9140dccdaa20d120,65671a3fe8694e8502f0f142,18872,1C,woman,NA,NA,W3 is feeding M1,feed,rating_volition,"{""Q0"":2}",[0],W3 cooked for M1,M1 cooked for W3
15541.699999999953,NA,NA,NA,NA,survey-likert-extra-labels,15,178085,0.0-9.0-3.0-0.0,anomymised,656582dc9140dccdaa20d120,65671a3fe8694e8502f0f142,18872,1C,woman,NA,NA,W3 is feeding M1,feed,rating_causation,"{""Q0"":5}",[0],W3 is eating M1's food,M1 is eating W3's food
null,Fred is being opposed by Luke,NA,NA,NA,html-keyboard-response,16,180093,0.0-10.0-0.0,anomymised,656582dc9140dccdaa20d120,65671a3fe8694e8502f0f142,18872,1C,woman,NA,null,M3 is being opposed by M1,oppose2,sentence,NA,NA,NA,NA
12413.20000000007,NA,NA,NA,NA,survey-likert-extra-labels,17,192509,0.0-10.0-2.0,anomymised,656582dc9140dccdaa20d120,65671a3fe8694e8502f0f142,18872,1C,woman,NA,NA,M3 is being opposed by M1,oppose2,rating_volition,"{""Q0"":0}",[0],M1 wanted to oppose M3,M3 wanted to oppose M1
8621.79999999993,NA,NA,NA,NA,survey-likert-extra-labels,18,201140,0.0-10.0-3.0-0.0,anomymised,656582dc9140dccdaa20d120,65671a3fe8694e8502f0f142,18872,1C,woman,NA,NA,M3 is being opposed by M1,oppose2,rating_causation,"{""Q0"":1}",[0],M1 started opposing M3,M3 started opposing M1
null,Kate is being greeted by Luke,NA,NA,NA,html-keyboard-response,19,203149,0.0-11.0-0.0,anomymised,656582dc9140dccdaa20d120,65671a3fe8694e8502f0f142,18872,1C,woman,NA,null,W3 is being greeted by M1,greet4,sentence,NA,NA,NA,NA
15228.900000000023,NA,NA,NA,NA,survey-likert-extra-labels,20,218381,0.0-11.0-1.0-0.0,anomymised,656582dc9140dccdaa20d120,65671a3fe8694e8502f0f142,18872,1C,woman,NA,NA,W3 is being greeted by M1,greet4,rating_causation,"{""Q0"":6}",[0],W3 started greeting M1 first,M1 started greeting W3 first
10206,NA,NA,NA,NA,survey-likert-extra-labels,21,228597,0.0-11.0-2.0,anomymised,656582dc9140dccdaa20d120,65671a3fe8694e8502f0f142,18872,1C,woman,NA,NA,W3 is being greeted by M1,greet4,rating_volition,"{""Q0"":6}",[0],W3 wanted to greet M1,M1 wanted to greet W3
null,Luke is being kissed by Fred,NA,NA,NA,html-keyboard-response,22,230608,0.0-12.0-0.0,anomymised,656582dc9140dccdaa20d120,65671a3fe8694e8502f0f142,18872,1C,woman,NA,null,M1 is being kissed by M3,kiss2,sentence,NA,NA,NA,NA
15065.800000000047,NA,NA,NA,NA,survey-likert-extra-labels,23,245676,0.0-12.0-2.0,anomymised,656582dc9140dccdaa20d120,65671a3fe8694e8502f0f142,18872,1C,woman,NA,NA,M1 is being kissed by M3,kiss2,rating_volition,"{""Q0"":1}",[0],M1 wanted to kiss M3,M3 wanted to kiss M1
18332.79999999993,NA,NA,NA,NA,survey-likert-extra-labels,24,264021,0.0-12.0-3.0-0.0,anomymised,656582dc9140dccdaa20d120,65671a3fe8694e8502f0f142,18872,1C,woman,NA,NA,M1 is being kissed by M3,kiss2,rating_causation,"{""Q0"":2}",[0],M1 asked to kiss M3,M3 asked to kiss M1
null,Mike is posing for Dave,NA,NA,NA,html-keyboard-response,25,266030,0.0-13.0-0.0,anomymised,656582dc9140dccdaa20d120,65671a3fe8694e8502f0f142,18872,1C,woman,NA,null,M2 is posing for M4,pose,sentence,NA,NA,NA,NA
12692.399999999907,NA,NA,NA,NA,survey-likert-extra-labels,26,278726,0.0-13.0-1.0-0.0,anomymised,656582dc9140dccdaa20d120,65671a3fe8694e8502f0f142,18872,1C,woman,NA,NA,M2 is posing for M4,pose,rating_causation,"{""Q0"":5}",[0],M2 is photographing M4,M4 is photographing M2
9769.5,NA,NA,NA,NA,survey-likert-extra-labels,27,288508,0.0-13.0-2.0,anomymised,656582dc9140dccdaa20d120,65671a3fe8694e8502f0f142,18872,1C,woman,NA,NA,M2 is posing for M4,pose,rating_volition,"{""Q0"":0}",[0],M2 is modelling for M4,M4 is modelling for M2
null,Mike is being kissed by Beth,NA,NA,NA,html-keyboard-response,28,290518,0.0-14.0-0.0,anomymised,656582dc9140dccdaa20d120,65671a3fe8694e8502f0f142,18872,1C,woman,NA,null,M2 is being kissed by W4,kiss3,sentence,NA,NA,NA,NA
33187.70000000007,NA,NA,NA,NA,survey-likert-extra-labels,29,323709,0.0-14.0-1.0-0.0,anomymised,656582dc9140dccdaa20d120,65671a3fe8694e8502f0f142,18872,1C,woman,NA,NA,M2 is being kissed by W4,kiss3,rating_causation,"{""Q0"":4}",[0],M2 asked to kiss W4,W4 asked to kiss M2
15829.70000000007,NA,NA,NA,NA,survey-likert-extra-labels,30,339548,0.0-14.0-2.0,anomymised,656582dc9140dccdaa20d120,65671a3fe8694e8502f0f142,18872,1C,woman,NA,NA,M2 is being kissed by W4,kiss3,rating_volition,"{""Q0"":6}",[0],M2 wanted to kiss W4,W4 wanted to kiss M2
null,Ruth is being looked at by Kate,NA,NA,NA,html-keyboard-response,31,341557,0.0-15.0-0.0,anomymised,656582dc9140dccdaa20d120,65671a3fe8694e8502f0f142,18872,1C,woman,NA,null,W1 is being looked at by W3,look1,sentence,NA,NA,NA,NA
25501.400000000023,NA,NA,NA,NA,survey-likert-extra-labels,32,367061,0.0-15.0-2.0,anomymised,656582dc9140dccdaa20d120,65671a3fe8694e8502f0f142,18872,1C,woman,NA,NA,W1 is being looked at by W3,look1,rating_volition,"{""Q0"":5}",[0],W1 wanted to look at W3,W3 wanted to look at W1
12140.5,NA,NA,NA,NA,survey-likert-extra-labels,33,379213,0.0-15.0-3.0-0.0,anomymised,656582dc9140dccdaa20d120,65671a3fe8694e8502f0f142,18872,1C,woman,NA,NA,W1 is being looked at by W3,look1,rating_causation,"{""Q0"":5}",[0],W1 looked at W3 first,W3 looked at W1 first
null,Beth is being touched by Jane,NA,NA,NA,html-keyboard-response,34,381222,0.0-16.0-0.0,anomymised,656582dc9140dccdaa20d120,65671a3fe8694e8502f0f142,18872,1C,woman,NA,null,W4 is being touched by W2,touch1,sentence,NA,NA,NA,NA
24099.400000000023,NA,NA,NA,NA,survey-likert-extra-labels,35,405325,0.0-16.0-1.0-0.0,anomymised,656582dc9140dccdaa20d120,65671a3fe8694e8502f0f142,18872,1C,woman,NA,NA,W4 is being touched by W2,touch1,rating_causation,"{""Q0"":2}",[0],W2 asked to touch W4,W4 asked to touch W2
19764.700000000186,NA,NA,NA,NA,survey-likert-extra-labels,36,425102,0.0-16.0-2.0,anomymised,656582dc9140dccdaa20d120,65671a3fe8694e8502f0f142,18872,1C,woman,NA,NA,W4 is being touched by W2,touch1,rating_volition,"{""Q0"":1}",[0],W2 wanted to touch W4,W4 wanted to touch W2
null,Luke is being looked at by Fred,NA,NA,NA,html-keyboard-response,37,427112,0.0-17.0-0.0,anomymised,656582dc9140dccdaa20d120,65671a3fe8694e8502f0f142,18872,1C,woman,NA,null,M1 is being looked at by M3,look2,sentence,NA,NA,NA,NA
9801.5,NA,NA,NA,NA,survey-likert-extra-labels,38,436916,0.0-17.0-2.0,anomymised,656582dc9140dccdaa20d120,65671a3fe8694e8502f0f142,18872,1C,woman,NA,NA,M1 is being looked at by M3,look2,rating_volition,"{""Q0"":1}",[0],M1 wanted to look at M3,M3 wanted to look at M1
13331,NA,NA,NA,NA,survey-likert-extra-labels,39,450258,0.0-17.0-3.0-0.0,anomymised,656582dc9140dccdaa20d120,65671a3fe8694e8502f0f142,18872,1C,woman,NA,NA,M1 is being looked at by M3,look2,rating_causation,"{""Q0"":5}",[0],M1 looked at M3 first,M3 looked at M1 first
null,Mike is being looked at by Beth,NA,NA,NA,html-keyboard-response,40,452263,0.0-18.0-0.0,anomymised,656582dc9140dccdaa20d120,65671a3fe8694e8502f0f142,18872,1C,woman,NA,null,M2 is being looked at by W4,look4,sentence,NA,NA,NA,NA
6440.700000000186,NA,NA,NA,NA,survey-likert-extra-labels,41,458706,0.0-18.0-2.0,anomymised,656582dc9140dccdaa20d120,65671a3fe8694e8502f0f142,18872,1C,woman,NA,NA,M2 is being looked at by W4,look4,rating_volition,"{""Q0"":5}",[0],M2 wanted to look at W4,W4 wanted to look at M2
10092.40000000014,NA,NA,NA,NA,survey-likert-extra-labels,42,468804,0.0-18.0-3.0-0.0,anomymised,656582dc9140dccdaa20d120,65671a3fe8694e8502f0f142,18872,1C,woman,NA,NA,M2 is being looked at by W4,look4,rating_causation,"{""Q0"":3}",[0],M2 looked at W4 first,W4 looked at M2 first
null,Dave is being hugged by Jane,NA,NA,NA,html-keyboard-response,43,470816,0.0-19.0-0.0,anomymised,656582dc9140dccdaa20d120,65671a3fe8694e8502f0f142,18872,1C,woman,NA,null,M4 is being hugged by W2,hug3,sentence,NA,NA,NA,NA
10794.200000000186,NA,NA,NA,NA,survey-likert-extra-labels,44,481613,0.0-19.0-2.0,anomymised,656582dc9140dccdaa20d120,65671a3fe8694e8502f0f142,18872,1C,woman,NA,NA,M4 is being hugged by W2,hug3,rating_volition,"{""Q0"":2}",[0],W2 wanted to hug M4,M4 wanted to hug W2
14842.90000000014,NA,NA,NA,NA,survey-likert-extra-labels,45,496469,0.0-19.0-3.0-0.0,anomymised,656582dc9140dccdaa20d120,65671a3fe8694e8502f0f142,18872,1C,woman,NA,NA,M4 is being hugged by W2,hug3,rating_causation,"{""Q0"":2}",[0],W2 asked to hug M4,M4 asked to hug W2
null,Kate is being hugged by Ruth,NA,NA,NA,html-keyboard-response,46,498478,0.0-20.0-0.0,anomymised,656582dc9140dccdaa20d120,65671a3fe8694e8502f0f142,18872,1C,woman,NA,null,W3 is being hugged by W1,hug1,sentence,NA,NA,NA,NA
15291.5,NA,NA,NA,NA,survey-likert-extra-labels,47,513774,0.0-20.0-2.0,anomymised,656582dc9140dccdaa20d120,65671a3fe8694e8502f0f142,18872,1C,woman,NA,NA,W3 is being hugged by W1,hug1,rating_volition,"{""Q0"":2}",[0],W1 wanted to hug W3,W3 wanted to hug W1
25388.100000000093,NA,NA,NA,NA,survey-likert-extra-labels,48,539172,0.0-20.0-3.0-0.0,anomymised,656582dc9140dccdaa20d120,65671a3fe8694e8502f0f142,18872,1C,woman,NA,NA,W3 is being hugged by W1,hug1,rating_causation,"{""Q0"":1}",[0],W1 asked to hug W3,W3 asked to hug W1
null,Jane is being copied by Beth,NA,NA,NA,html-keyboard-response,49,541183,0.0-21.0-0.0,anomymised,656582dc9140dccdaa20d120,65671a3fe8694e8502f0f142,18872,1C,woman,NA,null,W2 is being copied by W4,copy1,sentence,NA,NA,NA,NA
22546.800000000047,NA,NA,NA,NA,survey-likert-extra-labels,50,563732,0.0-21.0-1.0-0.0,anomymised,656582dc9140dccdaa20d120,65671a3fe8694e8502f0f142,18872,1C,woman,NA,NA,W2 is being copied by W4,copy1,rating_causation,"{""Q0"":4}",[0],W2 started copying W4 first,W4 started copying W2 first
10573.399999999907,NA,NA,NA,NA,survey-likert-extra-labels,51,574316,0.0-21.0-2.0,anomymised,656582dc9140dccdaa20d120,65671a3fe8694e8502f0f142,18872,1C,woman,NA,NA,W2 is being copied by W4,copy1,rating_volition,"{""Q0"":5}",[0],W2 wanted to copy W4,W4 wanted to copy W2
null,Dave is being opposed by Jane,NA,NA,NA,html-keyboard-response,52,576322,0.0-22.0-0.0,anomymised,656582dc9140dccdaa20d120,65671a3fe8694e8502f0f142,18872,1C,woman,NA,null,M4 is being opposed by W2,oppose3,sentence,NA,NA,NA,NA
15806.59999999986,NA,NA,NA,NA,survey-likert-extra-labels,53,592130,0.0-22.0-2.0,anomymised,656582dc9140dccdaa20d120,65671a3fe8694e8502f0f142,18872,1C,woman,NA,NA,M4 is being opposed by W2,oppose3,rating_volition,"{""Q0"":1}",[0],W2 wanted to oppose M4,M4 wanted to oppose W2
9382.5,NA,NA,NA,NA,survey-likert-extra-labels,54,601516,0.0-22.0-3.0-0.0,anomymised,656582dc9140dccdaa20d120,65671a3fe8694e8502f0f142,18872,1C,woman,NA,NA,M4 is being opposed by W2,oppose3,rating_causation,"{""Q0"":0}",[0],W2 started opposing M4,M4 started opposing W2
null,Dave is being challenged by Mike,NA,NA,NA,html-keyboard-response,55,603526,0.0-23.0-0.0,anomymised,656582dc9140dccdaa20d120,65671a3fe8694e8502f0f142,18872,1C,woman,NA,null,M4 is being challenged by M2,challenge2,sentence,NA,NA,NA,NA
6841.600000000093,NA,NA,NA,NA,survey-likert-extra-labels,56,610370,0.0-23.0-1.0-0.0,anomymised,656582dc9140dccdaa20d120,65671a3fe8694e8502f0f142,18872,1C,woman,NA,NA,M4 is being challenged by M2,challenge2,rating_causation,"{""Q0"":1}",[0],M2 started challenging M4 first,M4 started challenging M2 first
5686.300000000047,NA,NA,NA,NA,survey-likert-extra-labels,57,616061,0.0-23.0-2.0,anomymised,656582dc9140dccdaa20d120,65671a3fe8694e8502f0f142,18872,1C,woman,NA,NA,M4 is being challenged by M2,challenge2,rating_volition,"{""Q0"":0}",[0],M2 wanted to challenge M4,M4 wanted to challenge M2
null,Ruth is chasing Kate,NA,NA,NA,html-keyboard-response,58,618071,0.0-24.0-0.0,anomymised,656582dc9140dccdaa20d120,65671a3fe8694e8502f0f142,18872,1C,woman,NA,null,W1 is chasing W3,chase,sentence,NA,NA,NA,NA
10026.40000000014,NA,NA,NA,NA,survey-likert-extra-labels,59,628100,0.0-24.0-2.0,anomymised,656582dc9140dccdaa20d120,65671a3fe8694e8502f0f142,18872,1C,woman,NA,NA,W1 is chasing W3,chase,rating_volition,"{""Q0"":0}",[0],W1 is behind W3,W3 is behind W1
11221.799999999814,NA,NA,NA,NA,survey-likert-extra-labels,60,639332,0.0-24.0-3.0-0.0,anomymised,656582dc9140dccdaa20d120,65671a3fe8694e8502f0f142,18872,1C,woman,NA,NA,W1 is chasing W3,chase,rating_causation,"{""Q0"":6}",[0],W1 is running away from W3,W3 is running away from W1
null,Beth is being challenged by Jane,NA,NA,NA,html-keyboard-response,61,641341,0.0-25.0-0.0,anomymised,656582dc9140dccdaa20d120,65671a3fe8694e8502f0f142,18872,1C,woman,NA,null,W4 is being challenged by W2,challenge1,sentence,NA,NA,NA,NA
19556.699999999953,NA,NA,NA,NA,survey-likert-extra-labels,62,660900,0.0-25.0-2.0,anomymised,656582dc9140dccdaa20d120,65671a3fe8694e8502f0f142,18872,1C,woman,NA,NA,W4 is being challenged by W2,challenge1,rating_volition,"{""Q0"":2}",[0],W2 wanted to challenge W4,W4 wanted to challenge W2
10758.40000000014,NA,NA,NA,NA,survey-likert-extra-labels,63,671669,0.0-25.0-3.0-0.0,anomymised,656582dc9140dccdaa20d120,65671a3fe8694e8502f0f142,18872,1C,woman,NA,NA,W4 is being challenged by W2,challenge1,rating_causation,"{""Q0"":0}",[0],W2 started challenging W4 first,W4 started challenging W2 first
null,Luke is being touched by Kate,NA,NA,NA,html-keyboard-response,64,673680,0.0-26.0-0.0,anomymised,656582dc9140dccdaa20d120,65671a3fe8694e8502f0f142,18872,1C,woman,NA,null,M1 is being touched by W3,touch3,sentence,NA,NA,NA,NA
11481,NA,NA,NA,NA,survey-likert-extra-labels,65,685165,0.0-26.0-2.0,anomymised,656582dc9140dccdaa20d120,65671a3fe8694e8502f0f142,18872,1C,woman,NA,NA,M1 is being touched by W3,touch3,rating_volition,"{""Q0"":1}",[0],W3 wanted to touch M1,M1 wanted to touch W3
4627.899999999907,NA,NA,NA,NA,survey-likert-extra-labels,66,689805,0.0-26.0-3.0-0.0,anomymised,656582dc9140dccdaa20d120,65671a3fe8694e8502f0f142,18872,1C,woman,NA,NA,M1 is being touched by W3,touch3,rating_causation,"{""Q0"":""""}",[0],W3 asked to touch M1,M1 asked to touch W3
null,Luke is being challenged by Kate,NA,NA,NA,html-keyboard-response,67,691815,0.0-27.0-0.0,anomymised,656582dc9140dccdaa20d120,65671a3fe8694e8502f0f142,18872,1C,woman,NA,null,M1 is being challenged by W3,challenge4,sentence,NA,NA,NA,NA
14330.90000000014,NA,NA,NA,NA,survey-likert-extra-labels,68,706149,0.0-27.0-1.0-0.0,anomymised,656582dc9140dccdaa20d120,65671a3fe8694e8502f0f142,18872,1C,woman,NA,NA,M1 is being challenged by W3,challenge4,rating_causation,"{""Q0"":0}",[0],W3 started challenging M1 first,M1 started challenging W3 first
11684.100000000093,NA,NA,NA,NA,survey-likert-extra-labels,69,717844,0.0-27.0-2.0,anomymised,656582dc9140dccdaa20d120,65671a3fe8694e8502f0f142,18872,1C,woman,NA,NA,M1 is being challenged by W3,challenge4,rating_volition,"{""Q0"":0}",[0],W3 wanted to challenge M1,M1 wanted to challenge W3
null,Kate is being copied by Luke,NA,NA,NA,html-keyboard-response,70,719853,0.0-28.0-0.0,anomymised,656582dc9140dccdaa20d120,65671a3fe8694e8502f0f142,18872,1C,woman,NA,null,W3 is being copied by M1,copy3,sentence,NA,NA,NA,NA
14652.100000000093,NA,NA,NA,NA,survey-likert-extra-labels,71,734508,0.0-28.0-2.0,anomymised,656582dc9140dccdaa20d120,65671a3fe8694e8502f0f142,18872,1C,woman,NA,NA,W3 is being copied by M1,copy3,rating_volition,"{""Q0"":6}",[0],W3 wanted to copy M1,M1 wanted to copy W3
7972.40000000014,NA,NA,NA,NA,survey-likert-extra-labels,72,742490,0.0-28.0-3.0-0.0,anomymised,656582dc9140dccdaa20d120,65671a3fe8694e8502f0f142,18872,1C,woman,NA,NA,W3 is being copied by M1,copy3,rating_causation,"{""Q0"":6}",[0],W3 started copying M1 first,M1 started copying W3 first
null,Jane is being greeted by Beth,NA,NA,NA,html-keyboard-response,73,744494,0.0-29.0-0.0,anomymised,656582dc9140dccdaa20d120,65671a3fe8694e8502f0f142,18872,1C,woman,NA,null,W2 is being greeted by W4,greet1,sentence,NA,NA,NA,NA
10816.40000000014,NA,NA,NA,NA,survey-likert-extra-labels,74,755316,0.0-29.0-2.0,anomymised,656582dc9140dccdaa20d120,65671a3fe8694e8502f0f142,18872,1C,woman,NA,NA,W2 is being greeted by W4,greet1,rating_volition,"{""Q0"":5}",[0],W2 wanted to greet W4,W4 wanted to greet W2
5358,NA,NA,NA,NA,survey-likert-extra-labels,75,760684,0.0-29.0-3.0-0.0,anomymised,656582dc9140dccdaa20d120,65671a3fe8694e8502f0f142,18872,1C,woman,NA,NA,W2 is being greeted by W4,greet1,rating_causation,"{""Q0"":6}",[0],W2 started greeting W4 first,W4 started greeting W2 first
null,Dave is being shouted at by Jane,NA,NA,NA,html-keyboard-response,76,762693,0.0-30.0-0.0,anomymised,656582dc9140dccdaa20d120,65671a3fe8694e8502f0f142,18872,1C,woman,NA,null,M4 is being shouted at by W2,shout4,sentence,NA,NA,NA,NA
11830,NA,NA,NA,NA,survey-likert-extra-labels,77,774526,0.0-30.0-1.0-0.0,anomymised,656582dc9140dccdaa20d120,65671a3fe8694e8502f0f142,18872,1C,woman,NA,NA,M4 is being shouted at by W2,shout4,rating_causation,"{""Q0"":1}",[0],W2 shouted at M4 first,M4 shouted at W2 first
6890.399999999907,NA,NA,NA,NA,survey-likert-extra-labels,78,781429,0.0-30.0-2.0,anomymised,656582dc9140dccdaa20d120,65671a3fe8694e8502f0f142,18872,1C,woman,NA,NA,M4 is being shouted at by W2,shout4,rating_volition,"{""Q0"":0}",[0],W2 wanted to shout at M4,M4 wanted to shout at W2
null,Jane is teaching Dave,NA,NA,NA,html-keyboard-response,79,783442,0.0-31.0-0.0,anomymised,656582dc9140dccdaa20d120,65671a3fe8694e8502f0f142,18872,1C,woman,NA,null,W2 is teaching M4,teach,sentence,NA,NA,NA,NA
7727.600000000093,NA,NA,NA,NA,survey-likert-extra-labels,80,791172,0.0-31.0-1.0-0.0,anomymised,656582dc9140dccdaa20d120,65671a3fe8694e8502f0f142,18872,1C,woman,NA,NA,W2 is teaching M4,teach,rating_causation,"{""Q0"":6}",[0],W2 is learning from M4,M4 is learning from W2
8878.5,NA,NA,NA,NA,survey-likert-extra-labels,81,800060,0.0-31.0-2.0,anomymised,656582dc9140dccdaa20d120,65671a3fe8694e8502f0f142,18872,1C,woman,NA,NA,W2 is teaching M4,teach,rating_volition,"{""Q0"":0}",[0],W2 is educating M4,M4 is educating W2
null,Beth is being shouted at by Mike,NA,NA,NA,html-keyboard-response,82,802069,0.0-32.0-0.0,anomymised,656582dc9140dccdaa20d120,65671a3fe8694e8502f0f142,18872,1C,woman,NA,null,W4 is being shouted at by M2,shout3,sentence,NA,NA,NA,NA
14356.300000000047,NA,NA,NA,NA,survey-likert-extra-labels,83,816429,0.0-32.0-2.0,anomymised,656582dc9140dccdaa20d120,65671a3fe8694e8502f0f142,18872,1C,woman,NA,NA,W4 is being shouted at by M2,shout3,rating_volition,"{""Q0"":1}",[0],M2 wanted to shout at W4,W4 wanted to shout at M2
11058.399999999907,NA,NA,NA,NA,survey-likert-extra-labels,84,827498,0.0-32.0-3.0-0.0,anomymised,656582dc9140dccdaa20d120,65671a3fe8694e8502f0f142,18872,1C,woman,NA,NA,W4 is being shouted at by M2,shout3,rating_causation,"{""Q0"":0}",[0],M2 shouted at W4 first,W4 shouted at M2 first
null,Ruth is being kissed by Kate,NA,NA,NA,html-keyboard-response,85,829502,0.0-33.0-0.0,anomymised,656582dc9140dccdaa20d120,65671a3fe8694e8502f0f142,18872,1C,woman,NA,null,W1 is being kissed by W3,kiss1,sentence,NA,NA,NA,NA
8716,NA,NA,NA,NA,survey-likert-extra-labels,86,838221,0.0-33.0-2.0,anomymised,656582dc9140dccdaa20d120,65671a3fe8694e8502f0f142,18872,1C,woman,NA,NA,W1 is being kissed by W3,kiss1,rating_volition,"{""Q0"":5}",[0],W1 wanted to kiss W3,W3 wanted to kiss W1
13956.699999999953,NA,NA,NA,NA,survey-likert-extra-labels,87,852189,0.0-33.0-3.0-0.0,anomymised,656582dc9140dccdaa20d120,65671a3fe8694e8502f0f142,18872,1C,woman,NA,NA,W1 is being kissed by W3,kiss1,rating_causation,"{""Q0"":4}",[0],W1 asked to kiss W3,W3 asked to kiss W1
null,Kate is being shouted at by Ruth,NA,NA,NA,html-keyboard-response,88,854199,0.0-34.0-0.0,anomymised,656582dc9140dccdaa20d120,65671a3fe8694e8502f0f142,18872,1C,woman,NA,null,W3 is being shouted at by W1,shout1,sentence,NA,NA,NA,NA
18162.40000000014,NA,NA,NA,NA,survey-likert-extra-labels,89,872366,0.0-34.0-1.0-0.0,anomymised,656582dc9140dccdaa20d120,65671a3fe8694e8502f0f142,18872,1C,woman,NA,NA,W3 is being shouted at by W1,shout1,rating_causation,"{""Q0"":2}",[0],W1 shouted at W3 first,W3 shouted at W1 first
9236.199999999953,NA,NA,NA,NA,survey-likert-extra-labels,90,881612,0.0-34.0-2.0,anomymised,656582dc9140dccdaa20d120,65671a3fe8694e8502f0f142,18872,1C,woman,NA,NA,W3 is being shouted at by W1,shout1,rating_volition,"{""Q0"":2}",[0],W1 wanted to shout at W3,W3 wanted to shout at W1
null,Mike is being greeted by Dave,NA,NA,NA,html-keyboard-response,91,883622,0.0-35.0-0.0,anomymised,656582dc9140dccdaa20d120,65671a3fe8694e8502f0f142,18872,1C,woman,NA,null,M2 is being greeted by M4,greet2,sentence,NA,NA,NA,NA
9749.09999999986,NA,NA,NA,NA,survey-likert-extra-labels,92,893374,0.0-35.0-1.0-0.0,anomymised,656582dc9140dccdaa20d120,65671a3fe8694e8502f0f142,18872,1C,woman,NA,NA,M2 is being greeted by M4,greet2,rating_causation,"{""Q0"":1}",[0],M2 started greeting M4 first,M4 started greeting M2 first
9860.600000000093,NA,NA,NA,NA,survey-likert-extra-labels,93,903245,0.0-35.0-2.0,anomymised,656582dc9140dccdaa20d120,65671a3fe8694e8502f0f142,18872,1C,woman,NA,NA,M2 is being greeted by M4,greet2,rating_volition,"{""Q0"":6}",[0],M2 wanted to greet M4,M4 wanted to greet M2
null,Fred is being greeted by Ruth,NA,NA,NA,html-keyboard-response,94,905257,0.0-36.0-0.0,anomymised,656582dc9140dccdaa20d120,65671a3fe8694e8502f0f142,18872,1C,woman,NA,null,M3 is being greeted by W1,greet3,sentence,NA,NA,NA,NA
18264.5,NA,NA,NA,NA,survey-likert-extra-labels,95,923526,0.0-36.0-1.0-0.0,anomymised,656582dc9140dccdaa20d120,65671a3fe8694e8502f0f142,18872,1C,woman,NA,NA,M3 is being greeted by W1,greet3,rating_causation,"{""Q0"":4}",[0],M3 started greeting W1 first,W1 started greeting M3 first
16028.699999999953,NA,NA,NA,NA,survey-likert-extra-labels,96,939564,0.0-36.0-2.0,anomymised,656582dc9140dccdaa20d120,65671a3fe8694e8502f0f142,18872,1C,woman,NA,NA,M3 is being greeted by W1,greet3,rating_volition,"{""Q0"":5}",[0],M3 wanted to greet W1,W1 wanted to greet M3
null,Fred is being hugged by Luke,NA,NA,NA,html-keyboard-response,97,941574,0.0-37.0-0.0,anomymised,656582dc9140dccdaa20d120,65671a3fe8694e8502f0f142,18872,1C,woman,NA,null,M3 is being hugged by M1,hug2,sentence,NA,NA,NA,NA
13659.40000000014,NA,NA,NA,NA,survey-likert-extra-labels,98,955237,0.0-37.0-1.0-0.0,anomymised,656582dc9140dccdaa20d120,65671a3fe8694e8502f0f142,18872,1C,woman,NA,NA,M3 is being hugged by M1,hug2,rating_causation,"{""Q0"":3}",[0],M1 asked to hug M3,M3 asked to hug M1
