rt,stimulus,button_pressed,choices,ChosenStimulus,trial_type,trial_index,time_elapsed,internal_node_id,subject_id,study_id,session_id,subject,list,ppt_gender,url,key_press,sentence_type,verb,test_part,responses,question_order,left_part,right_part
1879.1000000014901,NA,NA,NA,NA,survey-likert-extra-labels,99,454938,0.0-37.0-2.0,anomymised,65658117cda9c2da75aaa191,656609e034b7ff4f1a017d8e,92743,2A,man,NA,NA,M1 is being opposed by M3,oppose2,rating_volition,"{""Q0"":3}",[0],M1 wanted to oppose M3,M3 wanted to oppose M1
null,Fred is being copied by Jane,NA,NA,NA,html-keyboard-response,100,456941,0.0-38.0-0.0,anomymised,65658117cda9c2da75aaa191,656609e034b7ff4f1a017d8e,92743,2A,man,NA,null,M1 is being copied by W3,copy3,sentence,NA,NA,NA,NA
5318.900000002235,NA,NA,NA,NA,survey-likert-extra-labels,101,462260,0.0-38.0-2.0,anomymised,65658117cda9c2da75aaa191,656609e034b7ff4f1a017d8e,92743,2A,man,NA,NA,M1 is being copied by W3,copy3,rating_volition,"{""Q0"":0}",[0],W3 wanted to copy M1,M1 wanted to copy W3
2657.5,NA,NA,NA,NA,survey-likert-extra-labels,102,464919,0.0-38.0-3.0-0.0,anomymised,65658117cda9c2da75aaa191,656609e034b7ff4f1a017d8e,92743,2A,man,NA,NA,M1 is being copied by W3,copy3,rating_causation,"{""Q0"":1}",[0],W3 started copying M1 first,M1 started copying W3 first
null,Kate is being seduced by Ruth,NA,NA,NA,html-keyboard-response,103,466921,0.0-39.0-0.0,anomymised,65658117cda9c2da75aaa191,656609e034b7ff4f1a017d8e,92743,2A,man,NA,null,W2 is being seduced by W4,seduce1,sentence,NA,NA,NA,NA
3680.900000002235,NA,NA,NA,NA,survey-likert-extra-labels,104,470603,0.0-39.0-2.0,anomymised,65658117cda9c2da75aaa191,656609e034b7ff4f1a017d8e,92743,2A,man,NA,NA,W2 is being seduced by W4,seduce1,rating_volition,"{""Q0"":6}",[0],W2 wanted to seduce W4,W4 wanted to seduce W2
2509,NA,NA,NA,NA,survey-likert-extra-labels,105,473113,0.0-39.0-3.0-0.0,anomymised,65658117cda9c2da75aaa191,656609e034b7ff4f1a017d8e,92743,2A,man,NA,NA,W2 is being seduced by W4,seduce1,rating_causation,"{""Q0"":5}",[0],W2 started seducing W4 first,W4 started seducing W2 first
null,Dave is being touched by Mike,NA,NA,NA,html-keyboard-response,106,475267,0.0-40.0-0.0,anomymised,65658117cda9c2da75aaa191,656609e034b7ff4f1a017d8e,92743,2A,man,NA,null,M2 is being touched by M4,touch2,sentence,NA,NA,NA,NA
5599.5,NA,NA,NA,NA,survey-likert-extra-labels,107,480867,0.0-40.0-2.0,anomymised,65658117cda9c2da75aaa191,656609e034b7ff4f1a017d8e,92743,2A,man,NA,NA,M2 is being touched by M4,touch2,rating_volition,"{""Q0"":6}",[0],M2 wanted to touch M4,M4 wanted to touch M2
2307.7000000029802,NA,NA,NA,NA,survey-likert-extra-labels,108,483176,0.0-40.0-3.0-0.0,anomymised,65658117cda9c2da75aaa191,656609e034b7ff4f1a017d8e,92743,2A,man,NA,NA,M2 is being touched by M4,touch2,rating_causation,"{""Q0"":3}",[0],M2 asked to touch M4,M4 asked to touch M2
null,Ruth is being kissed by Dave,NA,NA,NA,html-keyboard-response,109,485178,0.0-41.0-0.0,anomymised,65658117cda9c2da75aaa191,656609e034b7ff4f1a017d8e,92743,2A,man,NA,null,W4 is being kissed by M2,kiss3,sentence,NA,NA,NA,NA
3560.599999997765,NA,NA,NA,NA,survey-likert-extra-labels,110,488739,0.0-41.0-2.0,anomymised,65658117cda9c2da75aaa191,656609e034b7ff4f1a017d8e,92743,2A,man,NA,NA,W4 is being kissed by M2,kiss3,rating_volition,"{""Q0"":0}",[0],M2 wanted to kiss W4,W4 wanted to kiss M2
1735,NA,NA,NA,NA,survey-likert-extra-labels,111,490475,0.0-41.0-3.0-0.0,anomymised,65658117cda9c2da75aaa191,656609e034b7ff4f1a017d8e,92743,2A,man,NA,NA,W4 is being kissed by M2,kiss3,rating_causation,"{""Q0"":3}",[0],M2 asked to kiss W4,W4 asked to kiss M2
null,Kate is being opposed by Mike,NA,NA,NA,html-keyboard-response,112,492476,0.0-42.0-0.0,anomymised,65658117cda9c2da75aaa191,656609e034b7ff4f1a017d8e,92743,2A,man,NA,null,W2 is being opposed by M4,oppose3,sentence,NA,NA,NA,NA
3255.10000000149,NA,NA,NA,NA,survey-likert-extra-labels,113,495732,0.0-42.0-1.0-0.0,anomymised,65658117cda9c2da75aaa191,656609e034b7ff4f1a017d8e,92743,2A,man,NA,NA,W2 is being opposed by M4,oppose3,rating_causation,"{""Q0"":6}",[0],W2 started opposing M4,M4 started opposing W2
1833.8999999985099,NA,NA,NA,NA,survey-likert-extra-labels,114,497567,0.0-42.0-2.0,anomymised,65658117cda9c2da75aaa191,656609e034b7ff4f1a017d8e,92743,2A,man,NA,NA,W2 is being opposed by M4,oppose3,rating_volition,"{""Q0"":3}",[0],W2 wanted to oppose M4,M4 wanted to oppose W2
null,Luke is hiring Beth,NA,NA,NA,html-keyboard-response,115,499569,0.0-43.0-0.0,anomymised,65658117cda9c2da75aaa191,656609e034b7ff4f1a017d8e,92743,2A,man,NA,null,M3 is hiring W1,hire,sentence,NA,NA,NA,NA
2726.39999999851,NA,NA,NA,NA,survey-likert-extra-labels,116,502296,0.0-43.0-1.0-0.0,anomymised,65658117cda9c2da75aaa191,656609e034b7ff4f1a017d8e,92743,2A,man,NA,NA,M3 is hiring W1,hire,rating_causation,"{""Q0"":6}",[0],M3 will work for W1,W1 will work for M3
3288.10000000149,NA,NA,NA,NA,survey-likert-extra-labels,117,505585,0.0-43.0-2.0,anomymised,65658117cda9c2da75aaa191,656609e034b7ff4f1a017d8e,92743,2A,man,NA,NA,M3 is hiring W1,hire,rating_volition,"{""Q0"":0}",[0],M3 is employing W1,W1 is employing M3
null,Kate is teaching Mike,NA,NA,NA,html-keyboard-response,118,507587,0.0-44.0-0.0,anomymised,65658117cda9c2da75aaa191,656609e034b7ff4f1a017d8e,92743,2A,man,NA,null,W2 is teaching M4,teach,sentence,NA,NA,NA,NA
2347.5,NA,NA,NA,NA,survey-likert-extra-labels,119,509935,0.0-44.0-1.0-0.0,anomymised,65658117cda9c2da75aaa191,656609e034b7ff4f1a017d8e,92743,2A,man,NA,NA,W2 is teaching M4,teach,rating_causation,"{""Q0"":6}",[0],W2 is learning from M4,M4 is learning from W2
1581.0999999977648,NA,NA,NA,NA,survey-likert-extra-labels,120,511517,0.0-44.0-2.0,anomymised,65658117cda9c2da75aaa191,656609e034b7ff4f1a017d8e,92743,2A,man,NA,NA,W2 is teaching M4,teach,rating_volition,"{""Q0"":0}",[0],W2 is educating M4,M4 is educating W2
null,Fred is driving Luke,NA,NA,NA,html-keyboard-response,121,513527,0.0-45.0-0.0,anomymised,65658117cda9c2da75aaa191,656609e034b7ff4f1a017d8e,92743,2A,man,NA,null,M1 is driving M3,drive,sentence,NA,NA,NA,NA
3953.39999999851,NA,NA,NA,NA,survey-likert-extra-labels,122,517481,0.0-45.0-1.0-0.0,anomymised,65658117cda9c2da75aaa191,656609e034b7ff4f1a017d8e,92743,2A,man,NA,NA,M1 is driving M3,drive,rating_causation,"{""Q0"":0}",[0],M1 is taking M3 somewhere,M3 is taking M1 somewhere
3845.099999997765,NA,NA,NA,NA,survey-likert-extra-labels,123,521327,0.0-45.0-2.0,anomymised,65658117cda9c2da75aaa191,656609e034b7ff4f1a017d8e,92743,2A,man,NA,NA,M1 is driving M3,drive,rating_volition,"{""Q0"":6}",[0],M1 is M3's passenger,M3 is M1's passenger
null,Beth is chasing Jane,NA,NA,NA,html-keyboard-response,124,523329,0.0-46.0-0.0,anomymised,65658117cda9c2da75aaa191,656609e034b7ff4f1a017d8e,92743,2A,man,NA,null,W1 is chasing W3,chase,sentence,NA,NA,NA,NA
4748.800000000745,NA,NA,NA,NA,survey-likert-extra-labels,125,528078,0.0-46.0-2.0,anomymised,65658117cda9c2da75aaa191,656609e034b7ff4f1a017d8e,92743,2A,man,NA,NA,W1 is chasing W3,chase,rating_volition,"{""Q0"":0}",[0],W1 is behind W3,W3 is behind W1
3844.7000000029802,NA,NA,NA,NA,survey-likert-extra-labels,126,531924,0.0-46.0-3.0-0.0,anomymised,65658117cda9c2da75aaa191,656609e034b7ff4f1a017d8e,92743,2A,man,NA,NA,W1 is chasing W3,chase,rating_causation,"{""Q0"":6}",[0],W1 is running away from W3,W3 is running away from W1
null,Fred is being hugged by Luke,NA,NA,NA,html-keyboard-response,127,533926,0.0-47.0-0.0,anomymised,65658117cda9c2da75aaa191,656609e034b7ff4f1a017d8e,92743,2A,man,NA,null,M1 is being hugged by M3,hug2,sentence,NA,NA,NA,NA
3881.39999999851,NA,NA,NA,NA,survey-likert-extra-labels,128,537808,0.0-47.0-1.0-0.0,anomymised,65658117cda9c2da75aaa191,656609e034b7ff4f1a017d8e,92743,2A,man,NA,NA,M1 is being hugged by M3,hug2,rating_causation,"{""Q0"":3}",[0],M1 asked to hug M3,M3 asked to hug M1
2513.900000002235,NA,NA,NA,NA,survey-likert-extra-labels,129,540323,0.0-47.0-2.0,anomymised,65658117cda9c2da75aaa191,656609e034b7ff4f1a017d8e,92743,2A,man,NA,NA,M1 is being hugged by M3,hug2,rating_volition,"{""Q0"":3}",[0],M1 wanted to hug M3,M3 wanted to hug M1
null,Luke is being kissed by Fred,NA,NA,NA,html-keyboard-response,130,542325,0.0-48.0-0.0,anomymised,65658117cda9c2da75aaa191,656609e034b7ff4f1a017d8e,92743,2A,man,NA,null,M3 is being kissed by M1,kiss2,sentence,NA,NA,NA,NA
3015.5,NA,NA,NA,NA,survey-likert-extra-labels,131,545341,0.0-48.0-1.0-0.0,anomymised,65658117cda9c2da75aaa191,656609e034b7ff4f1a017d8e,92743,2A,man,NA,NA,M3 is being kissed by M1,kiss2,rating_causation,"{""Q0"":3}",[0],M1 asked to kiss M3,M3 asked to kiss M1
2210.900000002235,NA,NA,NA,NA,survey-likert-extra-labels,132,547553,0.0-48.0-2.0,anomymised,65658117cda9c2da75aaa191,656609e034b7ff4f1a017d8e,92743,2A,man,NA,NA,M3 is being kissed by M1,kiss2,rating_volition,"{""Q0"":3}",[0],M1 wanted to kiss M3,M3 wanted to kiss M1
null,Fred is being greeted by Jane,NA,NA,NA,html-keyboard-response,133,549554,0.0-49.0-0.0,anomymised,65658117cda9c2da75aaa191,656609e034b7ff4f1a017d8e,92743,2A,man,NA,null,M1 is being greeted by W3,greet4,sentence,NA,NA,NA,NA
6058.10000000149,NA,NA,NA,NA,survey-likert-extra-labels,134,555613,0.0-49.0-2.0,anomymised,65658117cda9c2da75aaa191,656609e034b7ff4f1a017d8e,92743,2A,man,NA,NA,M1 is being greeted by W3,greet4,rating_volition,"{""Q0"":1}",[0],W3 wanted to greet M1,M1 wanted to greet W3
2403.60000000149,NA,NA,NA,NA,survey-likert-extra-labels,135,558018,0.0-49.0-3.0-0.0,anomymised,65658117cda9c2da75aaa191,656609e034b7ff4f1a017d8e,92743,2A,man,NA,NA,M1 is being greeted by W3,greet4,rating_causation,"{""Q0"":0}",[0],W3 started greeting M1 first,M1 started greeting W3 first
null,Kate is being touched by Ruth,NA,NA,NA,html-keyboard-response,136,560020,0.0-50.0-0.0,anomymised,65658117cda9c2da75aaa191,656609e034b7ff4f1a017d8e,92743,2A,man,NA,null,W2 is being touched by W4,touch1,sentence,NA,NA,NA,NA
3506.60000000149,NA,NA,NA,NA,survey-likert-extra-labels,137,563527,0.0-50.0-2.0,anomymised,65658117cda9c2da75aaa191,656609e034b7ff4f1a017d8e,92743,2A,man,NA,NA,W2 is being touched by W4,touch1,rating_volition,"{""Q0"":5}",[0],W2 wanted to touch W4,W4 wanted to touch W2
2105.900000002235,NA,NA,NA,NA,survey-likert-extra-labels,138,565634,0.0-50.0-3.0-0.0,anomymised,65658117cda9c2da75aaa191,656609e034b7ff4f1a017d8e,92743,2A,man,NA,NA,W2 is being touched by W4,touch1,rating_causation,"{""Q0"":3}",[0],W2 asked to touch W4,W4 asked to touch W2
null,Mike is being greeted by Dave,NA,NA,NA,html-keyboard-response,139,567636,0.0-51.0-0.0,anomymised,65658117cda9c2da75aaa191,656609e034b7ff4f1a017d8e,92743,2A,man,NA,null,M4 is being greeted by M2,greet2,sentence,NA,NA,NA,NA
3023.599999997765,NA,NA,NA,NA,survey-likert-extra-labels,140,570660,0.0-51.0-1.0-0.0,anomymised,65658117cda9c2da75aaa191,656609e034b7ff4f1a017d8e,92743,2A,man,NA,NA,M4 is being greeted by M2,greet2,rating_causation,"{""Q0"":0}",[0],M2 started greeting M4 first,M4 started greeting M2 first
4007.10000000149,NA,NA,NA,NA,survey-likert-extra-labels,141,574668,0.0-51.0-2.0,anomymised,65658117cda9c2da75aaa191,656609e034b7ff4f1a017d8e,92743,2A,man,NA,NA,M4 is being greeted by M2,greet2,rating_volition,"{""Q0"":""""}",[0],M2 wanted to greet M4,M4 wanted to greet M2
null,Jane is being seduced by Fred,NA,NA,NA,html-keyboard-response,142,576671,0.0-52.0-0.0,anomymised,65658117cda9c2da75aaa191,656609e034b7ff4f1a017d8e,92743,2A,man,NA,null,W3 is being seduced by M1,seduce3,sentence,NA,NA,NA,NA
5279.699999999255,NA,NA,NA,NA,survey-likert-extra-labels,143,581951,0.0-52.0-1.0-0.0,anomymised,65658117cda9c2da75aaa191,656609e034b7ff4f1a017d8e,92743,2A,man,NA,NA,W3 is being seduced by M1,seduce3,rating_causation,"{""Q0"":5}",[0],W3 started seducing M1 first,M1 started seducing W3 first
1415.800000000745,NA,NA,NA,NA,survey-likert-extra-labels,144,583368,0.0-52.0-2.0,anomymised,65658117cda9c2da75aaa191,656609e034b7ff4f1a017d8e,92743,2A,man,NA,NA,W3 is being seduced by M1,seduce3,rating_volition,"{""Q0"":5}",[0],W3 wanted to seduce M1,M1 wanted to seduce W3
null,Kate is being hugged by Mike,NA,NA,NA,html-keyboard-response,145,585370,0.0-53.0-0.0,anomymised,65658117cda9c2da75aaa191,656609e034b7ff4f1a017d8e,92743,2A,man,NA,null,W2 is being hugged by M4,hug3,sentence,NA,NA,NA,NA
3554.699999999255,NA,NA,NA,NA,survey-likert-extra-labels,146,588925,0.0-53.0-1.0-0.0,anomymised,65658117cda9c2da75aaa191,656609e034b7ff4f1a017d8e,92743,2A,man,NA,NA,W2 is being hugged by M4,hug3,rating_causation,"{""Q0"":3}",[0],W2 asked to hug M4,M4 asked to hug W2
876.1999999992549,NA,NA,NA,NA,survey-likert-extra-labels,147,589802,0.0-53.0-2.0,anomymised,65658117cda9c2da75aaa191,656609e034b7ff4f1a017d8e,92743,2A,man,NA,NA,W2 is being hugged by M4,hug3,rating_volition,"{""Q0"":3}",[0],W2 wanted to hug M4,M4 wanted to hug W2
null,Jane is being touched by Fred,NA,NA,NA,html-keyboard-response,148,591804,0.0-54.0-0.0,anomymised,65658117cda9c2da75aaa191,656609e034b7ff4f1a017d8e,92743,2A,man,NA,null,W3 is being touched by M1,touch3,sentence,NA,NA,NA,NA
4832.400000002235,NA,NA,NA,NA,survey-likert-extra-labels,149,596637,0.0-54.0-2.0,anomymised,65658117cda9c2da75aaa191,656609e034b7ff4f1a017d8e,92743,2A,man,NA,NA,W3 is being touched by M1,touch3,rating_volition,"{""Q0"":5}",[0],W3 wanted to touch M1,M1 wanted to touch W3
917.8999999985099,NA,NA,NA,NA,survey-likert-extra-labels,150,597556,0.0-54.0-3.0-0.0,anomymised,65658117cda9c2da75aaa191,656609e034b7ff4f1a017d8e,92743,2A,man,NA,NA,W3 is being touched by M1,touch3,rating_causation,"{""Q0"":3}",[0],W3 asked to touch M1,M1 asked to touch W3
1455.8999999985099,<p>Thank you for completing that task.</p><p>The final part of this session is a short questionnaire.</p><p>Press Continue.</p>,0,Continue,Continue,html-button-response,151,599013,0.0-55.0,anomymised,65658117cda9c2da75aaa191,656609e034b7ff4f1a017d8e,92743,2A,man,NA,NA,NA,NA,NA,NA,NA,NA,NA
21230.89999999851,NA,NA,NA,NA,survey-text,152,621249,0.0-56.0,anomymised,65658117cda9c2da75aaa191,656609e034b7ff4f1a017d8e,92743,2A,man,NA,NA,NA,NA,demographics,"{""Q0"":""32"",""Q1"":""English"",""Q2"":""English"",""Q3"":""UK"",""Q4"":""British"",""Q5"":""Asian British"",""Q6"":""Male""}",NA,NA,NA
3415.699999999255,<p>This is the last question - thank you for taking part! Have you lived in the UK for the last 5 years or more?</p>,0,"Yes,No",Yes,html-button-response,153,624666,0.0-57.0,anomymised,65658117cda9c2da75aaa191,656609e034b7ff4f1a017d8e,92743,2A,man,NA,NA,NA,NA,fiveyears,NA,NA,NA,NA
