rt,stimulus,button_pressed,choices,ChosenStimulus,trial_type,trial_index,time_elapsed,internal_node_id,subject_id,study_id,session_id,subject,list,ppt_gender,url,key_press,sentence_type,verb,test_part,responses,question_order,left_part,right_part
1563.9000000022352,Welcome to the experiment. Press Continue to begin.,0,Continue,Continue,html-button-response,0,1566,0.0-0.0,anomymised,65658117cda9c2da75aaa191,656609e034b7ff4f1a017d8e,92743,2A,man,NA,NA,NA,NA,NA,NA,NA,NA,NA
7874.5,NA,NA,NA,NA,external-html,1,10468,0.0-1.0,anomymised,65658117cda9c2da75aaa191,656609e034b7ff4f1a017d8e,92743,2A,man,consent.html,NA,NA,NA,NA,NA,NA,NA,NA
3950.800000000745,"<p>Welcome.</p><p>In this experiment we will ask you to imagine some situations.</p><p>Each trial starts with a description of an event.</p><p>Then you will see alternative descriptions of that event, and you will rate on a scale how best they match the original description.</p><p>You will give your answer by clicking a button on a rating scale.</p><p>To do this task, you will have to use your imagination to visualise these events.</p><br><p>Ready?</p>",0,Continue,Continue,html-button-response,2,14419,0.0-2.0,anomymised,65658117cda9c2da75aaa191,656609e034b7ff4f1a017d8e,92743,2A,man,NA,NA,NA,NA,NA,NA,NA,NA,NA
40552.5,"<p>Before the experiment starts, you will watch an example trial. Press 'Continue'.</p>",0,Continue,Continue,html-button-response,3,55974,0.0-3.0,anomymised,65658117cda9c2da75aaa191,656609e034b7ff4f1a017d8e,92743,2A,man,NA,NA,NA,NA,NA,NA,NA,NA,NA
null,The police officer is arresting the robber,NA,NA,NA,html-keyboard-response,4,58977,0.0-4.0,anomymised,65658117cda9c2da75aaa191,656609e034b7ff4f1a017d8e,92743,2A,man,NA,null,NA,NA,NA,NA,NA,NA,NA
55980,<img src='img/Example-trial.jpg' style='height:550px;''></img>,0,Continue,Continue,html-button-response,5,114958,0.0-5.0,anomymised,65658117cda9c2da75aaa191,656609e034b7ff4f1a017d8e,92743,2A,man,NA,NA,NA,NA,NA,NA,NA,NA,NA
1781.800000000745,<p>Ready to start the experiment?</p><br><p><strong>Remember to give an answer by clicking a button on the rating scale.</strong></p><p>Press 'Continue' to begin.</p>,0,Continue,Continue,html-button-response,6,117742,0.0-6.0,anomymised,65658117cda9c2da75aaa191,656609e034b7ff4f1a017d8e,92743,2A,man,NA,NA,NA,NA,NA,NA,NA,NA,NA
null,Luke is being challenged by Beth,NA,NA,NA,html-keyboard-response,7,120745,0.0-7.0-0.0,anomymised,65658117cda9c2da75aaa191,656609e034b7ff4f1a017d8e,92743,2A,man,NA,null,M3 is being challenged by W1,challenge3,sentence,NA,NA,NA,NA
6923.39999999851,NA,NA,NA,NA,survey-likert-extra-labels,8,127670,0.0-7.0-2.0,anomymised,65658117cda9c2da75aaa191,656609e034b7ff4f1a017d8e,92743,2A,man,NA,NA,M3 is being challenged by W1,challenge3,rating_volition,"{""Q0"":6}",[0],M3 wanted to challenge W1,W1 wanted to challenge M3
9920.70000000298,NA,NA,NA,NA,survey-likert-extra-labels,9,137592,0.0-7.0-3.0-0.0,anomymised,65658117cda9c2da75aaa191,656609e034b7ff4f1a017d8e,92743,2A,man,NA,NA,M3 is being challenged by W1,challenge3,rating_causation,"{""Q0"":6}",[0],M3 started challenging W1 first,W1 started challenging M3 first
null,Jane is being looked at by Beth,NA,NA,NA,html-keyboard-response,10,139594,0.0-8.0-0.0,anomymised,65658117cda9c2da75aaa191,656609e034b7ff4f1a017d8e,92743,2A,man,NA,null,W3 is being looked at by W1,look1,sentence,NA,NA,NA,NA
7578.199999999255,NA,NA,NA,NA,survey-likert-extra-labels,11,147173,0.0-8.0-2.0,anomymised,65658117cda9c2da75aaa191,656609e034b7ff4f1a017d8e,92743,2A,man,NA,NA,W3 is being looked at by W1,look1,rating_volition,"{""Q0"":0}",[0],W1 wanted to look at W3,W3 wanted to look at W1
4937.5,NA,NA,NA,NA,survey-likert-extra-labels,12,152112,0.0-8.0-3.0-0.0,anomymised,65658117cda9c2da75aaa191,656609e034b7ff4f1a017d8e,92743,2A,man,NA,NA,W3 is being looked at by W1,look1,rating_causation,"{""Q0"":0}",[0],W1 looked at W3 first,W3 looked at W1 first
null,Beth is being hugged by Jane,NA,NA,NA,html-keyboard-response,13,154114,0.0-9.0-0.0,anomymised,65658117cda9c2da75aaa191,656609e034b7ff4f1a017d8e,92743,2A,man,NA,null,W1 is being hugged by W3,hug1,sentence,NA,NA,NA,NA
3329.39999999851,NA,NA,NA,NA,survey-likert-extra-labels,14,157444,0.0-9.0-2.0,anomymised,65658117cda9c2da75aaa191,656609e034b7ff4f1a017d8e,92743,2A,man,NA,NA,W1 is being hugged by W3,hug1,rating_volition,"{""Q0"":6}",[0],W1 wanted to hug W3,W3 wanted to hug W1
6091.10000000149,NA,NA,NA,NA,survey-likert-extra-labels,15,163536,0.0-9.0-3.0-0.0,anomymised,65658117cda9c2da75aaa191,656609e034b7ff4f1a017d8e,92743,2A,man,NA,NA,W1 is being hugged by W3,hug1,rating_causation,"{""Q0"":4}",[0],W1 asked to hug W3,W3 asked to hug W1
null,Beth is being copied by Luke,NA,NA,NA,html-keyboard-response,16,165538,0.0-10.0-0.0,anomymised,65658117cda9c2da75aaa191,656609e034b7ff4f1a017d8e,92743,2A,man,NA,null,W1 is being copied by M3,copy4,sentence,NA,NA,NA,NA
7409.20000000298,NA,NA,NA,NA,survey-likert-extra-labels,17,172948,0.0-10.0-2.0,anomymised,65658117cda9c2da75aaa191,656609e034b7ff4f1a017d8e,92743,2A,man,NA,NA,W1 is being copied by M3,copy4,rating_volition,"{""Q0"":0}",[0],M3 wanted to copy W1,W1 wanted to copy M3
4431.20000000298,NA,NA,NA,NA,survey-likert-extra-labels,18,177380,0.0-10.0-3.0-0.0,anomymised,65658117cda9c2da75aaa191,656609e034b7ff4f1a017d8e,92743,2A,man,NA,NA,W1 is being copied by M3,copy4,rating_causation,"{""Q0"":1}",[0],M3 started copying W1 first,W1 started copying M3 first
null,Kate is carrying Ruth,NA,NA,NA,html-keyboard-response,19,179383,0.0-11.0-0.0,anomymised,65658117cda9c2da75aaa191,656609e034b7ff4f1a017d8e,92743,2A,man,NA,null,W2 is carrying W4,carry,sentence,NA,NA,NA,NA
5283.199999999255,NA,NA,NA,NA,survey-likert-extra-labels,20,184667,0.0-11.0-1.0-0.0,anomymised,65658117cda9c2da75aaa191,656609e034b7ff4f1a017d8e,92743,2A,man,NA,NA,W2 is carrying W4,carry,rating_causation,"{""Q0"":6}",[0],W2 is being moved by W4,W4 is being moved by W2
4282.800000000745,NA,NA,NA,NA,survey-likert-extra-labels,21,188951,0.0-11.0-2.0,anomymised,65658117cda9c2da75aaa191,656609e034b7ff4f1a017d8e,92743,2A,man,NA,NA,W2 is carrying W4,carry,rating_volition,"{""Q0"":0}",[0],W2 is transporting W4,W4 is transporting W2
null,Luke is being touched by Beth,NA,NA,NA,html-keyboard-response,22,190953,0.0-12.0-0.0,anomymised,65658117cda9c2da75aaa191,656609e034b7ff4f1a017d8e,92743,2A,man,NA,null,M3 is being touched by W1,touch4,sentence,NA,NA,NA,NA
3547,NA,NA,NA,NA,survey-likert-extra-labels,23,194501,0.0-12.0-2.0,anomymised,65658117cda9c2da75aaa191,656609e034b7ff4f1a017d8e,92743,2A,man,NA,NA,M3 is being touched by W1,touch4,rating_volition,"{""Q0"":0}",[0],M3 wanted to touch W1,W1 wanted to touch M3
4126.10000000149,NA,NA,NA,NA,survey-likert-extra-labels,24,198628,0.0-12.0-3.0-0.0,anomymised,65658117cda9c2da75aaa191,656609e034b7ff4f1a017d8e,92743,2A,man,NA,NA,M3 is being touched by W1,touch4,rating_causation,"{""Q0"":3}",[0],M3 asked to touch W1,W1 asked to touch M3
null,Dave is being shouted at by Ruth,NA,NA,NA,html-keyboard-response,25,200630,0.0-13.0-0.0,anomymised,65658117cda9c2da75aaa191,656609e034b7ff4f1a017d8e,92743,2A,man,NA,null,M2 is being shouted at by W4,shout3,sentence,NA,NA,NA,NA
3458.89999999851,NA,NA,NA,NA,survey-likert-extra-labels,26,204090,0.0-13.0-2.0,anomymised,65658117cda9c2da75aaa191,656609e034b7ff4f1a017d8e,92743,2A,man,NA,NA,M2 is being shouted at by W4,shout3,rating_volition,"{""Q0"":5}",[0],M2 wanted to shout at W4,W4 wanted to shout at M2
3457.800000000745,NA,NA,NA,NA,survey-likert-extra-labels,27,207549,0.0-13.0-3.0-0.0,anomymised,65658117cda9c2da75aaa191,656609e034b7ff4f1a017d8e,92743,2A,man,NA,NA,M2 is being shouted at by W4,shout3,rating_causation,"{""Q0"":5}",[0],M2 shouted at W4 first,W4 shouted at M2 first
null,Beth is being greeted by Luke,NA,NA,NA,html-keyboard-response,28,209551,0.0-14.0-0.0,anomymised,65658117cda9c2da75aaa191,656609e034b7ff4f1a017d8e,92743,2A,man,NA,null,W1 is being greeted by M3,greet3,sentence,NA,NA,NA,NA
3613.10000000149,NA,NA,NA,NA,survey-likert-extra-labels,29,213165,0.0-14.0-2.0,anomymised,65658117cda9c2da75aaa191,656609e034b7ff4f1a017d8e,92743,2A,man,NA,NA,W1 is being greeted by M3,greet3,rating_volition,"{""Q0"":1}",[0],M3 wanted to greet W1,W1 wanted to greet M3
3241.199999999255,NA,NA,NA,NA,survey-likert-extra-labels,30,216407,0.0-14.0-3.0-0.0,anomymised,65658117cda9c2da75aaa191,656609e034b7ff4f1a017d8e,92743,2A,man,NA,NA,W1 is being greeted by M3,greet3,rating_causation,"{""Q0"":1}",[0],M3 started greeting W1 first,W1 started greeting M3 first
null,Mike is being kissed by Kate,NA,NA,NA,html-keyboard-response,31,218409,0.0-15.0-0.0,anomymised,65658117cda9c2da75aaa191,656609e034b7ff4f1a017d8e,92743,2A,man,NA,null,M4 is being kissed by W2,kiss4,sentence,NA,NA,NA,NA
5442.10000000149,NA,NA,NA,NA,survey-likert-extra-labels,32,223852,0.0-15.0-2.0,anomymised,65658117cda9c2da75aaa191,656609e034b7ff4f1a017d8e,92743,2A,man,NA,NA,M4 is being kissed by W2,kiss4,rating_volition,"{""Q0"":0}",[0],W2 wanted to kiss M4,M4 wanted to kiss W2
3444.89999999851,NA,NA,NA,NA,survey-likert-extra-labels,33,227298,0.0-15.0-3.0-0.0,anomymised,65658117cda9c2da75aaa191,656609e034b7ff4f1a017d8e,92743,2A,man,NA,NA,M4 is being kissed by W2,kiss4,rating_causation,"{""Q0"":2}",[0],W2 asked to kiss M4,M4 asked to kiss W2
null,Beth is being shouted at by Jane,NA,NA,NA,html-keyboard-response,34,229300,0.0-16.0-0.0,anomymised,65658117cda9c2da75aaa191,656609e034b7ff4f1a017d8e,92743,2A,man,NA,null,W1 is being shouted at by W3,shout1,sentence,NA,NA,NA,NA
4435.5,NA,NA,NA,NA,survey-likert-extra-labels,35,233736,0.0-16.0-2.0,anomymised,65658117cda9c2da75aaa191,656609e034b7ff4f1a017d8e,92743,2A,man,NA,NA,W1 is being shouted at by W3,shout1,rating_volition,"{""Q0"":5}",[0],W1 wanted to shout at W3,W3 wanted to shout at W1
2997.39999999851,NA,NA,NA,NA,survey-likert-extra-labels,36,236735,0.0-16.0-3.0-0.0,anomymised,65658117cda9c2da75aaa191,656609e034b7ff4f1a017d8e,92743,2A,man,NA,NA,W1 is being shouted at by W3,shout1,rating_causation,"{""Q0"":4}",[0],W1 shouted at W3 first,W3 shouted at W1 first
null,Beth is being opposed by Jane,NA,NA,NA,html-keyboard-response,37,238737,0.0-17.0-0.0,anomymised,65658117cda9c2da75aaa191,656609e034b7ff4f1a017d8e,92743,2A,man,NA,null,W1 is being opposed by W3,oppose1,sentence,NA,NA,NA,NA
3692,NA,NA,NA,NA,survey-likert-extra-labels,38,242430,0.0-17.0-2.0,anomymised,65658117cda9c2da75aaa191,656609e034b7ff4f1a017d8e,92743,2A,man,NA,NA,W1 is being opposed by W3,oppose1,rating_volition,"{""Q0"":4}",[0],W1 wanted to oppose W3,W3 wanted to oppose W1
2571.800000000745,NA,NA,NA,NA,survey-likert-extra-labels,39,245003,0.0-17.0-3.0-0.0,anomymised,65658117cda9c2da75aaa191,656609e034b7ff4f1a017d8e,92743,2A,man,NA,NA,W1 is being opposed by W3,oppose1,rating_causation,"{""Q0"":4}",[0],W1 started opposing W3,W3 started opposing W1
null,Ruth is being greeted by Kate,NA,NA,NA,html-keyboard-response,40,247004,0.0-18.0-0.0,anomymised,65658117cda9c2da75aaa191,656609e034b7ff4f1a017d8e,92743,2A,man,NA,null,W4 is being greeted by W2,greet1,sentence,NA,NA,NA,NA
6223,NA,NA,NA,NA,survey-likert-extra-labels,41,253228,0.0-18.0-1.0-0.0,anomymised,65658117cda9c2da75aaa191,656609e034b7ff4f1a017d8e,92743,2A,man,NA,NA,W4 is being greeted by W2,greet1,rating_causation,"{""Q0"":0}",[0],W2 started greeting W4 first,W4 started greeting W2 first
4066.900000002235,NA,NA,NA,NA,survey-likert-extra-labels,42,257296,0.0-18.0-2.0,anomymised,65658117cda9c2da75aaa191,656609e034b7ff4f1a017d8e,92743,2A,man,NA,NA,W4 is being greeted by W2,greet1,rating_volition,"{""Q0"":2}",[0],W2 wanted to greet W4,W4 wanted to greet W2
null,Luke is being seduced by Beth,NA,NA,NA,html-keyboard-response,43,259298,0.0-19.0-0.0,anomymised,65658117cda9c2da75aaa191,656609e034b7ff4f1a017d8e,92743,2A,man,NA,null,M3 is being seduced by W1,seduce4,sentence,NA,NA,NA,NA
4362.699999999255,NA,NA,NA,NA,survey-likert-extra-labels,44,263661,0.0-19.0-2.0,anomymised,65658117cda9c2da75aaa191,656609e034b7ff4f1a017d8e,92743,2A,man,NA,NA,M3 is being seduced by W1,seduce4,rating_volition,"{""Q0"":6}",[0],M3 wanted to seducing W1,W1 wanted to seducing M3
1673.5,NA,NA,NA,NA,survey-likert-extra-labels,45,265336,0.0-19.0-3.0-0.0,anomymised,65658117cda9c2da75aaa191,656609e034b7ff4f1a017d8e,92743,2A,man,NA,NA,M3 is being seduced by W1,seduce4,rating_causation,"{""Q0"":5}",[0],M3 started seducing W1 first,W1 started seducing M3 first
null,Fred is being shouted at by Luke,NA,NA,NA,html-keyboard-response,46,267338,0.0-20.0-0.0,anomymised,65658117cda9c2da75aaa191,656609e034b7ff4f1a017d8e,92743,2A,man,NA,null,M1 is being shouted at by M3,shout2,sentence,NA,NA,NA,NA
4422.199999999255,NA,NA,NA,NA,survey-likert-extra-labels,47,271761,0.0-20.0-2.0,anomymised,65658117cda9c2da75aaa191,656609e034b7ff4f1a017d8e,92743,2A,man,NA,NA,M1 is being shouted at by M3,shout2,rating_volition,"{""Q0"":5}",[0],M1 wanted to shout at M3,M3 wanted to shout at M1
3874.39999999851,NA,NA,NA,NA,survey-likert-extra-labels,48,275638,0.0-20.0-3.0-0.0,anomymised,65658117cda9c2da75aaa191,656609e034b7ff4f1a017d8e,92743,2A,man,NA,NA,M1 is being shouted at by M3,shout2,rating_causation,"{""Q0"":5}",[0],M1 shouted at M3 first,M3 shouted at M1 first
null,Dave is being opposed by Ruth,NA,NA,NA,html-keyboard-response,49,277640,0.0-21.0-0.0,anomymised,65658117cda9c2da75aaa191,656609e034b7ff4f1a017d8e,92743,2A,man,NA,null,M2 is being opposed by W4,oppose4,sentence,NA,NA,NA,NA
4455.400000002235,NA,NA,NA,NA,survey-likert-extra-labels,50,282096,0.0-21.0-2.0,anomymised,65658117cda9c2da75aaa191,656609e034b7ff4f1a017d8e,92743,2A,man,NA,NA,M2 is being opposed by W4,oppose4,rating_volition,"{""Q0"":5}",[0],M2 wanted to oppose W4,W4 wanted to oppose M2
3764,NA,NA,NA,NA,survey-likert-extra-labels,51,285861,0.0-21.0-3.0-0.0,anomymised,65658117cda9c2da75aaa191,656609e034b7ff4f1a017d8e,92743,2A,man,NA,NA,M2 is being opposed by W4,oppose4,rating_causation,"{""Q0"":5}",[0],M2 started opposing W4,W4 started opposing M2
null,Kate is being shouted at by Mike,NA,NA,NA,html-keyboard-response,52,287863,0.0-22.0-0.0,anomymised,65658117cda9c2da75aaa191,656609e034b7ff4f1a017d8e,92743,2A,man,NA,null,W2 is being shouted at by M4,shout4,sentence,NA,NA,NA,NA
2387.599999997765,NA,NA,NA,NA,survey-likert-extra-labels,53,290252,0.0-22.0-1.0-0.0,anomymised,65658117cda9c2da75aaa191,656609e034b7ff4f1a017d8e,92743,2A,man,NA,NA,W2 is being shouted at by M4,shout4,rating_causation,"{""Q0"":5}",[0],W2 shouted at M4 first,M4 shouted at W2 first
1846.199999999255,NA,NA,NA,NA,survey-likert-extra-labels,54,292099,0.0-22.0-2.0,anomymised,65658117cda9c2da75aaa191,656609e034b7ff4f1a017d8e,92743,2A,man,NA,NA,W2 is being shouted at by M4,shout4,rating_volition,"{""Q0"":5}",[0],W2 wanted to shout at M4,M4 wanted to shout at W2
null,Kate is being challenged by Ruth,NA,NA,NA,html-keyboard-response,55,294101,0.0-23.0-0.0,anomymised,65658117cda9c2da75aaa191,656609e034b7ff4f1a017d8e,92743,2A,man,NA,null,W2 is being challenged by W4,challenge1,sentence,NA,NA,NA,NA
3741.2000000029802,NA,NA,NA,NA,survey-likert-extra-labels,56,297843,0.0-23.0-2.0,anomymised,65658117cda9c2da75aaa191,656609e034b7ff4f1a017d8e,92743,2A,man,NA,NA,W2 is being challenged by W4,challenge1,rating_volition,"{""Q0"":6}",[0],W2 wanted to challenge W4,W4 wanted to challenge W2
1875.800000000745,NA,NA,NA,NA,survey-likert-extra-labels,57,299720,0.0-23.0-3.0-0.0,anomymised,65658117cda9c2da75aaa191,656609e034b7ff4f1a017d8e,92743,2A,man,NA,NA,W2 is being challenged by W4,challenge1,rating_causation,"{""Q0"":6}",[0],W2 started challenging W4 first,W4 started challenging W2 first
null,Mike is being looked at by Kate,NA,NA,NA,html-keyboard-response,58,301721,0.0-24.0-0.0,anomymised,65658117cda9c2da75aaa191,656609e034b7ff4f1a017d8e,92743,2A,man,NA,null,M4 is being looked at by W2,look3,sentence,NA,NA,NA,NA
5788.099999997765,NA,NA,NA,NA,survey-likert-extra-labels,59,307510,0.0-24.0-1.0-0.0,anomymised,65658117cda9c2da75aaa191,656609e034b7ff4f1a017d8e,92743,2A,man,NA,NA,M4 is being looked at by W2,look3,rating_causation,"{""Q0"":0}",[0],W2 looked at M4 first,M4 looked at W2 first
1988.6000000014901,NA,NA,NA,NA,survey-likert-extra-labels,60,309500,0.0-24.0-2.0,anomymised,65658117cda9c2da75aaa191,656609e034b7ff4f1a017d8e,92743,2A,man,NA,NA,M4 is being looked at by W2,look3,rating_volition,"{""Q0"":0}",[0],W2 wanted to look at M4,M4 wanted to look at W2
null,Dave is being challenged by Mike,NA,NA,NA,html-keyboard-response,61,311501,0.0-25.0-0.0,anomymised,65658117cda9c2da75aaa191,656609e034b7ff4f1a017d8e,92743,2A,man,NA,null,M2 is being challenged by M4,challenge2,sentence,NA,NA,NA,NA
3421,NA,NA,NA,NA,survey-likert-extra-labels,62,314923,0.0-25.0-2.0,anomymised,65658117cda9c2da75aaa191,656609e034b7ff4f1a017d8e,92743,2A,man,NA,NA,M2 is being challenged by M4,challenge2,rating_volition,"{""Q0"":6}",[0],M2 wanted to challenge M4,M4 wanted to challenge M2
1813.699999999255,NA,NA,NA,NA,survey-likert-extra-labels,63,316738,0.0-25.0-3.0-0.0,anomymised,65658117cda9c2da75aaa191,656609e034b7ff4f1a017d8e,92743,2A,man,NA,NA,M2 is being challenged by M4,challenge2,rating_causation,"{""Q0"":6}",[0],M2 started challenging M4 first,M4 started challenging M2 first
null,Ruth is being looked at by Dave,NA,NA,NA,html-keyboard-response,64,318739,0.0-26.0-0.0,anomymised,65658117cda9c2da75aaa191,656609e034b7ff4f1a017d8e,92743,2A,man,NA,null,W4 is being looked at by M2,look4,sentence,NA,NA,NA,NA
3359.400000002235,NA,NA,NA,NA,survey-likert-extra-labels,65,322099,0.0-26.0-1.0-0.0,anomymised,65658117cda9c2da75aaa191,656609e034b7ff4f1a017d8e,92743,2A,man,NA,NA,W4 is being looked at by M2,look4,rating_causation,"{""Q0"":0}",[0],M2 looked at W4 first,W4 looked at M2 first
2444,NA,NA,NA,NA,survey-likert-extra-labels,66,324544,0.0-26.0-2.0,anomymised,65658117cda9c2da75aaa191,656609e034b7ff4f1a017d8e,92743,2A,man,NA,NA,W4 is being looked at by M2,look4,rating_volition,"{""Q0"":1}",[0],M2 wanted to look at W4,W4 wanted to look at M2
null,Dave is being hugged by Ruth,NA,NA,NA,html-keyboard-response,67,326546,0.0-27.0-0.0,anomymised,65658117cda9c2da75aaa191,656609e034b7ff4f1a017d8e,92743,2A,man,NA,null,M2 is being hugged by W4,hug4,sentence,NA,NA,NA,NA
3887.199999999255,NA,NA,NA,NA,survey-likert-extra-labels,68,330434,0.0-27.0-2.0,anomymised,65658117cda9c2da75aaa191,656609e034b7ff4f1a017d8e,92743,2A,man,NA,NA,M2 is being hugged by W4,hug4,rating_volition,"{""Q0"":3}",[0],M2 wanted to hug W4,W4 wanted to hug M2
2375.7999999970198,NA,NA,NA,NA,survey-likert-extra-labels,69,332811,0.0-27.0-3.0-0.0,anomymised,65658117cda9c2da75aaa191,656609e034b7ff4f1a017d8e,92743,2A,man,NA,NA,M2 is being hugged by W4,hug4,rating_causation,"{""Q0"":3}",[0],M2 asked to hug W4,W4 asked to hug M2
null,Jane is being kissed by Beth,NA,NA,NA,html-keyboard-response,70,334812,0.0-28.0-0.0,anomymised,65658117cda9c2da75aaa191,656609e034b7ff4f1a017d8e,92743,2A,man,NA,null,W3 is being kissed by W1,kiss1,sentence,NA,NA,NA,NA
6036.699999999255,NA,NA,NA,NA,survey-likert-extra-labels,71,340850,0.0-28.0-1.0-0.0,anomymised,65658117cda9c2da75aaa191,656609e034b7ff4f1a017d8e,92743,2A,man,NA,NA,W3 is being kissed by W1,kiss1,rating_causation,"{""Q0"":3}",[0],W1 asked to kiss W3,W3 asked to kiss W1
2855.199999999255,NA,NA,NA,NA,survey-likert-extra-labels,72,343706,0.0-28.0-2.0,anomymised,65658117cda9c2da75aaa191,656609e034b7ff4f1a017d8e,92743,2A,man,NA,NA,W3 is being kissed by W1,kiss1,rating_volition,"{""Q0"":3}",[0],W1 wanted to kiss W3,W3 wanted to kiss W1
null,Jane is feeding Fred,NA,NA,NA,html-keyboard-response,73,345707,0.0-29.0-0.0,anomymised,65658117cda9c2da75aaa191,656609e034b7ff4f1a017d8e,92743,2A,man,NA,null,W3 is feeding M1,feed,sentence,NA,NA,NA,NA
5648,NA,NA,NA,NA,survey-likert-extra-labels,74,351356,0.0-29.0-1.0-0.0,anomymised,65658117cda9c2da75aaa191,656609e034b7ff4f1a017d8e,92743,2A,man,NA,NA,W3 is feeding M1,feed,rating_causation,"{""Q0"":6}",[0],W3 is eating M1's food,M1 is eating W3's food
7113.60000000149,NA,NA,NA,NA,survey-likert-extra-labels,75,358471,0.0-29.0-2.0,anomymised,65658117cda9c2da75aaa191,656609e034b7ff4f1a017d8e,92743,2A,man,NA,NA,W3 is feeding M1,feed,rating_volition,"{""Q0"":0}",[0],W3 cooked for M1,M1 cooked for W3
null,Mike is being copied by Dave,NA,NA,NA,html-keyboard-response,76,360473,0.0-30.0-0.0,anomymised,65658117cda9c2da75aaa191,656609e034b7ff4f1a017d8e,92743,2A,man,NA,null,M4 is being copied by M2,copy2,sentence,NA,NA,NA,NA
5884.10000000149,NA,NA,NA,NA,survey-likert-extra-labels,77,366358,0.0-30.0-1.0-0.0,anomymised,65658117cda9c2da75aaa191,656609e034b7ff4f1a017d8e,92743,2A,man,NA,NA,M4 is being copied by M2,copy2,rating_causation,"{""Q0"":1}",[0],M2 started copying M4 first,M4 started copying M2 first
7935,NA,NA,NA,NA,survey-likert-extra-labels,78,374294,0.0-30.0-2.0,anomymised,65658117cda9c2da75aaa191,656609e034b7ff4f1a017d8e,92743,2A,man,NA,NA,M4 is being copied by M2,copy2,rating_volition,"{""Q0"":1}",[0],M2 wanted to copy M4,M4 wanted to copy M2
null,Luke is being looked at by Fred,NA,NA,NA,html-keyboard-response,79,376296,0.0-31.0-0.0,anomymised,65658117cda9c2da75aaa191,656609e034b7ff4f1a017d8e,92743,2A,man,NA,null,M3 is being looked at by M1,look2,sentence,NA,NA,NA,NA
4941.10000000149,NA,NA,NA,NA,survey-likert-extra-labels,80,381238,0.0-31.0-1.0-0.0,anomymised,65658117cda9c2da75aaa191,656609e034b7ff4f1a017d8e,92743,2A,man,NA,NA,M3 is being looked at by M1,look2,rating_causation,"{""Q0"":0}",[0],M1 looked at M3 first,M3 looked at M1 first
2617.800000000745,NA,NA,NA,NA,survey-likert-extra-labels,81,383857,0.0-31.0-2.0,anomymised,65658117cda9c2da75aaa191,656609e034b7ff4f1a017d8e,92743,2A,man,NA,NA,M3 is being looked at by M1,look2,rating_volition,"{""Q0"":1}",[0],M1 wanted to look at M3,M3 wanted to look at M1
null,Ruth is being copied by Kate,NA,NA,NA,html-keyboard-response,82,385858,0.0-32.0-0.0,anomymised,65658117cda9c2da75aaa191,656609e034b7ff4f1a017d8e,92743,2A,man,NA,null,W4 is being copied by W2,copy1,sentence,NA,NA,NA,NA
4881,NA,NA,NA,NA,survey-likert-extra-labels,83,390740,0.0-32.0-2.0,anomymised,65658117cda9c2da75aaa191,656609e034b7ff4f1a017d8e,92743,2A,man,NA,NA,W4 is being copied by W2,copy1,rating_volition,"{""Q0"":1}",[0],W2 wanted to copy W4,W4 wanted to copy W2
19827,NA,NA,NA,NA,survey-likert-extra-labels,84,410568,0.0-32.0-3.0-0.0,anomymised,65658117cda9c2da75aaa191,656609e034b7ff4f1a017d8e,92743,2A,man,NA,NA,W4 is being copied by W2,copy1,rating_causation,"{""Q0"":0}",[0],W2 started copying W4 first,W4 started copying W2 first
null,Dave is reminding Ruth,NA,NA,NA,html-keyboard-response,85,412570,0.0-33.0-0.0,anomymised,65658117cda9c2da75aaa191,656609e034b7ff4f1a017d8e,92743,2A,man,NA,null,M2 is reminding W4,remind,sentence,NA,NA,NA,NA
3772.300000000745,NA,NA,NA,NA,survey-likert-extra-labels,86,416343,0.0-33.0-2.0,anomymised,65658117cda9c2da75aaa191,656609e034b7ff4f1a017d8e,92743,2A,man,NA,NA,M2 is reminding W4,remind,rating_volition,"{""Q0"":0}",[0],M2 is telling W4 again,W4 is telling M2 again
4106.10000000149,NA,NA,NA,NA,survey-likert-extra-labels,87,420450,0.0-33.0-3.0-0.0,anomymised,65658117cda9c2da75aaa191,656609e034b7ff4f1a017d8e,92743,2A,man,NA,NA,M2 is reminding W4,remind,rating_causation,"{""Q0"":0}",[0],M2 is remembering,W4 is remembering
null,Dave is posing for Mike,NA,NA,NA,html-keyboard-response,88,422452,0.0-34.0-0.0,anomymised,65658117cda9c2da75aaa191,656609e034b7ff4f1a017d8e,92743,2A,man,NA,null,M2 is posing for M4,pose,sentence,NA,NA,NA,NA
5513.5,NA,NA,NA,NA,survey-likert-extra-labels,89,427966,0.0-34.0-2.0,anomymised,65658117cda9c2da75aaa191,656609e034b7ff4f1a017d8e,92743,2A,man,NA,NA,M2 is posing for M4,pose,rating_volition,"{""Q0"":0}",[0],M2 is modelling for M4,M4 is modelling for M2
3823,NA,NA,NA,NA,survey-likert-extra-labels,90,431790,0.0-34.0-3.0-0.0,anomymised,65658117cda9c2da75aaa191,656609e034b7ff4f1a017d8e,92743,2A,man,NA,NA,M2 is posing for M4,pose,rating_causation,"{""Q0"":6}",[0],M2 is photographing M4,M4 is photographing M2
null,Dave is being seduced by Mike,NA,NA,NA,html-keyboard-response,91,433791,0.0-35.0-0.0,anomymised,65658117cda9c2da75aaa191,656609e034b7ff4f1a017d8e,92743,2A,man,NA,null,M2 is being seduced by M4,seduce2,sentence,NA,NA,NA,NA
3645,NA,NA,NA,NA,survey-likert-extra-labels,92,437437,0.0-35.0-1.0-0.0,anomymised,65658117cda9c2da75aaa191,656609e034b7ff4f1a017d8e,92743,2A,man,NA,NA,M2 is being seduced by M4,seduce2,rating_causation,"{""Q0"":6}",[0],M2 started seducing M4 first,M4 started seducing M2 first
2927.800000000745,NA,NA,NA,NA,survey-likert-extra-labels,93,440366,0.0-35.0-2.0,anomymised,65658117cda9c2da75aaa191,656609e034b7ff4f1a017d8e,92743,2A,man,NA,NA,M2 is being seduced by M4,seduce2,rating_volition,"{""Q0"":5}",[0],M2 wanted to seduce M4,M4 wanted to seduce M2
null,Jane is being challenged by Fred,NA,NA,NA,html-keyboard-response,94,442367,0.0-36.0-0.0,anomymised,65658117cda9c2da75aaa191,656609e034b7ff4f1a017d8e,92743,2A,man,NA,null,W3 is being challenged by M1,challenge4,sentence,NA,NA,NA,NA
3869.800000000745,NA,NA,NA,NA,survey-likert-extra-labels,95,446238,0.0-36.0-2.0,anomymised,65658117cda9c2da75aaa191,656609e034b7ff4f1a017d8e,92743,2A,man,NA,NA,W3 is being challenged by M1,challenge4,rating_volition,"{""Q0"":6}",[0],W3 wanted to challenge M1,M1 wanted to challenge W3
1919.9000000022352,NA,NA,NA,NA,survey-likert-extra-labels,96,448159,0.0-36.0-3.0-0.0,anomymised,65658117cda9c2da75aaa191,656609e034b7ff4f1a017d8e,92743,2A,man,NA,NA,W3 is being challenged by M1,challenge4,rating_causation,"{""Q0"":5}",[0],W3 started challenging M1 first,M1 started challenging W3 first
null,Fred is being opposed by Luke,NA,NA,NA,html-keyboard-response,97,450169,0.0-37.0-0.0,anomymised,65658117cda9c2da75aaa191,656609e034b7ff4f1a017d8e,92743,2A,man,NA,null,M1 is being opposed by M3,oppose2,sentence,NA,NA,NA,NA
2888.60000000149,NA,NA,NA,NA,survey-likert-extra-labels,98,453058,0.0-37.0-1.0-0.0,anomymised,65658117cda9c2da75aaa191,656609e034b7ff4f1a017d8e,92743,2A,man,NA,NA,M1 is being opposed by M3,oppose2,rating_causation,"{""Q0"":5}",[0],M1 started opposing M3,M3 started opposing M1
