"rt","stimulus","button_pressed","trial_type","trial_index","time_elapsed","internal_node_id","subject","list","ppt_gender","url","key_press","sentence_type","verb","test_part","responses","question_order","left_part","right_part"
"2282.970000000205","","","survey-likert-extra-labels","120","520291","0.0-44.0-2.0","50780","2B","man","","","W2 is marrying W4","marry1","rating_volition","{""Q0"":3}","[0]","W4 wanted to marry W2","W2 wanted to marry W4"
"null","Luke is marrying Mike","","html-keyboard-response","121","522303","0.0-45.0-0.0","50780","2B","man","","null","M2 is marrying M4","marry2","sentence","","","",""
"1705.5649999983725","","","survey-likert-extra-labels","122","524012","0.0-45.0-1.0-0.0","50780","2B","man","","","M2 is marrying M4","marry2","rating_causation","{""Q0"":3}","[0]","M4 asked to marry M2","M2 asked to marry M4"
"2016.1100000004517","","","survey-likert-extra-labels","123","526031","0.0-45.0-2.0","50780","2B","man","","","M2 is marrying M4","marry2","rating_volition","{""Q0"":3}","[0]","M4 wanted to marry M2","M2 wanted to marry M4"
"null","Ruth is carrying Jane","","html-keyboard-response","124","528037","0.0-46.0-0.0","50780","2B","man","","null","W2 is carrying W4","carry","sentence","","","",""
"4490.139999999898","","","survey-likert-extra-labels","125","532530","0.0-46.0-1.0-0.0","50780","2B","man","","","W2 is carrying W4","carry","rating_causation","{""Q0"":6}","[0]","W2 is being moved by W4","W4 is being moved by W2"
"3142.149999999674","","","survey-likert-extra-labels","126","535679","0.0-46.0-2.0","50780","2B","man","","","W2 is carrying W4","carry","rating_volition","{""Q0"":0}","[0]","W2 is transporting W4","W4 is transporting W2"
"null","Kate is fighting with Dave","","html-keyboard-response","127","537686","0.0-47.0-0.0","50780","2B","man","","null","W1 is fighting with M3","fight4","sentence","","","",""
"4886.67500000156","","","survey-likert-extra-labels","128","542575","0.0-47.0-2.0","50780","2B","man","","","W1 is fighting with M3","fight4","rating_volition","{""Q0"":3}","[0]","W1 wanted to fight M3","M3 wanted to fight W1"
"3510.3349999990314","","","survey-likert-extra-labels","129","546091","0.0-47.0-3.0-0.0","50780","2B","man","","","W1 is fighting with M3","fight4","rating_causation","{""Q0"":3}","[0]","W1 started the fight with M3","M3 started the fight with W1"
"null","Mike is playing with Luke","","html-keyboard-response","130","548098","0.0-48.0-0.0","50780","2B","man","","null","M4 is playing with M2","play2","sentence","","","",""
"3671.7250000002095","","","survey-likert-extra-labels","131","551772","0.0-48.0-1.0-0.0","50780","2B","man","","","M4 is playing with M2","play2","rating_causation","{""Q0"":3}","[0]","M4 asked to play with M2","M2 asked to play with M4"
"4206.329999999143","","","survey-likert-extra-labels","132","555984","0.0-48.0-2.0","50780","2B","man","","","M4 is playing with M2","play2","rating_volition","{""Q0"":2}","[0]","M4 wanted to play with M2","M2 wanted to play with M4"
"null","Luke is flirting with Mike","","html-keyboard-response","133","557990","0.0-49.0-0.0","50780","2B","man","","null","M2 is flirting with M4","flirt2","sentence","","","",""
"3447.1299999986077","","","survey-likert-extra-labels","134","561440","0.0-49.0-2.0","50780","2B","man","","","M2 is flirting with M4","flirt2","rating_volition","{""Q0"":5}","[0]","M4 wanted to flirt with M2","M2 wanted to flirt with M4"
"6116.949999999604","","","survey-likert-extra-labels","135","567563","0.0-49.0-3.0-0.0","50780","2B","man","","","M2 is flirting with M4","flirt2","rating_causation","{""Q0"":5}","[0]","M4 started flirting with M2 first","M2 started flirting with M4 first"
"null","Mike is shouting at Ruth","","html-keyboard-response","136","569572","0.0-50.0-0.0","50780","2B","man","","null","M4 is shouting at W2","shout4","sentence","","","",""
"2202.2649999998976","","","survey-likert-extra-labels","137","571777","0.0-50.0-1.0-0.0","50780","2B","man","","","M4 is shouting at W2","shout4","rating_causation","{""Q0"":3}","[0]","M4 shouted at W2 first","W2 shouted at M4 first"
"3271.4800000011455","","","survey-likert-extra-labels","138","575051","0.0-50.0-2.0","50780","2B","man","","","M4 is shouting at W2","shout4","rating_volition","{""Q0"":3}","[0]","M4 wanted to shout at W2","W2 wanted to shout at M4"
"null","Mike is arguing with Ruth","","html-keyboard-response","139","577055","0.0-51.0-0.0","50780","2B","man","","null","M4 is arguing with W2","argue3","sentence","","","",""
"2493.1949999990175","","","survey-likert-extra-labels","140","579551","0.0-51.0-2.0","50780","2B","man","","","M4 is arguing with W2","argue3","rating_volition","{""Q0"":3}","[0]","M4 wanted to argue with W2","W2 wanted to argue with M4"
"3746.685000000056","","","survey-likert-extra-labels","141","583302","0.0-51.0-3.0-0.0","50780","2B","man","","","M4 is arguing with W2","argue3","rating_causation","{""Q0"":2}","[0]","M4 started an argument with W2","W2 started an argument with M4"
"null","Ruth is teaching Mike","","html-keyboard-response","142","585308","0.0-52.0-0.0","50780","2B","man","","null","W2 is teaching M4","teach","sentence","","","",""
"3499.849999998347","","","survey-likert-extra-labels","143","588811","0.0-52.0-2.0","50780","2B","man","","","W2 is teaching M4","teach","rating_volition","{""Q0"":0}","[0]","W2 is educating M4","M4 is educating W2"
"3202.0150000007125","","","survey-likert-extra-labels","144","592018","0.0-52.0-3.0-0.0","50780","2B","man","","","W2 is teaching M4","teach","rating_causation","{""Q0"":6}","[0]","W2 is learning from M4","M4 is learning from W2"
"null","Ruth is talking to Mike","","html-keyboard-response","145","594024","0.0-53.0-0.0","50780","2B","man","","null","W2 is talking to M4","talk3","sentence","","","",""
"7653.350000000442","","","survey-likert-extra-labels","146","601681","0.0-53.0-1.0-0.0","50780","2B","man","","","W2 is talking to M4","talk3","rating_causation","{""Q0"":5}","[0]","M4 started a conversation with W2","W2 started a conversation with M4"
"4108.135000000475","","","survey-likert-extra-labels","147","605795","0.0-53.0-2.0","50780","2B","man","","","W2 is talking to M4","talk3","rating_volition","{""Q0"":5}","[0]","M4 wanted to talk to W2","W2 wanted to talk to M4"
"null","Dave is hiring Kate","","html-keyboard-response","148","607814","0.0-54.0-0.0","50780","2B","man","","null","M3 is hiring W1","hire","sentence","","","",""
"5713.609999998938","","","survey-likert-extra-labels","149","613530","0.0-54.0-1.0-0.0","50780","2B","man","","","M3 is hiring W1","hire","rating_causation","{""Q0"":6}","[0]","M3 will work for W1","W1 will work for M3"
"2821.8249999991385","","","survey-likert-extra-labels","150","616358","0.0-54.0-2.0","50780","2B","man","","","M3 is hiring W1","hire","rating_volition","{""Q0"":0}","[0]","M3 is employing W1","W1 is employing M3"
"1586.5099999991944","<p>Thank you for completing that task.</p><p>The final part of this session is a short questionnaire.</p><p>Press Continue.</p>","0","html-button-response","151","617949","0.0-55.0","50780","2B","man","","","","","","","","",""
"33100.689999999246","","","survey-text","152","652075","0.0-56.0","50780","2B","man","","","","","demographics","{""Q0"":""21"",""Q1"":""English"",""Q2"":""English"",""Q3"":""Cornwall (Britain)"",""Q4"":""Cornish British"",""Q5"":""White"",""Q6"":""Male""}","","",""
"1678.8649999998743","<p>Have you lived in the UK for the last 5 years or more?</p>","0","html-button-response","153","653760","0.0-57.0","50780","2B","man","","","","","fiveyears","","","",""
"5607.560000000405","","","survey-text","154","660389","0.0-58.0","50780","2B","man","","","","","worker_id","{""Q0"":""5ee60dc294223201e0ad64ed""}","","",""
"27155.735000000335","","","external-html","155","687657","0.0-59.0","50780","2B","man","debrief.html","","","","","","","",""
