"rt","stimulus","button_pressed","trial_type","trial_index","time_elapsed","internal_node_id","subject","list","ppt_gender","url","key_press","sentence_type","verb","test_part","responses","question_order","left_part","right_part"
"null","Kate is talking to Ruth","","html-keyboard-response","121","733157","0.0-45.0-0.0","7009","3A","man","","null","W3 is talking to W1","talk1","sentence","","","",""
"3637.049999961164","","","survey-likert-extra-labels","122","736794","0.0-45.0-1.0-0.0","7009","3A","man","","","W3 is talking to W1","talk1","rating_causation","{""Q0"":3}","[0]","W1 started a conversation with W3","W3 started a conversation with W1"
"1533.4399999701418","","","survey-likert-extra-labels","123","738330","0.0-45.0-2.0","7009","3A","man","","","W3 is talking to W1","talk1","rating_volition","{""Q0"":3}","[0]","W1 wanted to talk to W3","W3 wanted to talk to W1"
"null","Kate is shouting at Ruth","","html-keyboard-response","124","740333","0.0-46.0-0.0","7009","3A","man","","null","W3 is shouting at W1","shout1","sentence","","","",""
"1140.4600000241771","","","survey-likert-extra-labels","125","741474","0.0-46.0-2.0","7009","3A","man","","","W3 is shouting at W1","shout1","rating_volition","{""Q0"":3}","[0]","W1 wanted to shout at W3","W3 wanted to shout at W1"
"925.5300000077114","","","survey-likert-extra-labels","126","742402","0.0-46.0-3.0-0.0","7009","3A","man","","","W3 is shouting at W1","shout1","rating_causation","{""Q0"":3}","[0]","W1 shouted at W3 first","W3 shouted at W1 first"
"null","Luke is touching Kate","","html-keyboard-response","127","744404","0.0-47.0-0.0","7009","3A","man","","null","M1 is touching W3","touch3","sentence","","","",""
"1965.2900000219233","","","survey-likert-extra-labels","128","746370","0.0-47.0-2.0","7009","3A","man","","","M1 is touching W3","touch3","rating_volition","{""Q0"":3}","[0]","W3 wanted to touch M1","M1 wanted to touch W3"
"1318.0799999972805","","","survey-likert-extra-labels","129","747690","0.0-47.0-3.0-0.0","7009","3A","man","","","M1 is touching W3","touch3","rating_causation","{""Q0"":3}","[0]","W3 asked to touch M1","M1 asked to touch W3"
"null","Fred is shouting at Luke","","html-keyboard-response","130","749693","0.0-48.0-0.0","7009","3A","man","","null","M3 is shouting at M1","shout2","sentence","","","",""
"2573.069999984","","","survey-likert-extra-labels","131","752267","0.0-48.0-1.0-0.0","7009","3A","man","","","M3 is shouting at M1","shout2","rating_causation","{""Q0"":3}","[0]","M1 shouted at M3 first","M3 shouted at M1 first"
"901.5099999960512","","","survey-likert-extra-labels","132","753170","0.0-48.0-2.0","7009","3A","man","","","M3 is shouting at M1","shout2","rating_volition","{""Q0"":3}","[0]","M1 wanted to shout at M3","M3 wanted to shout at M1"
"null","Fred is fighting with Ruth","","html-keyboard-response","133","755172","0.0-49.0-0.0","7009","3A","man","","null","M3 is fighting with W1","fight4","sentence","","","",""
"1061.359999992419","","","survey-likert-extra-labels","134","756234","0.0-49.0-2.0","7009","3A","man","","","M3 is fighting with W1","fight4","rating_volition","{""Q0"":3}","[0]","M3 wanted to fight W1","W1 wanted to fight M3"
"965.9950000350364","","","survey-likert-extra-labels","135","757202","0.0-49.0-3.0-0.0","7009","3A","man","","","M3 is fighting with W1","fight4","rating_causation","{""Q0"":3}","[0]","M3 started the fight with W1","W1 started the fight with M3"
"null","Beth is talking to Mike","","html-keyboard-response","136","759205","0.0-50.0-0.0","7009","3A","man","","null","W4 is talking to M2","talk4","sentence","","","",""
"2140.484999981709","","","survey-likert-extra-labels","137","761346","0.0-50.0-2.0","7009","3A","man","","","W4 is talking to M2","talk4","rating_volition","{""Q0"":3}","[0]","M2 wanted to talk to W4","W4 wanted to talk to M2"
"1045.8549999748357","","","survey-likert-extra-labels","138","762395","0.0-50.0-3.0-0.0","7009","3A","man","","","W4 is talking to M2","talk4","rating_causation","{""Q0"":3}","[0]","M2 started a conversation with W4","W4 started a conversation with M2"
"null","Beth is playing with Jane","","html-keyboard-response","139","764409","0.0-51.0-0.0","7009","3A","man","","null","W4 is playing with W2","play1","sentence","","","",""
"3513.0550000467338","","","survey-likert-extra-labels","140","767922","0.0-51.0-2.0","7009","3A","man","","","W4 is playing with W2","play1","rating_volition","{""Q0"":3}","[0]","W2 wanted to play with W4","W4 wanted to play with W2"
"1101.1150000267662","","","survey-likert-extra-labels","141","769026","0.0-51.0-3.0-0.0","7009","3A","man","","","W4 is playing with W2","play1","rating_causation","{""Q0"":3}","[0]","W2 asked to play with W4","W4 asked to play with W2"
"null","Mike is arguing with Beth","","html-keyboard-response","142","771029","0.0-52.0-0.0","7009","3A","man","","null","M2 is arguing with W4","argue4","sentence","","","",""
"1500.44999999227","","","survey-likert-extra-labels","143","772530","0.0-52.0-1.0-0.0","7009","3A","man","","","M2 is arguing with W4","argue4","rating_causation","{""Q0"":3}","[0]","M2 started an argument with W4","W4 started an argument with M2"
"893.6149999499321","","","survey-likert-extra-labels","144","773426","0.0-52.0-2.0","7009","3A","man","","","M2 is arguing with W4","argue4","rating_volition","{""Q0"":3}","[0]","M2 wanted to argue with W4","W4 wanted to argue with M2"
"null","Mike is posing for Dave","","html-keyboard-response","145","775428","0.0-53.0-0.0","7009","3A","man","","null","M2 is posing for M4","pose","sentence","","","",""
"2141.654999984894","","","survey-likert-extra-labels","146","777571","0.0-53.0-2.0","7009","3A","man","","","M2 is posing for M4","pose","rating_volition","{""Q0"":3}","[0]","M2 is modelling for M4","M4 is modelling for M2"
"10357.004999998026","","","survey-likert-extra-labels","147","787930","0.0-53.0-3.0-0.0","7009","3A","man","","","M2 is posing for M4","pose","rating_causation","{""Q0"":6}","[0]","M2 is photographing M4","M4 is photographing M2"
"null","Jane is fighting with Beth","","html-keyboard-response","148","789936","0.0-54.0-0.0","7009","3A","man","","null","W2 is fighting with W4","fight1","sentence","","","",""
"1850.719999987632","","","survey-likert-extra-labels","149","791787","0.0-54.0-2.0","7009","3A","man","","","W2 is fighting with W4","fight1","rating_volition","{""Q0"":3}","[0]","W2 wanted to fight W4","W4 wanted to fight W2"
"1773.6649999860674","","","survey-likert-extra-labels","150","793563","0.0-54.0-3.0-0.0","7009","3A","man","","","W2 is fighting with W4","fight1","rating_causation","{""Q0"":3}","[0]","W2 started the fight with W4","W4 started the fight with W2"
"2229.8050000099465","<p>Thank you for completing that task.</p><p>The final part of this session is a short questionnaire.</p><p>Press Continue.</p>","0","html-button-response","151","795795","0.0-55.0","7009","3A","man","","","","","","","","",""
"32978.53500000201","","","survey-text","152","829788","0.0-56.0","7009","3A","man","","","","","demographics","{""Q0"":""39"",""Q1"":""English"",""Q2"":""English"",""Q3"":""UK"",""Q4"":""British"",""Q5"":""White"",""Q6"":""Male""}","","",""
"2661.6800000192598","<p>Have you lived in the UK for the last 5 years or more?</p>","0","html-button-response","153","832451","0.0-57.0","7009","3A","man","","","","","fiveyears","","","",""
"5382.554999960121","","","survey-text","154","838835","0.0-58.0","7009","3A","man","","","","","worker_id","{""Q0"":""5e3ad15d793a082d7cf448ba""}","","",""
"47520.169999974314","","","external-html","155","886402","0.0-59.0","7009","3A","man","debrief.html","","","","","","","",""
