"rt","stimulus","button_pressed","trial_type","trial_index","time_elapsed","internal_node_id","subject","list","ppt_gender","url","key_press","sentence_type","verb","test_part","responses","question_order","left_part","right_part"
"1834.6749999327585","","","survey-likert-extra-labels","119","453199","0.0-44.0-1.0-0.0","75332","4B","woman","","","M2 is fighting with M4","fight2","rating_causation","{""Q0"":3}","[0]","M4 started the fight with M2","M2 started the fight with M4"
"1914.5550000248477","","","survey-likert-extra-labels","120","455121","0.0-44.0-2.0","75332","4B","woman","","","M2 is fighting with M4","fight2","rating_volition","{""Q0"":3}","[0]","M4 wanted to fight M2","M2 wanted to fight M4"
"null","Mike is flirting with Luke","","html-keyboard-response","121","457129","0.0-45.0-0.0","75332","4B","woman","","null","M4 is flirting with M2","flirt2","sentence","","","",""
"4066.925000050105","","","survey-likert-extra-labels","122","461199","0.0-45.0-2.0","75332","4B","woman","","","M4 is flirting with M2","flirt2","rating_volition","{""Q0"":2}","[0]","M4 wanted to flirt with M2","M2 wanted to flirt with M4"
"1617.5200000870973","","","survey-likert-extra-labels","123","462825","0.0-45.0-3.0-0.0","75332","4B","woman","","","M4 is flirting with M2","flirt2","rating_causation","{""Q0"":3}","[0]","M4 started flirting with M2 first","M2 started flirting with M4 first"
"null","Kate is chasing Beth","","html-keyboard-response","124","464833","0.0-46.0-0.0","75332","4B","woman","","null","W1 is chasing W3","chase","sentence","","","",""
"4193.304999964312","","","survey-likert-extra-labels","125","469029","0.0-46.0-1.0-0.0","75332","4B","woman","","","W1 is chasing W3","chase","rating_causation","{""Q0"":6}","[0]","W1 is running away from W3","W3 is running away from W1"
"6268.099999986589","","","survey-likert-extra-labels","126","475305","0.0-46.0-2.0","75332","4B","woman","","","W1 is chasing W3","chase","rating_volition","{""Q0"":1}","[0]","W1 is behind W3","W3 is behind W1"
"null","Kate is marrying Dave","","html-keyboard-response","127","477312","0.0-47.0-0.0","75332","4B","woman","","null","W1 is marrying M3","marry3","sentence","","","",""
"2461.284999968484","","","survey-likert-extra-labels","128","479777","0.0-47.0-1.0-0.0","75332","4B","woman","","","W1 is marrying M3","marry3","rating_causation","{""Q0"":3}","[0]","W1 asked to marry M3","M3 asked to marry W1"
"3028.5499999299645","","","survey-likert-extra-labels","129","482813","0.0-47.0-2.0","75332","4B","woman","","","W1 is marrying M3","marry3","rating_volition","{""Q0"":2}","[0]","W1 wanted to marry M3","M3 wanted to marry W1"
"null","Dave is fighting with Kate","","html-keyboard-response","130","484820","0.0-48.0-0.0","75332","4B","woman","","null","M3 is fighting with W1","fight4","sentence","","","",""
"3118.0350000504404","","","survey-likert-extra-labels","131","487941","0.0-48.0-2.0","75332","4B","woman","","","M3 is fighting with W1","fight4","rating_volition","{""Q0"":3}","[0]","W1 wanted to fight M3","M3 wanted to fight W1"
"1234.1299999970943","","","survey-likert-extra-labels","132","489183","0.0-48.0-3.0-0.0","75332","4B","woman","","","M3 is fighting with W1","fight4","rating_causation","{""Q0"":3}","[0]","W1 started the fight with M3","M3 started the fight with W1"
"null","Beth is fighting with Fred","","html-keyboard-response","133","491190","0.0-49.0-0.0","75332","4B","woman","","null","W3 is fighting with M1","fight3","sentence","","","",""
"1254.1650000493973","","","survey-likert-extra-labels","134","492447","0.0-49.0-2.0","75332","4B","woman","","","W3 is fighting with M1","fight3","rating_volition","{""Q0"":3}","[0]","M1 wanted to fight W3","W3 wanted to fight M1"
"1135.4450000217184","","","survey-likert-extra-labels","135","493591","0.0-49.0-3.0-0.0","75332","4B","woman","","","W3 is fighting with M1","fight3","rating_causation","{""Q0"":3}","[0]","M1 started the fight with W3","W3 started the fight with M1"
"null","Dave is dancing with Fred","","html-keyboard-response","136","495598","0.0-50.0-0.0","75332","4B","woman","","null","M3 is dancing with M1","dance2","sentence","","","",""
"2213.469999958761","","","survey-likert-extra-labels","137","497815","0.0-50.0-1.0-0.0","75332","4B","woman","","","M3 is dancing with M1","dance2","rating_causation","{""Q0"":3}","[0]","M3 asked M1 to dance","M1 asked M3 to dance"
"2804.6699999831617","","","survey-likert-extra-labels","138","500627","0.0-50.0-2.0","75332","4B","woman","","","M3 is dancing with M1","dance2","rating_volition","{""Q0"":3}","[0]","M3 wanted to dance with M1","M1 wanted to dance with M3"
"null","Dave is talking to Fred","","html-keyboard-response","139","502635","0.0-51.0-0.0","75332","4B","woman","","null","M3 is talking to M1","talk2","sentence","","","",""
"2732.5049999635667","","","survey-likert-extra-labels","140","505370","0.0-51.0-2.0","75332","4B","woman","","","M3 is talking to M1","talk2","rating_volition","{""Q0"":3}","[0]","M3 wanted to talk to M1","M1 wanted to talk to M3"
"1674.5899999514222","","","survey-likert-extra-labels","141","507054","0.0-51.0-3.0-0.0","75332","4B","woman","","","M3 is talking to M1","talk2","rating_causation","{""Q0"":3}","[0]","M3 started a conversation with M1","M1 started a conversation with M3"
"null","Mike is kissing Ruth","","html-keyboard-response","142","509061","0.0-52.0-0.0","75332","4B","woman","","null","M4 is kissing W2","kiss4","sentence","","","",""
"1525.2000000327826","","","survey-likert-extra-labels","143","510590","0.0-52.0-1.0-0.0","75332","4B","woman","","","M4 is kissing W2","kiss4","rating_causation","{""Q0"":3}","[0]","M4 asked to kiss W2","W2 asked to kiss M4"
"1006.6600000718608","","","survey-likert-extra-labels","144","511605","0.0-52.0-2.0","75332","4B","woman","","","M4 is kissing W2","kiss4","rating_volition","{""Q0"":3}","[0]","M4 wanted to kiss W2","W2 wanted to kiss M4"
"null","Beth is feeding Fred","","html-keyboard-response","145","513613","0.0-53.0-0.0","75332","4B","woman","","null","W3 is feeding M1","feed","sentence","","","",""
"8198.815000010654","","","survey-likert-extra-labels","146","521815","0.0-53.0-1.0-0.0","75332","4B","woman","","","W3 is feeding M1","feed","rating_causation","{""Q0"":6}","[0]","W3 is eating M1's food","M1 is eating W3's food"
"3509.1750000137836","","","survey-likert-extra-labels","147","525333","0.0-53.0-2.0","75332","4B","woman","","","W3 is feeding M1","feed","rating_volition","{""Q0"":0}","[0]","W3 is giving M1 food","M1 is giving W3 food"
"null","Luke is reminding Jane","","html-keyboard-response","148","527347","0.0-54.0-0.0","75332","4B","woman","","null","M2 is reminding W4","remind","sentence","","","",""
"4651.745000039227","","","survey-likert-extra-labels","149","532002","0.0-54.0-1.0-0.0","75332","4B","woman","","","M2 is reminding W4","remind","rating_causation","{""Q0"":6}","[0]","M2 is remembering","W4 is remembering"
"3554.935000021942","","","survey-likert-extra-labels","150","535565","0.0-54.0-2.0","75332","4B","woman","","","M2 is reminding W4","remind","rating_volition","{""Q0"":0}","[0]","M2 is telling W4 again","W4 is telling M2 again"
"1748.0050000594929","<p>Thank you for completing that task.</p><p>The final part of this session is a short questionnaire.</p><p>Press Continue.</p>","0","html-button-response","151","537321","0.0-55.0","75332","4B","woman","","","","","","","","",""
"24200.514999916777","","","survey-text","152","562539","0.0-56.0","75332","4B","woman","","","","","demographics","{""Q0"":""27"",""Q1"":""English"",""Q2"":""English"",""Q3"":""England"",""Q4"":""English"",""Q5"":""White"",""Q6"":""Female""}","","",""
"2491.234999964945","<p>Have you lived in the UK for the last 5 years or more?</p>","0","html-button-response","153","565033","0.0-57.0","75332","4B","woman","","","","","fiveyears","","","",""
"6289.494999917224","","","survey-text","154","572335","0.0-58.0","75332","4B","woman","","","","","worker_id","{""Q0"":""5ee57a019e80f50008aba206""}","","",""
"47554.134999983944","","","external-html","155","620007","0.0-59.0","75332","4B","woman","debrief.html","","","","","","","",""
