"rt","stimulus","button_pressed","trial_type","trial_index","time_elapsed","internal_node_id","subject","list","ppt_gender","url","key_press","sentence_type","verb","test_part","responses","question_order","left_part","right_part"
"1269.7249999982305","","","survey-likert-extra-labels","120","503892","0.0-44.0-3.0-0.0","76442","3B","man","","","W2 is kissing M4","kiss4","rating_causation","{""Q0"":3}","[0]","W2 asked to kiss M4","M4 asked to kiss W2"
"null","Beth is shouting at Kate","","html-keyboard-response","121","505914","0.0-45.0-0.0","76442","3B","man","","null","W3 is shouting at W1","shout1","sentence","","","",""
"9000.410000000615","","","survey-likert-extra-labels","122","514916","0.0-45.0-2.0","76442","3B","man","","","W3 is shouting at W1","shout1","rating_volition","{""Q0"":2}","[0]","W1 wanted to shout at W3","W3 wanted to shout at W1"
"2617.535000001255","","","survey-likert-extra-labels","123","517546","0.0-45.0-3.0-0.0","76442","3B","man","","","W3 is shouting at W1","shout1","rating_causation","{""Q0"":3}","[0]","W1 shouted at W3 first","W3 shouted at W1 first"
"null","Mike is touching Luke","","html-keyboard-response","124","519562","0.0-46.0-0.0","76442","3B","man","","null","M4 is touching M2","touch2","sentence","","","",""
"4784.360000001499","","","survey-likert-extra-labels","125","524349","0.0-46.0-1.0-0.0","76442","3B","man","","","M4 is touching M2","touch2","rating_causation","{""Q0"":3}","[0]","M2 asked to touch M4","M4 asked to touch M2"
"4129.195000001346","","","survey-likert-extra-labels","126","528491","0.0-46.0-2.0","76442","3B","man","","","M4 is touching M2","touch2","rating_volition","{""Q0"":3}","[0]","M2 wanted to touch M4","M4 wanted to touch M2"
"null","Kate is arguing with Beth","","html-keyboard-response","127","530504","0.0-47.0-0.0","76442","3B","man","","null","W1 is arguing with W3","argue1","sentence","","","",""
"5624.864999998012","","","survey-likert-extra-labels","128","536131","0.0-47.0-1.0-0.0","76442","3B","man","","","W1 is arguing with W3","argue1","rating_causation","{""Q0"":3}","[0]","W1 started an argument with W3","W3 started an argument with W1"
"3051.8149999988964","","","survey-likert-extra-labels","129","539195","0.0-47.0-2.0","76442","3B","man","","","W1 is arguing with W3","argue1","rating_volition","{""Q0"":3}","[0]","W1 wanted to argue with W3","W3 wanted to argue with W1"
"null","Jane is talking to Luke","","html-keyboard-response","130","541207","0.0-48.0-0.0","76442","3B","man","","null","W4 is talking to M2","talk4","sentence","","","",""
"3065.8149999980815","","","survey-likert-extra-labels","131","544275","0.0-48.0-1.0-0.0","76442","3B","man","","","W4 is talking to M2","talk4","rating_causation","{""Q0"":3}","[0]","M2 started a conversation with W4","W4 started a conversation with M2"
"2907.2200000009034","","","survey-likert-extra-labels","132","547195","0.0-48.0-2.0","76442","3B","man","","","W4 is talking to M2","talk4","rating_volition","{""Q0"":3}","[0]","M2 wanted to talk to W4","W4 wanted to talk to M2"
"null","Fred is arguing with Dave","","html-keyboard-response","133","549205","0.0-49.0-0.0","76442","3B","man","","null","M1 is arguing with M3","argue2","sentence","","","",""
"2882.959999998915","","","survey-likert-extra-labels","134","552090","0.0-49.0-1.0-0.0","76442","3B","man","","","M1 is arguing with M3","argue2","rating_causation","{""Q0"":3}","[0]","M1 started an argument with M3","M3 started an argument with M1"
"3375.725000001723","","","survey-likert-extra-labels","135","555479","0.0-49.0-2.0","76442","3B","man","","","M1 is arguing with M3","argue2","rating_volition","{""Q0"":3}","[0]","M1 wanted to argue with M3","M3 wanted to argue with M1"
"null","Ruth is marrying Jane","","html-keyboard-response","136","557494","0.0-50.0-0.0","76442","3B","man","","null","W2 is marrying W4","marry1","sentence","","","",""
"2233.345000000554","","","survey-likert-extra-labels","137","559729","0.0-50.0-1.0-0.0","76442","3B","man","","","W2 is marrying W4","marry1","rating_causation","{""Q0"":3}","[0]","W2 asked to marry W4","W4 asked to marry W2"
"11391.220000001253","","","survey-likert-extra-labels","138","571134","0.0-50.0-2.0","76442","3B","man","","","W2 is marrying W4","marry1","rating_volition","{""Q0"":3}","[0]","W2 wanted to marry W4","W4 wanted to marry W2"
"null","Fred is touching Beth","","html-keyboard-response","139","573146","0.0-51.0-0.0","76442","3B","man","","null","M1 is touching W3","touch3","sentence","","","",""
"3185.4249999996973","","","survey-likert-extra-labels","140","576334","0.0-51.0-1.0-0.0","76442","3B","man","","","M1 is touching W3","touch3","rating_causation","{""Q0"":3}","[0]","W3 asked to touch M1","M1 asked to touch W3"
"1843.860000000801","","","survey-likert-extra-labels","141","578191","0.0-51.0-2.0","76442","3B","man","","","M1 is touching W3","touch3","rating_volition","{""Q0"":3}","[0]","W3 wanted to touch M1","M1 wanted to touch W3"
"null","Luke is kissing Jane","","html-keyboard-response","142","580205","0.0-52.0-0.0","76442","3B","man","","null","M2 is kissing W4","kiss3","sentence","","","",""
"1999.0950000028824","","","survey-likert-extra-labels","143","582207","0.0-52.0-2.0","76442","3B","man","","","M2 is kissing W4","kiss3","rating_volition","{""Q0"":3}","[0]","M2 wanted to kiss W4","W4 wanted to kiss M2"
"2838.0250000009546","","","survey-likert-extra-labels","144","585056","0.0-52.0-3.0-0.0","76442","3B","man","","","M2 is kissing W4","kiss3","rating_causation","{""Q0"":3}","[0]","M2 asked to kiss W4","W4 asked to kiss M2"
"null","Luke is reminding Jane","","html-keyboard-response","145","587068","0.0-53.0-0.0","76442","3B","man","","null","M2 is reminding W4","remind","sentence","","","",""
"4592.189999999362","","","survey-likert-extra-labels","146","591662","0.0-53.0-2.0","76442","3B","man","","","M2 is reminding W4","remind","rating_volition","{""Q0"":0}","[0]","M2 is telling W4 again","W4 is telling M2 again"
"10933.815000000293","","","survey-likert-extra-labels","147","602610","0.0-53.0-3.0-0.0","76442","3B","man","","","M2 is reminding W4","remind","rating_causation","{""Q0"":6}","[0]","M2 is remembering","W4 is remembering"
"null","Luke is arguing with Jane","","html-keyboard-response","148","604628","0.0-54.0-0.0","76442","3B","man","","null","M2 is arguing with W4","argue4","sentence","","","",""
"3512.1599999982864","","","survey-likert-extra-labels","149","608143","0.0-54.0-2.0","76442","3B","man","","","M2 is arguing with W4","argue4","rating_volition","{""Q0"":3}","[0]","M2 wanted to argue with W4","W4 wanted to argue with M2"
"2364.6149999985937","","","survey-likert-extra-labels","150","610521","0.0-54.0-3.0-0.0","76442","3B","man","","","M2 is arguing with W4","argue4","rating_causation","{""Q0"":3}","[0]","M2 started an argument with W4","W4 started an argument with M2"
"1841.2500000012806","<p>Thank you for completing that task.</p><p>The final part of this session is a short questionnaire.</p><p>Press Continue.</p>","0","html-button-response","151","612373","0.0-55.0","76442","3B","man","","","","","","","","",""
"69358.78500000038","","","survey-text","152","682763","0.0-56.0","76442","3B","man","","","","","demographics","{""Q0"":""26"",""Q1"":""english"",""Q2"":""english"",""Q3"":""england"",""Q4"":""english"",""Q5"":""caucasian"",""Q6"":""male""}","","",""
"1700.2950000024866","<p>Have you lived in the UK for the last 5 years or more?</p>","0","html-button-response","153","684469","0.0-57.0","76442","3B","man","","","","","fiveyears","","","",""
"9311.05000000028","","","survey-text","154","694809","0.0-58.0","76442","3B","man","","","","","worker_id","{""Q0"":""5c13d54cce422b0001d6f05c""}","","",""
"69273.46000000031","","","external-html","155","764153","0.0-59.0","76442","3B","man","debrief.html","","","","","","","",""
