"rt","stimulus","button_pressed","trial_type","trial_index","time_elapsed","internal_node_id","subject","list","ppt_gender","url","key_press","sentence_type","verb","test_part","responses","question_order","left_part","right_part"
"2309.450000000652","Welcome to the experiment. Press Continue to begin.","0","html-button-response","0","2315","0.0-0.0","76442","3B","man","","","","","","","","",""
"25405.790000000707","","","external-html","1","28771","0.0-1.0","76442","3B","man","consent.html","","","","","","","",""
"11684.11500000002","<p>Welcome.</p><p>In this experiment we will ask you to imagine some situations.</p><p>Each trial starts with a description of an event.</p><p>Then you will see alternative descriptions of that event, and you will rate on a scale how best they match the original description.</p><p>You will give your answer by clicking a button on a rating scale.</p><p>To do this task, you will have to use your imagination to visualise these events.</p><br><p>Ready?</p>","0","html-button-response","2","40458","0.0-2.0","76442","3B","man","","","","","","","","",""
"2242.1400000021094","<p>Before the experiment starts, you will watch an example trial. Press 'Continue'.</p>","0","html-button-response","3","43718","0.0-3.0","76442","3B","man","","","","","","","","",""
"null","The police officer is arresting the robber","","html-keyboard-response","4","46741","0.0-4.0","76442","3B","man","","null","","","","","","",""
"10422.10999999952","<img src='img/Example-trial.jpg' style='height:550px;''></img>","0","html-button-response","5","57165","0.0-5.0","76442","3B","man","","","","","","","","",""
"3076.8299999981537","<p>Ready to start the experiment?</p><br><p><strong>Remember to give an answer by clicking a button on the rating scale.</strong></p><p>Press 'Continue' to begin.</p>","0","html-button-response","6","61246","0.0-6.0","76442","3B","man","","","","","","","","",""
"null","Jane is touching Ruth","","html-keyboard-response","7","64263","0.0-7.0-0.0","76442","3B","man","","null","W4 is touching W2","touch1","sentence","","","",""
"8324.819999997999","","","survey-likert-extra-labels","8","72592","0.0-7.0-1.0-0.0","76442","3B","man","","","W4 is touching W2","touch1","rating_causation","{""Q0"":3}","[0]","W2 asked to touch W4","W4 asked to touch W2"
"9211.325000000215","","","survey-likert-extra-labels","9","81815","0.0-7.0-2.0","76442","3B","man","","","W4 is touching W2","touch1","rating_volition","{""Q0"":4}","[0]","W2 wanted to touch W4","W4 wanted to touch W2"
"null","Fred is driving Dave","","html-keyboard-response","10","83829","0.0-8.0-0.0","76442","3B","man","","null","M1 is driving M3","drive","sentence","","","",""
"5848.394999997254","","","survey-likert-extra-labels","11","89680","0.0-8.0-2.0","76442","3B","man","","","M1 is driving M3","drive","rating_volition","{""Q0"":0}","[0]","M3 is M1's passenger","M1 is M3's passenger"
"9363.349999999627","","","survey-likert-extra-labels","12","99057","0.0-8.0-3.0-0.0","76442","3B","man","","","M1 is driving M3","drive","rating_causation","{""Q0"":5}","[0]","M3 is taking M1 somewhere","M1 is taking M3 somewhere"
"null","Ruth is fighting with Jane","","html-keyboard-response","13","101080","0.0-9.0-0.0","76442","3B","man","","null","W2 is fighting with W4","fight1","sentence","","","",""
"6100.279999998747","","","survey-likert-extra-labels","14","107183","0.0-9.0-1.0-0.0","76442","3B","man","","","W2 is fighting with W4","fight1","rating_causation","{""Q0"":3}","[0]","W2 started the fight with W4","W4 started the fight with W2"
"4115.884999999253","","","survey-likert-extra-labels","15","111312","0.0-9.0-2.0","76442","3B","man","","","W2 is fighting with W4","fight1","rating_volition","{""Q0"":3}","[0]","W2 wanted to fight W4","W4 wanted to fight W2"
"null","Dave is dancing with Fred","","html-keyboard-response","16","113339","0.0-10.0-0.0","76442","3B","man","","null","M3 is dancing with M1","dance2","sentence","","","",""
"4265.194999999949","","","survey-likert-extra-labels","17","117607","0.0-10.0-2.0","76442","3B","man","","","M3 is dancing with M1","dance2","rating_volition","{""Q0"":3}","[0]","M1 wanted to dance with M3","M3 wanted to dance with M1"
"3119.314999999915","","","survey-likert-extra-labels","18","120739","0.0-10.0-3.0-0.0","76442","3B","man","","","M3 is dancing with M1","dance2","rating_causation","{""Q0"":3}","[0]","M1 asked M3 to dance","M3 asked M1 to dance"
"null","Kate is playing with Dave","","html-keyboard-response","19","122752","0.0-11.0-0.0","76442","3B","man","","null","W1 is playing with M3","play3","sentence","","","",""
"5884.045000002516","","","survey-likert-extra-labels","20","128639","0.0-11.0-2.0","76442","3B","man","","","W1 is playing with M3","play3","rating_volition","{""Q0"":3}","[0]","M3 wanted to play with W1","W1 wanted to play with M3"
"4562.470000000758","","","survey-likert-extra-labels","21","133215","0.0-11.0-3.0-0.0","76442","3B","man","","","W1 is playing with M3","play3","rating_causation","{""Q0"":3}","[0]","M3 asked to play with W1","W1 asked to play with M3"
"null","Dave is talking to Fred","","html-keyboard-response","22","135234","0.0-12.0-0.0","76442","3B","man","","null","M3 is talking to M1","talk2","sentence","","","",""
"7348.229999999603","","","survey-likert-extra-labels","23","142584","0.0-12.0-2.0","76442","3B","man","","","M3 is talking to M1","talk2","rating_volition","{""Q0"":3}","[0]","M1 wanted to talk to M3","M3 wanted to talk to M1"
"4514.285000001109","","","survey-likert-extra-labels","24","147111","0.0-12.0-3.0-0.0","76442","3B","man","","","M3 is talking to M1","talk2","rating_causation","{""Q0"":3}","[0]","M1 started a conversation with M3","M3 started a conversation with M1"
"null","Ruth is arguing with Mike","","html-keyboard-response","25","149128","0.0-13.0-0.0","76442","3B","man","","null","W2 is arguing with M4","argue3","sentence","","","",""
"4748.5950000009325","","","survey-likert-extra-labels","26","153880","0.0-13.0-2.0","76442","3B","man","","","W2 is arguing with M4","argue3","rating_volition","{""Q0"":3}","[0]","W2 wanted to argue with M4","M4 wanted to argue with W2"
"3324.0699999987555","","","survey-likert-extra-labels","27","157215","0.0-13.0-3.0-0.0","76442","3B","man","","","W2 is arguing with M4","argue3","rating_causation","{""Q0"":3}","[0]","W2 started an argument with M4","M4 started an argument with W2"
"null","Mike is dancing with Ruth","","html-keyboard-response","28","159233","0.0-14.0-0.0","76442","3B","man","","null","M4 is dancing with W2","dance3","sentence","","","",""
"6077.500000003056","","","survey-likert-extra-labels","29","165313","0.0-14.0-1.0-0.0","76442","3B","man","","","M4 is dancing with W2","dance3","rating_causation","{""Q0"":3}","[0]","W2 asked M4 to dance","M4 asked W2 to dance"
"5055.780000002414","","","survey-likert-extra-labels","30","170380","0.0-14.0-2.0","76442","3B","man","","","M4 is dancing with W2","dance3","rating_volition","{""Q0"":3}","[0]","W2 wanted to dance with M4","M4 wanted to dance with W2"
"null","Jane is shouting at Luke","","html-keyboard-response","31","172396","0.0-15.0-0.0","76442","3B","man","","null","W4 is shouting at M2","shout3","sentence","","","",""
"3932.669999998325","","","survey-likert-extra-labels","32","176331","0.0-15.0-2.0","76442","3B","man","","","W4 is shouting at M2","shout3","rating_volition","{""Q0"":3}","[0]","M2 wanted to shout at W4","W4 wanted to shout at M2"
"9838.425000001735","","","survey-likert-extra-labels","33","186182","0.0-15.0-3.0-0.0","76442","3B","man","","","W4 is shouting at M2","shout3","rating_causation","{""Q0"":4}","[0]","M2 shouted at W4 first","W4 shouted at M2 first"
"null","Fred is flirting with Beth","","html-keyboard-response","34","188209","0.0-16.0-0.0","76442","3B","man","","null","M1 is flirting with W3","flirt3","sentence","","","",""
"11697.609999999258","","","survey-likert-extra-labels","35","199909","0.0-16.0-1.0-0.0","76442","3B","man","","","M1 is flirting with W3","flirt3","rating_causation","{""Q0"":3}","[0]","W3 started flirting with M1 first","M1 started flirting with W3 first"
"8835.43500000087","","","survey-likert-extra-labels","36","208757","0.0-16.0-2.0","76442","3B","man","","","M1 is flirting with W3","flirt3","rating_volition","{""Q0"":4}","[0]","W3 wanted to flirt with M1","M1 wanted to flirt with W3"
"null","Beth is marrying Fred","","html-keyboard-response","37","210781","0.0-17.0-0.0","76442","3B","man","","null","W3 is marrying M1","marry4","sentence","","","",""
"6451.984999999695","","","survey-likert-extra-labels","38","217235","0.0-17.0-1.0-0.0","76442","3B","man","","","W3 is marrying M1","marry4","rating_causation","{""Q0"":3}","[0]","W3 asked to marry M1","M1 asked to marry W3"
"5406.79000000091","","","survey-likert-extra-labels","39","222655","0.0-17.0-2.0","76442","3B","man","","","W3 is marrying M1","marry4","rating_volition","{""Q0"":3}","[0]","W3 wanted to marry M1","M1 wanted to marry W3"
"null","Mike is playing with Luke","","html-keyboard-response","40","224669","0.0-18.0-0.0","76442","3B","man","","null","M4 is playing with M2","play2","sentence","","","",""
"4475.054999998974","","","survey-likert-extra-labels","41","229146","0.0-18.0-2.0","76442","3B","man","","","M4 is playing with M2","play2","rating_volition","{""Q0"":3}","[0]","M2 wanted to play with M4","M4 wanted to play with M2"
"3979.350000001432","","","survey-likert-extra-labels","42","233138","0.0-18.0-3.0-0.0","76442","3B","man","","","M4 is playing with M2","play2","rating_causation","{""Q0"":3}","[0]","M2 asked to play with M4","M4 asked to play with M2"
"null","Mike is shouting at Ruth","","html-keyboard-response","43","235150","0.0-19.0-0.0","76442","3B","man","","null","M4 is shouting at W2","shout4","sentence","","","",""
"10370.315000000119","","","survey-likert-extra-labels","44","245524","0.0-19.0-2.0","76442","3B","man","","","M4 is shouting at W2","shout4","rating_volition","{""Q0"":4}","[0]","W2 wanted to shout at M4","M4 wanted to shout at W2"
"5170.105000001058","","","survey-likert-extra-labels","45","250707","0.0-19.0-3.0-0.0","76442","3B","man","","","M4 is shouting at W2","shout4","rating_causation","{""Q0"":3}","[0]","W2 shouted at M4 first","M4 shouted at W2 first"
"null","Kate is chasing Beth","","html-keyboard-response","46","252723","0.0-20.0-0.0","76442","3B","man","","null","W1 is chasing W3","chase","sentence","","","",""
"6221.8900000007125","","","survey-likert-extra-labels","47","258947","0.0-20.0-1.0-0.0","76442","3B","man","","","W1 is chasing W3","chase","rating_causation","{""Q0"":6}","[0]","W1 is running away from W3","W3 is running away from W1"
"7274.414999999863","","","survey-likert-extra-labels","48","266235","0.0-20.0-2.0","76442","3B","man","","","W1 is chasing W3","chase","rating_volition","{""Q0"":0}","[0]","W1 is behind W3","W3 is behind W1"
"null","Fred is kissing Dave","","html-keyboard-response","49","268255","0.0-21.0-0.0","76442","3B","man","","null","M1 is kissing M3","kiss2","sentence","","","",""
"4221.550000002026","","","survey-likert-extra-labels","50","272479","0.0-21.0-2.0","76442","3B","man","","","M1 is kissing M3","kiss2","rating_volition","{""Q0"":3}","[0]","M1 wanted to kiss M3","M3 wanted to kiss M1"
"3823.5400000012014","","","survey-likert-extra-labels","51","276315","0.0-21.0-3.0-0.0","76442","3B","man","","","M1 is kissing M3","kiss2","rating_causation","{""Q0"":3}","[0]","M1 asked to kiss M3","M3 asked to kiss M1"
"null","Ruth is teaching Mike","","html-keyboard-response","52","278341","0.0-22.0-0.0","76442","3B","man","","null","W2 is teaching M4","teach","sentence","","","",""
"5611.079999998736","","","survey-likert-extra-labels","53","283955","0.0-22.0-2.0","76442","3B","man","","","W2 is teaching M4","teach","rating_volition","{""Q0"":0}","[0]","W2 is educating M4","M4 is educating W2"
"3963.4650000007823","","","survey-likert-extra-labels","54","287931","0.0-22.0-3.0-0.0","76442","3B","man","","","W2 is teaching M4","teach","rating_causation","{""Q0"":6}","[0]","W2 is learning from M4","M4 is learning from W2"
"null","Luke is marrying Mike","","html-keyboard-response","55","289949","0.0-23.0-0.0","76442","3B","man","","null","M2 is marrying M4","marry2","sentence","","","",""
"2431.524999999965","","","survey-likert-extra-labels","56","292383","0.0-23.0-1.0-0.0","76442","3B","man","","","M2 is marrying M4","marry2","rating_causation","{""Q0"":3}","[0]","M2 asked to marry M4","M4 asked to marry M2"
"2454.235000001092","","","survey-likert-extra-labels","57","294851","0.0-23.0-2.0","76442","3B","man","","","M2 is marrying M4","marry2","rating_volition","{""Q0"":3}","[0]","M2 wanted to marry M4","M4 wanted to marry M2"
"null","Dave is shouting at Fred","","html-keyboard-response","58","296870","0.0-24.0-0.0","76442","3B","man","","null","M3 is shouting at M1","shout2","sentence","","","",""
"5401.35999999987","","","survey-likert-extra-labels","59","302275","0.0-24.0-1.0-0.0","76442","3B","man","","","M3 is shouting at M1","shout2","rating_causation","{""Q0"":3}","[0]","M1 shouted at M3 first","M3 shouted at M1 first"
"1854.3949999985052","","","survey-likert-extra-labels","60","304143","0.0-24.0-2.0","76442","3B","man","","","M3 is shouting at M1","shout2","rating_volition","{""Q0"":3}","[0]","M1 wanted to shout at M3","M3 wanted to shout at M1"
"null","Dave is hiring Kate","","html-keyboard-response","61","306164","0.0-25.0-0.0","76442","3B","man","","null","M3 is hiring W1","hire","sentence","","","",""
"4393.084999999672","","","survey-likert-extra-labels","62","310559","0.0-25.0-2.0","76442","3B","man","","","M3 is hiring W1","hire","rating_volition","{""Q0"":0}","[0]","M3 is employing W1","W1 is employing M3"
"4828.050000000047","","","survey-likert-extra-labels","63","315399","0.0-25.0-3.0-0.0","76442","3B","man","","","M3 is hiring W1","hire","rating_causation","{""Q0"":6}","[0]","M3 will work for W1","W1 will work for M3"
"null","Fred is playing with Beth","","html-keyboard-response","64","317418","0.0-26.0-0.0","76442","3B","man","","null","M1 is playing with W3","play4","sentence","","","",""
"3403.1700000013807","","","survey-likert-extra-labels","65","320825","0.0-26.0-1.0-0.0","76442","3B","man","","","M1 is playing with W3","play4","rating_causation","{""Q0"":3}","[0]","W3 asked to play with M1","M1 asked to play with W3"
"3241.8150000012247","","","survey-likert-extra-labels","66","324078","0.0-26.0-2.0","76442","3B","man","","","M1 is playing with W3","play4","rating_volition","{""Q0"":3}","[0]","W3 wanted to play with M1","M1 wanted to play with W3"
"null","Dave is fighting with Kate","","html-keyboard-response","67","326097","0.0-27.0-0.0","76442","3B","man","","null","M3 is fighting with W1","fight4","sentence","","","",""
"3131.0449999982957","","","survey-likert-extra-labels","68","329230","0.0-27.0-1.0-0.0","76442","3B","man","","","M3 is fighting with W1","fight4","rating_causation","{""Q0"":3}","[0]","M3 started the fight with W1","W1 started the fight with M3"
"2413.029999999737","","","survey-likert-extra-labels","69","331657","0.0-27.0-2.0","76442","3B","man","","","M3 is fighting with W1","fight4","rating_volition","{""Q0"":3}","[0]","M3 wanted to fight W1","W1 wanted to fight M3"
"null","Jane is dancing with Luke","","html-keyboard-response","70","333671","0.0-28.0-0.0","76442","3B","man","","null","W4 is dancing with M2","dance4","sentence","","","",""
"2261.1900000011083","","","survey-likert-extra-labels","71","335935","0.0-28.0-2.0","76442","3B","man","","","W4 is dancing with M2","dance4","rating_volition","{""Q0"":3}","[0]","M2 wanted to dance with W4","W4 wanted to dance with M2"
"4060.0400000003283","","","survey-likert-extra-labels","72","340007","0.0-28.0-3.0-0.0","76442","3B","man","","","W4 is dancing with M2","dance4","rating_causation","{""Q0"":3}","[0]","M2 asked W4 to dance","W4 asked M2 to dance"
"null","Kate is kissing Beth","","html-keyboard-response","73","342034","0.0-29.0-0.0","76442","3B","man","","null","W1 is kissing W3","kiss1","sentence","","","",""
"2620.5499999996973","","","survey-likert-extra-labels","74","344657","0.0-29.0-2.0","76442","3B","man","","","W1 is kissing W3","kiss1","rating_volition","{""Q0"":3}","[0]","W1 wanted to kiss W3","W3 wanted to kiss W1"
"2934.3100000005215","","","survey-likert-extra-labels","75","347603","0.0-29.0-3.0-0.0","76442","3B","man","","","W1 is kissing W3","kiss1","rating_causation","{""Q0"":3}","[0]","W1 asked to kiss W3","W3 asked to kiss W1"
"null","Beth is dancing with Kate","","html-keyboard-response","76","349614","0.0-30.0-0.0","76442","3B","man","","null","W3 is dancing with W1","dance1","sentence","","","",""
"3478.565000001283","","","survey-likert-extra-labels","77","353095","0.0-30.0-2.0","76442","3B","man","","","W3 is dancing with W1","dance1","rating_volition","{""Q0"":3}","[0]","W1 wanted to dance with W3","W3 wanted to dance with W1"
"2212.104999998701","","","survey-likert-extra-labels","78","355319","0.0-30.0-3.0-0.0","76442","3B","man","","","W3 is dancing with W1","dance1","rating_causation","{""Q0"":3}","[0]","W1 asked W3 to dance","W3 asked W1 to dance"
"null","Jane is playing with Ruth","","html-keyboard-response","79","357338","0.0-31.0-0.0","76442","3B","man","","null","W4 is playing with W2","play1","sentence","","","",""
"4099.024999999499","","","survey-likert-extra-labels","80","361439","0.0-31.0-1.0-0.0","76442","3B","man","","","W4 is playing with W2","play1","rating_causation","{""Q0"":3}","[0]","W2 asked to play with W4","W4 asked to play with W2"
"3131.485000001674","","","survey-likert-extra-labels","81","364582","0.0-31.0-2.0","76442","3B","man","","","W4 is playing with W2","play1","rating_volition","{""Q0"":3}","[0]","W2 wanted to play with W4","W4 wanted to play with W2"
"null","Mike is flirting with Luke","","html-keyboard-response","82","366594","0.0-32.0-0.0","76442","3B","man","","null","M4 is flirting with M2","flirt2","sentence","","","",""
"4738.520000002638","","","survey-likert-extra-labels","83","371335","0.0-32.0-1.0-0.0","76442","3B","man","","","M4 is flirting with M2","flirt2","rating_causation","{""Q0"":3}","[0]","M2 started flirting with M4 first","M4 started flirting with M2 first"
"7211.530000000494","","","survey-likert-extra-labels","84","378559","0.0-32.0-2.0","76442","3B","man","","","M4 is flirting with M2","flirt2","rating_volition","{""Q0"":4}","[0]","M2 wanted to flirt with M4","M4 wanted to flirt with M2"
"null","Beth is fighting with Fred","","html-keyboard-response","85","380577","0.0-33.0-0.0","76442","3B","man","","null","W3 is fighting with M1","fight3","sentence","","","",""
"3939.300000001851","","","survey-likert-extra-labels","86","384519","0.0-33.0-1.0-0.0","76442","3B","man","","","W3 is fighting with M1","fight3","rating_causation","{""Q0"":3}","[0]","W3 started the fight with M1","M1 started the fight with W3"
"3444.765000000247","","","survey-likert-extra-labels","87","387975","0.0-33.0-2.0","76442","3B","man","","","W3 is fighting with M1","fight3","rating_volition","{""Q0"":3}","[0]","W3 wanted to fight M1","M1 wanted to fight W3"
"null","Jane is flirting with Ruth","","html-keyboard-response","88","389990","0.0-34.0-0.0","76442","3B","man","","null","W4 is flirting with W2","flirt1","sentence","","","",""
"11518.319999999192","","","survey-likert-extra-labels","89","401511","0.0-34.0-2.0","76442","3B","man","","","W4 is flirting with W2","flirt1","rating_volition","{""Q0"":4}","[0]","W2 wanted to flirt with W4","W4 wanted to flirt with W2"
"3649.904999998398","","","survey-likert-extra-labels","90","405175","0.0-34.0-3.0-0.0","76442","3B","man","","","W4 is flirting with W2","flirt1","rating_causation","{""Q0"":3}","[0]","W2 started flirting with W4 first","W4 started flirting with W2 first"
"null","Ruth is carrying Jane","","html-keyboard-response","91","407194","0.0-35.0-0.0","76442","3B","man","","null","W2 is carrying W4","carry","sentence","","","",""
"5985.720000000554","","","survey-likert-extra-labels","92","413183","0.0-35.0-1.0-0.0","76442","3B","man","","","W2 is carrying W4","carry","rating_causation","{""Q0"":6}","[0]","W2 is being moved by W4","W4 is being moved by W2"
"5332.470000001194","","","survey-likert-extra-labels","93","418527","0.0-35.0-2.0","76442","3B","man","","","W2 is carrying W4","carry","rating_volition","{""Q0"":0}","[0]","W2 is transporting W4","W4 is transporting W2"
"null","Luke is posing for Mike","","html-keyboard-response","94","420546","0.0-36.0-0.0","76442","3B","man","","null","M2 is posing for M4","pose","sentence","","","",""
"6378.505000000587","","","survey-likert-extra-labels","95","426927","0.0-36.0-2.0","76442","3B","man","","","M2 is posing for M4","pose","rating_volition","{""Q0"":1}","[0]","M2 is modelling for M4","M4 is modelling for M2"
"5795.894999999262","","","survey-likert-extra-labels","96","432734","0.0-36.0-3.0-0.0","76442","3B","man","","","M2 is posing for M4","pose","rating_causation","{""Q0"":5}","[0]","M2 is photographing M4","M4 is photographing M2"
"null","Beth is feeding Fred","","html-keyboard-response","97","434747","0.0-37.0-0.0","76442","3B","man","","null","W3 is feeding M1","feed","sentence","","","",""
"5510.904999999155","","","survey-likert-extra-labels","98","440260","0.0-37.0-2.0","76442","3B","man","","","W3 is feeding M1","feed","rating_volition","{""Q0"":0}","[0]","W3 is giving M1 food","M1 is giving W3 food"
"4649.114999996556","","","survey-likert-extra-labels","99","444922","0.0-37.0-3.0-0.0","76442","3B","man","","","W3 is feeding M1","feed","rating_causation","{""Q0"":6}","[0]","W3 is eating M1's food","M1 is eating W3's food"
"null","Luke is fighting with Mike","","html-keyboard-response","100","446933","0.0-38.0-0.0","76442","3B","man","","null","M2 is fighting with M4","fight2","sentence","","","",""
"3697.9500000015832","","","survey-likert-extra-labels","101","450635","0.0-38.0-2.0","76442","3B","man","","","M2 is fighting with M4","fight2","rating_volition","{""Q0"":3}","[0]","M2 wanted to fight M4","M4 wanted to fight M2"
"3226.969999999681","","","survey-likert-extra-labels","102","453875","0.0-38.0-3.0-0.0","76442","3B","man","","","M2 is fighting with M4","fight2","rating_causation","{""Q0"":3}","[0]","M2 started the fight with M4","M4 started the fight with M2"
"null","Dave is marrying Kate","","html-keyboard-response","103","455889","0.0-39.0-0.0","76442","3B","man","","null","M3 is marrying W1","marry3","sentence","","","",""
"5327.4749999982305","","","survey-likert-extra-labels","104","461219","0.0-39.0-2.0","76442","3B","man","","","M3 is marrying W1","marry3","rating_volition","{""Q0"":3}","[0]","M3 wanted to marry W1","W1 wanted to marry M3"
"3224.405000000843","","","survey-likert-extra-labels","105","464458","0.0-39.0-3.0-0.0","76442","3B","man","","","M3 is marrying W1","marry3","rating_causation","{""Q0"":3}","[0]","M3 asked to marry W1","W1 asked to marry M3"
"null","Kate is flirting with Dave","","html-keyboard-response","106","466479","0.0-40.0-0.0","76442","3B","man","","null","W1 is flirting with M3","flirt4","sentence","","","",""
"3417.6249999981956","","","survey-likert-extra-labels","107","469899","0.0-40.0-2.0","76442","3B","man","","","W1 is flirting with M3","flirt4","rating_volition","{""Q0"":4}","[0]","M3 wanted to flirt with W1","W1 wanted to flirt with M3"
"2538.7699999992037","","","survey-likert-extra-labels","108","472451","0.0-40.0-3.0-0.0","76442","3B","man","","","W1 is flirting with M3","flirt4","rating_causation","{""Q0"":3}","[0]","M3 started flirting with W1 first","W1 started flirting with M3 first"
"null","Beth is talking to Kate","","html-keyboard-response","109","474477","0.0-41.0-0.0","76442","3B","man","","null","W3 is talking to W1","talk1","sentence","","","",""
"2805.284999998519","","","survey-likert-extra-labels","110","477287","0.0-41.0-2.0","76442","3B","man","","","W3 is talking to W1","talk1","rating_volition","{""Q0"":3}","[0]","W1 wanted to talk to W3","W3 wanted to talk to W1"
"4031.7399999985355","","","survey-likert-extra-labels","111","481331","0.0-41.0-3.0-0.0","76442","3B","man","","","W3 is talking to W1","talk1","rating_causation","{""Q0"":3}","[0]","W1 started a conversation with W3","W3 started a conversation with W1"
"null","Kate is touching Dave","","html-keyboard-response","112","483354","0.0-42.0-0.0","76442","3B","man","","null","W1 is touching M3","touch4","sentence","","","",""
"3344.93499999732","","","survey-likert-extra-labels","113","486715","0.0-42.0-1.0-0.0","76442","3B","man","","","W1 is touching M3","touch4","rating_causation","{""Q0"":3}","[0]","M3 asked to touch W1","W1 asked to touch M3"
"3138.484999999462","","","survey-likert-extra-labels","114","489868","0.0-42.0-2.0","76442","3B","man","","","W1 is touching M3","touch4","rating_volition","{""Q0"":3}","[0]","M3 wanted to touch W1","W1 wanted to touch M3"
"null","Mike is talking to Ruth","","html-keyboard-response","115","491893","0.0-43.0-0.0","76442","3B","man","","null","M4 is talking to W2","talk3","sentence","","","",""
"3241.794999998063","","","survey-likert-extra-labels","116","495138","0.0-43.0-1.0-0.0","76442","3B","man","","","M4 is talking to W2","talk3","rating_causation","{""Q0"":3}","[0]","W2 started a conversation with M4","M4 started a conversation with W2"
"3389.4550000004238","","","survey-likert-extra-labels","117","498539","0.0-43.0-2.0","76442","3B","man","","","M4 is talking to W2","talk3","rating_volition","{""Q0"":3}","[0]","W2 wanted to talk to M4","M4 wanted to talk to W2"
"null","Ruth is kissing Mike","","html-keyboard-response","118","500564","0.0-44.0-0.0","76442","3B","man","","null","W2 is kissing M4","kiss4","sentence","","","",""
"2043.130000001809","","","survey-likert-extra-labels","119","502610","0.0-44.0-2.0","76442","3B","man","","","W2 is kissing M4","kiss4","rating_volition","{""Q0"":3}","[0]","W2 wanted to kiss M4","M4 wanted to kiss W2"
