"rt","stimulus","button_pressed","trial_type","trial_index","time_elapsed","internal_node_id","subject","list","condition","ppt_gender","url","key_press","sentence_type","verb","test_part","responses","question_order","left_part","right_part"
"1291.9299999484792","","","survey-likert-extra-labels","105","2682221","0.0-39.0-2.0","56062","4B","conjoined","man","","","M2 and W4 are shouting at each other","shout3","rating_volition","{""Q0"":3}","[0]","W4 wanted to shout at M2","M2 wanted to shout at W4"
"null","Mike and Ruth are kissing each other","","html-keyboard-response","106","2684226","0.0-40.0-0.0","56062","4B","conjoined","man","","null","M4 and W2 are kissing each other","kiss4","sentence","","","",""
"2029.439999954775","","","survey-likert-extra-labels","107","2686265","0.0-40.0-1.0-0.0","56062","4B","conjoined","man","","","M4 and W2 are kissing each other","kiss4","rating_causation","{""Q0"":3}","[0]","M4 asked to kiss W2","W2 asked to kiss M4"
"1310.2700000163168","","","survey-likert-extra-labels","108","2687581","0.0-40.0-2.0","56062","4B","conjoined","man","","","M4 and W2 are kissing each other","kiss4","rating_volition","{""Q0"":3}","[0]","M4 wanted to kiss W2","W2 wanted to kiss M4"
"null","Dave and Fred are kissing each other","","html-keyboard-response","109","2689588","0.0-41.0-0.0","56062","4B","conjoined","man","","null","M3 and M1 are kissing each other","kiss2","sentence","","","",""
"2662.2199999401346","","","survey-likert-extra-labels","110","2692260","0.0-41.0-2.0","56062","4B","conjoined","man","","","M3 and M1 are kissing each other","kiss2","rating_volition","{""Q0"":3}","[0]","M3 wanted to kiss M1","M1 wanted to kiss M3"
"1292.284999974072","","","survey-likert-extra-labels","111","2693558","0.0-41.0-3.0-0.0","56062","4B","conjoined","man","","","M3 and M1 are kissing each other","kiss2","rating_causation","{""Q0"":3}","[0]","M3 asked to kiss M1","M1 asked to kiss M3"
"null","Mike and Luke are flirting with each other","","html-keyboard-response","112","2695564","0.0-42.0-0.0","56062","4B","conjoined","man","","null","M4 and M2 are flirting with each other","flirt2","sentence","","","",""
"12810.120000038296","","","survey-likert-extra-labels","113","2708384","0.0-42.0-1.0-0.0","56062","4B","conjoined","man","","","M4 and M2 are flirting with each other","flirt2","rating_causation","{""Q0"":3}","[0]","M4 started flirting with M2 first","M2 started flirting with M4 first"
"2123.064999934286","","","survey-likert-extra-labels","114","2710513","0.0-42.0-2.0","56062","4B","conjoined","man","","","M4 and M2 are flirting with each other","flirt2","rating_volition","{""Q0"":3}","[0]","M4 wanted to flirt with M2","M2 wanted to flirt with M4"
"null","Fred and Dave are shouting at each other","","html-keyboard-response","115","2712520","0.0-43.0-0.0","56062","4B","conjoined","man","","null","M1 and M3 are shouting at each other","shout2","sentence","","","",""
"39552.09000001196","","","survey-likert-extra-labels","116","2752084","0.0-43.0-2.0","56062","4B","conjoined","man","","","M1 and M3 are shouting at each other","shout2","rating_volition","{""Q0"":3}","[0]","M3 wanted to shout at M1","M1 wanted to shout at M3"
"1275.0249999808148","","","survey-likert-extra-labels","117","2753366","0.0-43.0-3.0-0.0","56062","4B","conjoined","man","","","M1 and M3 are shouting at each other","shout2","rating_causation","{""Q0"":3}","[0]","M3 shouted at M1 first","M1 shouted at M3 first"
"null","Mike and Ruth are dancing with each other","","html-keyboard-response","118","2755370","0.0-44.0-0.0","56062","4B","conjoined","man","","null","M4 and W2 are dancing with each other","dance3","sentence","","","",""
"1089.365000021644","","","survey-likert-extra-labels","119","2756466","0.0-44.0-2.0","56062","4B","conjoined","man","","","M4 and W2 are dancing with each other","dance3","rating_volition","{""Q0"":3}","[0]","M4 wanted to dance with W2","W2 wanted to dance with M4"
"1196.5249999193475","","","survey-likert-extra-labels","120","2757668","0.0-44.0-3.0-0.0","56062","4B","conjoined","man","","","M4 and W2 are dancing with each other","dance3","rating_causation","{""Q0"":3}","[0]","M4 asked W2 to dance","W2 asked M4 to dance"
"null","Jane and Luke are talking to each other","","html-keyboard-response","121","2759673","0.0-45.0-0.0","56062","4B","conjoined","man","","null","W4 and M2 are talking to each other","talk4","sentence","","","",""
"1010.9549999469891","","","survey-likert-extra-labels","122","2760696","0.0-45.0-2.0","56062","4B","conjoined","man","","","W4 and M2 are talking to each other","talk4","rating_volition","{""Q0"":3}","[0]","W4 wanted to talk to M2","M2 wanted to talk to W4"
"1748.615000047721","","","survey-likert-extra-labels","123","2762450","0.0-45.0-3.0-0.0","56062","4B","conjoined","man","","","W4 and M2 are talking to each other","talk4","rating_causation","{""Q0"":3}","[0]","W4 started a conversation with M2","M2 started a conversation with W4"
"null","Fred and Beth are flirting with each other","","html-keyboard-response","124","2764457","0.0-46.0-0.0","56062","4B","conjoined","man","","null","M1 and W3 are flirting with each other","flirt3","sentence","","","",""
"836.9500000262633","","","survey-likert-extra-labels","125","2765303","0.0-46.0-1.0-0.0","56062","4B","conjoined","man","","","M1 and W3 are flirting with each other","flirt3","rating_causation","{""Q0"":3}","[0]","M1 started flirting with W3 first","W3 started flirting with M1 first"
"1580.989999929443","","","survey-likert-extra-labels","126","2766890","0.0-46.0-2.0","56062","4B","conjoined","man","","","M1 and W3 are flirting with each other","flirt3","rating_volition","{""Q0"":3}","[0]","M1 wanted to flirt with W3","W3 wanted to flirt with M1"
"null","Luke and Jane are arguing with each other","","html-keyboard-response","127","2768896","0.0-47.0-0.0","56062","4B","conjoined","man","","null","M2 and W4 are arguing with each other","argue4","sentence","","","",""
"1317.7650000434369","","","survey-likert-extra-labels","128","2770224","0.0-47.0-1.0-0.0","56062","4B","conjoined","man","","","M2 and W4 are arguing with each other","argue4","rating_causation","{""Q0"":3}","[0]","W4 started an argument with M2","M2 started an argument with W4"
"988.0400000838563","","","survey-likert-extra-labels","129","2771218","0.0-47.0-2.0","56062","4B","conjoined","man","","","M2 and W4 are arguing with each other","argue4","rating_volition","{""Q0"":3}","[0]","W4 wanted to argue with M2","M2 wanted to argue with W4"
"null","Mike and Luke are marrying each other","","html-keyboard-response","130","2773226","0.0-48.0-0.0","56062","4B","conjoined","man","","null","M4 and M2 are marrying each other","marry2","sentence","","","",""
"948.7100000260398","","","survey-likert-extra-labels","131","2774184","0.0-48.0-2.0","56062","4B","conjoined","man","","","M4 and M2 are marrying each other","marry2","rating_volition","{""Q0"":3}","[0]","M4 wanted to marry M2","M2 wanted to marry M4"
"922.275000018999","","","survey-likert-extra-labels","132","2775112","0.0-48.0-3.0-0.0","56062","4B","conjoined","man","","","M4 and M2 are marrying each other","marry2","rating_causation","{""Q0"":3}","[0]","M4 asked to marry M2","M2 asked to marry M4"
"null","Luke is posing for Mike","","html-keyboard-response","133","2777119","0.0-49.0-0.0","56062","4B","conjoined","man","","null","M2 is posing for M4","pose","sentence","","","",""
"795.8949999883771","","","survey-likert-extra-labels","134","2777924","0.0-49.0-1.0-0.0","56062","4B","conjoined","man","","","M2 is posing for M4","pose","rating_causation","{""Q0"":3}","[0]","M2 is photographing M4","M4 is photographing M2"
"3992.674999986775","","","survey-likert-extra-labels","135","2781922","0.0-49.0-2.0","56062","4B","conjoined","man","","","M2 is posing for M4","pose","rating_volition","{""Q0"":0}","[0]","M2 is modelling for M4","M4 is modelling for M2"
"null","Jane and Ruth are touching each other","","html-keyboard-response","136","2783932","0.0-50.0-0.0","56062","4B","conjoined","man","","null","W4 and W2 are touching each other","touch1","sentence","","","",""
"1810.5750000104308","","","survey-likert-extra-labels","137","2785753","0.0-50.0-2.0","56062","4B","conjoined","man","","","W4 and W2 are touching each other","touch1","rating_volition","{""Q0"":3}","[0]","W4 wanted to touch W2","W2 wanted to touch W4"
"1099.404999986291","","","survey-likert-extra-labels","138","2786858","0.0-50.0-3.0-0.0","56062","4B","conjoined","man","","","W4 and W2 are touching each other","touch1","rating_causation","{""Q0"":3}","[0]","W4 asked to touch W2","W2 asked to touch W4"
"null","Mike and Luke are touching each other","","html-keyboard-response","139","2788863","0.0-51.0-0.0","56062","4B","conjoined","man","","null","M4 and M2 are touching each other","touch2","sentence","","","",""
"1324.6949999593198","","","survey-likert-extra-labels","140","2790198","0.0-51.0-1.0-0.0","56062","4B","conjoined","man","","","M4 and M2 are touching each other","touch2","rating_causation","{""Q0"":3}","[0]","M4 asked to touch M2","M2 asked to touch M4"
"1148.6199999926612","","","survey-likert-extra-labels","141","2791353","0.0-51.0-2.0","56062","4B","conjoined","man","","","M4 and M2 are touching each other","touch2","rating_volition","{""Q0"":3}","[0]","M4 wanted to touch M2","M2 wanted to touch M4"
"null","Fred and Beth are touching each other","","html-keyboard-response","142","2793357","0.0-52.0-0.0","56062","4B","conjoined","man","","null","M1 and W3 are touching each other","touch3","sentence","","","",""
"883.849999983795","","","survey-likert-extra-labels","143","2794244","0.0-52.0-2.0","56062","4B","conjoined","man","","","M1 and W3 are touching each other","touch3","rating_volition","{""Q0"":3}","[0]","M1 wanted to touch W3","W3 wanted to touch M1"
"1772.4450000096112","","","survey-likert-extra-labels","144","2796022","0.0-52.0-3.0-0.0","56062","4B","conjoined","man","","","M1 and W3 are touching each other","touch3","rating_causation","{""Q0"":3}","[0]","M1 asked to touch W3","W3 asked to touch M1"
"null","Fred and Dave are arguing with each other","","html-keyboard-response","145","2798027","0.0-53.0-0.0","56062","4B","conjoined","man","","null","M1 and M3 are arguing with each other","argue2","sentence","","","",""
"2006.0149999335408","","","survey-likert-extra-labels","146","2800038","0.0-53.0-1.0-0.0","56062","4B","conjoined","man","","","M1 and M3 are arguing with each other","argue2","rating_causation","{""Q0"":3}","[0]","M3 started an argument with M1","M1 started an argument with M3"
"1177.5400000624359","","","survey-likert-extra-labels","147","2801222","0.0-53.0-2.0","56062","4B","conjoined","man","","","M1 and M3 are arguing with each other","argue2","rating_volition","{""Q0"":3}","[0]","M3 wanted to argue with M1","M1 wanted to argue with M3"
"null","Beth is feeding Fred","","html-keyboard-response","148","2803228","0.0-54.0-0.0","56062","4B","conjoined","man","","null","W3 is feeding M1","feed","sentence","","","",""
"3681.5199999837205","","","survey-likert-extra-labels","149","2806920","0.0-54.0-1.0-0.0","56062","4B","conjoined","man","","","W3 is feeding M1","feed","rating_causation","{""Q0"":6}","[0]","W3 is eating M1's food","M1 is eating W3's food"
"7411.8149999994785","","","survey-likert-extra-labels","150","2814338","0.0-54.0-2.0","56062","4B","conjoined","man","","","W3 is feeding M1","feed","rating_volition","{""Q0"":0}","[0]","W3 is giving M1 food","M1 is giving W3 food"
"2213.6399999726564","<p>Thank you for completing that task.</p><p>The final part of this session is a short questionnaire.</p><p>Press Continue.</p>","0","html-button-response","151","2816556","0.0-55.0","56062","4B","conjoined","man","","","","","","","","",""
"30913.830000092275","","","survey-text","152","2848562","0.0-56.0","56062","4B","conjoined","man","","","","","demographics","{""Q0"":""37"",""Q1"":""Bengali"",""Q2"":""English"",""Q3"":""United Kingdom"",""Q4"":""British"",""Q5"":""Bangladeshi"",""Q6"":""Male""}","","",""
"1907.3349999962375","<p>Have you lived in the UK for the last 5 years or more?</p>","0","html-button-response","153","2850474","0.0-57.0","56062","4B","conjoined","man","","","","","fiveyears","","","",""
"3754.6549999387935","","","survey-text","154","2855281","0.0-58.0","56062","4B","conjoined","man","","","","","worker_id","{""Q0"":""5de21543762dc22548c937b3""}","","",""
"12681.87999993097","","","external-html","155","2868558","0.0-59.0","56062","4B","conjoined","man","debrief.html","","","","","","","",""
