"rt","stimulus","button_pressed","trial_type","trial_index","time_elapsed","internal_node_id","subject","list","condition","ppt_gender","url","key_press","sentence_type","verb","test_part","responses","question_order","left_part","right_part"
"91695.23499999195","Welcome to the experiment. Press Continue to begin.","0","html-button-response","0","91706","0.0-0.0","56062","4B","conjoined","man","","","","","","","","",""
"13769.785000011325","","","external-html","1","106599","0.0-1.0","56062","4B","conjoined","man","consent.html","","","","","","","",""
"13957.769999979064","<p>Welcome.</p><p>In this experiment we will ask you to imagine some situations.</p><p>Each trial starts with a description of an event.</p><p>Then you will see alternative descriptions of that event, and you will rate on a scale how best they match the original description.</p><p>You will give your answer by clicking a button on a rating scale.</p><p>To do this task, you will have to use your imagination to visualise these events.</p><br><p>Ready?</p>","0","html-button-response","2","120561","0.0-2.0","56062","4B","conjoined","man","","","","","","","","",""
"3434.264999930747","<p>Before the experiment starts, you will watch an example trial. Press 'Continue'.</p>","0","html-button-response","3","125009","0.0-3.0","56062","4B","conjoined","man","","","","","","","","",""
"null","The police officer is arresting the robber","","html-keyboard-response","4","128025","0.0-4.0","56062","4B","conjoined","man","","null","","","","","","",""
"48228.95000001881","<img src='img/Example-trial.jpg' style='height:550px;''></img>","0","html-button-response","5","176261","0.0-5.0","56062","4B","conjoined","man","","","","","","","","",""
"159180.2499999758","<p>Ready to start the experiment?</p><br><p><strong>Remember to give an answer by clicking a button on the rating scale.</strong></p><p>Press 'Continue' to begin.</p>","0","html-button-response","6","336448","0.0-6.0","56062","4B","conjoined","man","","","","","","","","",""
"null","Kate and Dave are flirting with each other","","html-keyboard-response","7","339483","0.0-7.0-0.0","56062","4B","conjoined","man","","null","W1 and M3 are flirting with each other","flirt4","sentence","","","",""
"87633.03000002634","","","survey-likert-extra-labels","8","427140","0.0-7.0-2.0","56062","4B","conjoined","man","","","W1 and M3 are flirting with each other","flirt4","rating_volition","{""Q0"":3}","[0]","W1 wanted to flirt with M3","M3 wanted to flirt with W1"
"4703.840000089258","","","survey-likert-extra-labels","9","431851","0.0-7.0-3.0-0.0","56062","4B","conjoined","man","","","W1 and M3 are flirting with each other","flirt4","rating_causation","{""Q0"":3}","[0]","W1 started flirting with M3 first","M3 started flirting with W1 first"
"null","Kate is chasing Beth","","html-keyboard-response","10","433857","0.0-8.0-0.0","56062","4B","conjoined","man","","null","W1 is chasing W3","chase","sentence","","","",""
"4912.829999928363","","","survey-likert-extra-labels","11","438783","0.0-8.0-1.0-0.0","56062","4B","conjoined","man","","","W1 is chasing W3","chase","rating_causation","{""Q0"":6}","[0]","W1 is running away from W3","W3 is running away from W1"
"52177.419999963604","","","survey-likert-extra-labels","12","490968","0.0-8.0-2.0","56062","4B","conjoined","man","","","W1 is chasing W3","chase","rating_volition","{""Q0"":6}","[0]","W1 is behind W3","W3 is behind W1"
"null","Luke is reminding Jane","","html-keyboard-response","13","492974","0.0-9.0-0.0","56062","4B","conjoined","man","","null","M2 is reminding W4","remind","sentence","","","",""
"92665.80499999691","","","survey-likert-extra-labels","14","585651","0.0-9.0-1.0-0.0","56062","4B","conjoined","man","","","M2 is reminding W4","remind","rating_causation","{""Q0"":6}","[0]","M2 is remembering","W4 is remembering"
"21536.515000043437","","","survey-likert-extra-labels","15","607195","0.0-9.0-2.0","56062","4B","conjoined","man","","","M2 is reminding W4","remind","rating_volition","{""Q0"":0}","[0]","M2 is telling W4 again","W4 is telling M2 again"
"null","Beth and Fred are playing with each other","","html-keyboard-response","16","609201","0.0-10.0-0.0","56062","4B","conjoined","man","","null","W3 and M1 are playing with each other","play4","sentence","","","",""
"4771.719999960624","","","survey-likert-extra-labels","17","613983","0.0-10.0-1.0-0.0","56062","4B","conjoined","man","","","W3 and M1 are playing with each other","play4","rating_causation","{""Q0"":3}","[0]","M1 asked to play with W3","W3 asked to play with M1"
"3753.1299999682233","","","survey-likert-extra-labels","18","617742","0.0-10.0-2.0","56062","4B","conjoined","man","","","W3 and M1 are playing with each other","play4","rating_volition","{""Q0"":3}","[0]","M1 wanted to play with W3","W3 wanted to play with M1"
"null","Dave and Kate are fighting each other","","html-keyboard-response","19","619750","0.0-11.0-0.0","56062","4B","conjoined","man","","null","M3 and W1 are fighting each other","fight4","sentence","","","",""
"4033.43000006862","","","survey-likert-extra-labels","20","623792","0.0-11.0-2.0","56062","4B","conjoined","man","","","M3 and W1 are fighting each other","fight4","rating_volition","{""Q0"":3}","[0]","W1 wanted to fight M3","M3 wanted to fight W1"
"4655.535000027157","","","survey-likert-extra-labels","21","628455","0.0-11.0-3.0-0.0","56062","4B","conjoined","man","","","M3 and W1 are fighting each other","fight4","rating_causation","{""Q0"":3}","[0]","W1 started the fight with M3","M3 started the fight with W1"
"null","Jane and Luke are dancing with each other","","html-keyboard-response","22","630461","0.0-12.0-0.0","56062","4B","conjoined","man","","null","W4 and M2 are dancing with each other","dance4","sentence","","","",""
"4211.050000041723","","","survey-likert-extra-labels","23","634683","0.0-12.0-1.0-0.0","56062","4B","conjoined","man","","","W4 and M2 are dancing with each other","dance4","rating_causation","{""Q0"":3}","[0]","W4 asked M2 to dance","M2 asked W4 to dance"
"2981.0500000603497","","","survey-likert-extra-labels","24","637671","0.0-12.0-2.0","56062","4B","conjoined","man","","","W4 and M2 are dancing with each other","dance4","rating_volition","{""Q0"":3}","[0]","W4 wanted to dance with M2","M2 wanted to dance with W4"
"null","Beth and Kate are kissing each other","","html-keyboard-response","25","639677","0.0-13.0-0.0","56062","4B","conjoined","man","","null","W3 and W1 are kissing each other","kiss1","sentence","","","",""
"3985.755000030622","","","survey-likert-extra-labels","26","643672","0.0-13.0-2.0","56062","4B","conjoined","man","","","W3 and W1 are kissing each other","kiss1","rating_volition","{""Q0"":3}","[0]","W3 wanted to kiss W1","W1 wanted to kiss W3"
"2445.285000023432","","","survey-likert-extra-labels","27","646124","0.0-13.0-3.0-0.0","56062","4B","conjoined","man","","","W3 and W1 are kissing each other","kiss1","rating_causation","{""Q0"":3}","[0]","W3 asked to kiss W1","W1 asked to kiss W3"
"null","Kate and Dave are marrying each other","","html-keyboard-response","28","648129","0.0-14.0-0.0","56062","4B","conjoined","man","","null","W1 and M3 are marrying each other","marry3","sentence","","","",""
"3361.3550000591204","","","survey-likert-extra-labels","29","651500","0.0-14.0-1.0-0.0","56062","4B","conjoined","man","","","W1 and M3 are marrying each other","marry3","rating_causation","{""Q0"":3}","[0]","W1 asked to marry M3","M3 asked to marry W1"
"7815.2850000187755","","","survey-likert-extra-labels","30","659323","0.0-14.0-2.0","56062","4B","conjoined","man","","","W1 and M3 are marrying each other","marry3","rating_volition","{""Q0"":3}","[0]","W1 wanted to marry M3","M3 wanted to marry W1"
"null","Jane and Luke are kissing each other","","html-keyboard-response","31","661330","0.0-15.0-0.0","56062","4B","conjoined","man","","null","W4 and M2 are kissing each other","kiss3","sentence","","","",""
"19696.16000005044","","","survey-likert-extra-labels","32","681036","0.0-15.0-1.0-0.0","56062","4B","conjoined","man","","","W4 and M2 are kissing each other","kiss3","rating_causation","{""Q0"":3}","[0]","W4 asked to kiss M2","M2 asked to kiss W4"
"1963.6999999638647","","","survey-likert-extra-labels","33","683007","0.0-15.0-2.0","56062","4B","conjoined","man","","","W4 and M2 are kissing each other","kiss3","rating_volition","{""Q0"":3}","[0]","W4 wanted to kiss M2","M2 wanted to kiss W4"
"null","Ruth is teaching Mike","","html-keyboard-response","34","685012","0.0-16.0-0.0","56062","4B","conjoined","man","","null","W2 is teaching M4","teach","sentence","","","",""
"224596.87499993015","","","survey-likert-extra-labels","35","909616","0.0-16.0-2.0","56062","4B","conjoined","man","","","W2 is teaching M4","teach","rating_volition","{""Q0"":0}","[0]","W2 is educating M4","M4 is educating W2"
"5768.359999987297","","","survey-likert-extra-labels","36","915392","0.0-16.0-3.0-0.0","56062","4B","conjoined","man","","","W2 is teaching M4","teach","rating_causation","{""Q0"":6}","[0]","W2 is learning from M4","M4 is learning from W2"
"null","Luke and Mike are fighting each other","","html-keyboard-response","37","917399","0.0-17.0-0.0","56062","4B","conjoined","man","","null","M2 and M4 are fighting each other","fight2","sentence","","","",""
"7334.094999940135","","","survey-likert-extra-labels","38","924739","0.0-17.0-1.0-0.0","56062","4B","conjoined","man","","","M2 and M4 are fighting each other","fight2","rating_causation","{""Q0"":3}","[0]","M4 started the fight with M2","M2 started the fight with M4"
"19140.429999912158","","","survey-likert-extra-labels","39","943886","0.0-17.0-2.0","56062","4B","conjoined","man","","","M2 and M4 are fighting each other","fight2","rating_volition","{""Q0"":3}","[0]","M4 wanted to fight M2","M2 wanted to fight M4"
"null","Jane and Ruth are marrying each other","","html-keyboard-response","40","945892","0.0-18.0-0.0","56062","4B","conjoined","man","","null","W4 and W2 are marrying each other","marry1","sentence","","","",""
"24903.330000001006","","","survey-likert-extra-labels","41","970804","0.0-18.0-2.0","56062","4B","conjoined","man","","","W4 and W2 are marrying each other","marry1","rating_volition","{""Q0"":3}","[0]","W4 wanted to marry W2","W2 wanted to marry W4"
"2388.7800000375137","","","survey-likert-extra-labels","42","973200","0.0-18.0-3.0-0.0","56062","4B","conjoined","man","","","W4 and W2 are marrying each other","marry1","rating_causation","{""Q0"":3}","[0]","W4 asked to marry W2","W2 asked to marry W4"
"null","Kate and Dave are touching each other","","html-keyboard-response","43","975206","0.0-19.0-0.0","56062","4B","conjoined","man","","null","W1 and M3 are touching each other","touch4","sentence","","","",""
"25378.850000095554","","","survey-likert-extra-labels","44","1000600","0.0-19.0-2.0","56062","4B","conjoined","man","","","W1 and M3 are touching each other","touch4","rating_volition","{""Q0"":3}","[0]","W1 wanted to touch M3","M3 wanted to touch W1"
"2429.1799999773502","","","survey-likert-extra-labels","45","1003036","0.0-19.0-3.0-0.0","56062","4B","conjoined","man","","","W1 and M3 are touching each other","touch4","rating_causation","{""Q0"":3}","[0]","W1 asked to touch M3","M3 asked to touch W1"
"null","Fred is driving Dave","","html-keyboard-response","46","1005051","0.0-20.0-0.0","56062","4B","conjoined","man","","null","M1 is driving M3","drive","sentence","","","",""
"6160.295000066981","","","survey-likert-extra-labels","47","1011220","0.0-20.0-2.0","56062","4B","conjoined","man","","","M1 is driving M3","drive","rating_volition","{""Q0"":0}","[0]","M3 is M1's passenger","M1 is M3's passenger"
"45238.50999993738","","","survey-likert-extra-labels","48","1056466","0.0-20.0-3.0-0.0","56062","4B","conjoined","man","","","M1 is driving M3","drive","rating_causation","{""Q0"":6}","[0]","M3 is taking M1 somewhere","M1 is taking M3 somewhere"
"null","Jane and Ruth are flirting with each other","","html-keyboard-response","49","1058472","0.0-21.0-0.0","56062","4B","conjoined","man","","null","W4 and W2 are flirting with each other","flirt1","sentence","","","",""
"23488.335000001825","","","survey-likert-extra-labels","50","1081966","0.0-21.0-1.0-0.0","56062","4B","conjoined","man","","","W4 and W2 are flirting with each other","flirt1","rating_causation","{""Q0"":3}","[0]","W4 started flirting with W2 first","W2 started flirting with W4 first"
"1341642.7850000327","","","survey-likert-extra-labels","51","2412141","0.0-21.0-2.0","56062","4B","conjoined","man","","","W4 and W2 are flirting with each other","flirt1","rating_volition","{""Q0"":3}","[0]","W4 wanted to flirt with W2","W2 wanted to flirt with W4"
"null","Fred and Beth are marrying each other","","html-keyboard-response","52","2414145","0.0-22.0-0.0","56062","4B","conjoined","man","","null","M1 and W3 are marrying each other","marry4","sentence","","","",""
"3208.935000002384","","","survey-likert-extra-labels","53","2417358","0.0-22.0-1.0-0.0","56062","4B","conjoined","man","","","M1 and W3 are marrying each other","marry4","rating_causation","{""Q0"":3}","[0]","M1 asked to marry W3","W3 asked to marry M1"
"2951.245000003837","","","survey-likert-extra-labels","54","2420314","0.0-22.0-2.0","56062","4B","conjoined","man","","","M1 and W3 are marrying each other","marry4","rating_volition","{""Q0"":3}","[0]","M1 wanted to marry W3","W3 wanted to marry M1"
"null","Ruth is carrying Jane","","html-keyboard-response","55","2422431","0.0-23.0-0.0","56062","4B","conjoined","man","","null","W2 is carrying W4","carry","sentence","","","",""
"29164.630000013858","","","survey-likert-extra-labels","56","2451602","0.0-23.0-1.0-0.0","56062","4B","conjoined","man","","","W2 is carrying W4","carry","rating_causation","{""Q0"":6}","[0]","W2 is being moved by W4","W4 is being moved by W2"
"7469.674999942072","","","survey-likert-extra-labels","57","2459077","0.0-23.0-2.0","56062","4B","conjoined","man","","","W2 is carrying W4","carry","rating_volition","{""Q0"":0}","[0]","W2 is transporting W4","W4 is transporting W2"
"null","Ruth and Mike are shouting at each other","","html-keyboard-response","58","2461085","0.0-24.0-0.0","56062","4B","conjoined","man","","null","W2 and M4 are shouting at each other","shout4","sentence","","","",""
"18829.180000000633","","","survey-likert-extra-labels","59","2479918","0.0-24.0-1.0-0.0","56062","4B","conjoined","man","","","W2 and M4 are shouting at each other","shout4","rating_causation","{""Q0"":3}","[0]","M4 shouted at W2 first","W2 shouted at M4 first"
"3920.864999992773","","","survey-likert-extra-labels","60","2483846","0.0-24.0-2.0","56062","4B","conjoined","man","","","W2 and M4 are shouting at each other","shout4","rating_volition","{""Q0"":3}","[0]","M4 wanted to shout at W2","W2 wanted to shout at M4"
"null","Dave and Fred are talking to each other","","html-keyboard-response","61","2485851","0.0-25.0-0.0","56062","4B","conjoined","man","","null","M3 and M1 are talking to each other","talk2","sentence","","","",""
"4050.054999999702","","","survey-likert-extra-labels","62","2489912","0.0-25.0-1.0-0.0","56062","4B","conjoined","man","","","M3 and M1 are talking to each other","talk2","rating_causation","{""Q0"":3}","[0]","M3 started a conversation with M1","M1 started a conversation with M3"
"2349.0900000324473","","","survey-likert-extra-labels","63","2492268","0.0-25.0-2.0","56062","4B","conjoined","man","","","M3 and M1 are talking to each other","talk2","rating_volition","{""Q0"":3}","[0]","M3 wanted to talk to M1","M1 wanted to talk to M3"
"null","Mike and Ruth are talking to each other","","html-keyboard-response","64","2494274","0.0-26.0-0.0","56062","4B","conjoined","man","","null","M4 and W2 are talking to each other","talk3","sentence","","","",""
"1323.2050000224262","","","survey-likert-extra-labels","65","2495607","0.0-26.0-1.0-0.0","56062","4B","conjoined","man","","","M4 and W2 are talking to each other","talk3","rating_causation","{""Q0"":3}","[0]","M4 started a conversation with W2","W2 started a conversation with M4"
"2237.62499995064","","","survey-likert-extra-labels","66","2497850","0.0-26.0-2.0","56062","4B","conjoined","man","","","M4 and W2 are talking to each other","talk3","rating_volition","{""Q0"":3}","[0]","M4 wanted to talk to W2","W2 wanted to talk to M4"
"null","Kate and Beth are arguing with each other","","html-keyboard-response","67","2499855","0.0-27.0-0.0","56062","4B","conjoined","man","","null","W1 and W3 are arguing with each other","argue1","sentence","","","",""
"1333.7299999548122","","","survey-likert-extra-labels","68","2501200","0.0-27.0-2.0","56062","4B","conjoined","man","","","W1 and W3 are arguing with each other","argue1","rating_volition","{""Q0"":3}","[0]","W3 wanted to argue with W1","W1 wanted to argue with W3"
"1284.3799999682233","","","survey-likert-extra-labels","69","2502490","0.0-27.0-3.0-0.0","56062","4B","conjoined","man","","","W1 and W3 are arguing with each other","argue1","rating_causation","{""Q0"":3}","[0]","W3 started an argument with W1","W1 started an argument with W3"
"null","Dave and Kate are playing with each other","","html-keyboard-response","70","2504497","0.0-28.0-0.0","56062","4B","conjoined","man","","null","M3 and W1 are playing with each other","play3","sentence","","","",""
"3103.250000043772","","","survey-likert-extra-labels","71","2507610","0.0-28.0-1.0-0.0","56062","4B","conjoined","man","","","M3 and W1 are playing with each other","play3","rating_causation","{""Q0"":3}","[0]","W1 asked to play with M3","M3 asked to play with W1"
"1307.9450000077486","","","survey-likert-extra-labels","72","2508924","0.0-28.0-2.0","56062","4B","conjoined","man","","","M3 and W1 are playing with each other","play3","rating_volition","{""Q0"":3}","[0]","W1 wanted to play with M3","M3 wanted to play with W1"
"null","Beth and Kate are talking to each other","","html-keyboard-response","73","2510930","0.0-29.0-0.0","56062","4B","conjoined","man","","null","W3 and W1 are talking to each other","talk1","sentence","","","",""
"1971.9000000040978","","","survey-likert-extra-labels","74","2512911","0.0-29.0-1.0-0.0","56062","4B","conjoined","man","","","W3 and W1 are talking to each other","talk1","rating_causation","{""Q0"":3}","[0]","W3 started a conversation with W1","W1 started a conversation with W3"
"1804.7249999362975","","","survey-likert-extra-labels","75","2514722","0.0-29.0-2.0","56062","4B","conjoined","man","","","W3 and W1 are talking to each other","talk1","rating_volition","{""Q0"":3}","[0]","W3 wanted to talk to W1","W1 wanted to talk to W3"
"null","Dave is hiring Kate","","html-keyboard-response","76","2516728","0.0-30.0-0.0","56062","4B","conjoined","man","","null","M3 is hiring W1","hire","sentence","","","",""
"3522.0099999569356","","","survey-likert-extra-labels","77","2520260","0.0-30.0-2.0","56062","4B","conjoined","man","","","M3 is hiring W1","hire","rating_volition","{""Q0"":0}","[0]","M3 is employing W1","W1 is employing M3"
"4224.6199999935925","","","survey-likert-extra-labels","78","2524491","0.0-30.0-3.0-0.0","56062","4B","conjoined","man","","","M3 is hiring W1","hire","rating_causation","{""Q0"":6}","[0]","M3 will work for W1","W1 will work for M3"
"null","Luke and Mike are playing with each other","","html-keyboard-response","79","2526498","0.0-31.0-0.0","56062","4B","conjoined","man","","null","M2 and M4 are playing with each other","play2","sentence","","","",""
"4533.4299999522045","","","survey-likert-extra-labels","80","2531060","0.0-31.0-1.0-0.0","56062","4B","conjoined","man","","","M2 and M4 are playing with each other","play2","rating_causation","{""Q0"":3}","[0]","M4 asked to play with M2","M2 asked to play with M4"
"1382.7899999450892","","","survey-likert-extra-labels","81","2532449","0.0-31.0-2.0","56062","4B","conjoined","man","","","M2 and M4 are playing with each other","play2","rating_volition","{""Q0"":3}","[0]","M4 wanted to play with M2","M2 wanted to play with M4"
"null","Ruth and Jane are playing with each other","","html-keyboard-response","82","2534454","0.0-32.0-0.0","56062","4B","conjoined","man","","null","W2 and W4 are playing with each other","play1","sentence","","","",""
"5471.759999985807","","","survey-likert-extra-labels","83","2539936","0.0-32.0-2.0","56062","4B","conjoined","man","","","W2 and W4 are playing with each other","play1","rating_volition","{""Q0"":3}","[0]","W4 wanted to play with W2","W2 wanted to play with W4"
"1404.2899999767542","","","survey-likert-extra-labels","84","2541347","0.0-32.0-3.0-0.0","56062","4B","conjoined","man","","","W2 and W4 are playing with each other","play1","rating_causation","{""Q0"":3}","[0]","W4 asked to play with W2","W2 asked to play with W4"
"null","Dave and Fred are dancing with each other","","html-keyboard-response","85","2543352","0.0-33.0-0.0","56062","4B","conjoined","man","","null","M3 and M1 are dancing with each other","dance2","sentence","","","",""
"1514.9750000564381","","","survey-likert-extra-labels","86","2544872","0.0-33.0-2.0","56062","4B","conjoined","man","","","M3 and M1 are dancing with each other","dance2","rating_volition","{""Q0"":3}","[0]","M3 wanted to dance with M1","M1 wanted to dance with M3"
"1339.4700000062585","","","survey-likert-extra-labels","87","2546218","0.0-33.0-3.0-0.0","56062","4B","conjoined","man","","","M3 and M1 are dancing with each other","dance2","rating_causation","{""Q0"":3}","[0]","M3 asked M1 to dance","M1 asked M3 to dance"
"null","Ruth and Jane are fighting each other","","html-keyboard-response","88","2548289","0.0-34.0-0.0","56062","4B","conjoined","man","","null","W2 and W4 are fighting each other","fight1","sentence","","","",""
"17439.175000065006","","","survey-likert-extra-labels","89","2565814","0.0-34.0-2.0","56062","4B","conjoined","man","","","W2 and W4 are fighting each other","fight1","rating_volition","{""Q0"":3}","[0]","W4 wanted to fight W2","W2 wanted to fight W4"
"3028.0100000090897","","","survey-likert-extra-labels","90","2568850","0.0-34.0-3.0-0.0","56062","4B","conjoined","man","","","W2 and W4 are fighting each other","fight1","rating_causation","{""Q0"":3}","[0]","W4 started the fight with W2","W2 started the fight with W4"
"null","Beth and Kate are dancing with each other","","html-keyboard-response","91","2570855","0.0-35.0-0.0","56062","4B","conjoined","man","","null","W3 and W1 are dancing with each other","dance1","sentence","","","",""
"2215.709999902174","","","survey-likert-extra-labels","92","2573080","0.0-35.0-2.0","56062","4B","conjoined","man","","","W3 and W1 are dancing with each other","dance1","rating_volition","{""Q0"":3}","[0]","W3 wanted to dance with W1","W1 wanted to dance with W3"
"1758.3950000116602","","","survey-likert-extra-labels","93","2574844","0.0-35.0-3.0-0.0","56062","4B","conjoined","man","","","W3 and W1 are dancing with each other","dance1","rating_causation","{""Q0"":3}","[0]","W3 asked W1 to dance","W1 asked W3 to dance"
"null","Kate and Beth are shouting at each other","","html-keyboard-response","94","2576848","0.0-36.0-0.0","56062","4B","conjoined","man","","null","W1 and W3 are shouting at each other","shout1","sentence","","","",""
"2693.020000006072","","","survey-likert-extra-labels","95","2579555","0.0-36.0-2.0","56062","4B","conjoined","man","","","W1 and W3 are shouting at each other","shout1","rating_volition","{""Q0"":3}","[0]","W3 wanted to shout at W1","W1 wanted to shout at W3"
"1084.1700000455603","","","survey-likert-extra-labels","96","2580645","0.0-36.0-3.0-0.0","56062","4B","conjoined","man","","","W1 and W3 are shouting at each other","shout1","rating_causation","{""Q0"":3}","[0]","W3 shouted at W1 first","W1 shouted at W3 first"
"null","Beth and Fred are fighting each other","","html-keyboard-response","97","2582653","0.0-37.0-0.0","56062","4B","conjoined","man","","null","W3 and M1 are fighting each other","fight3","sentence","","","",""
"26771.194999921136","","","survey-likert-extra-labels","98","2609431","0.0-37.0-2.0","56062","4B","conjoined","man","","","W3 and M1 are fighting each other","fight3","rating_volition","{""Q0"":3}","[0]","M1 wanted to fight W3","W3 wanted to fight M1"
"1168.6599999666214","","","survey-likert-extra-labels","99","2610607","0.0-37.0-3.0-0.0","56062","4B","conjoined","man","","","W3 and M1 are fighting each other","fight3","rating_causation","{""Q0"":3}","[0]","M1 started the fight with W3","W3 started the fight with M1"
"null","Ruth and Mike are arguing with each other","","html-keyboard-response","100","2612621","0.0-38.0-0.0","56062","4B","conjoined","man","","null","W2 and M4 are arguing with each other","argue3","sentence","","","",""
"11203.635000041686","","","survey-likert-extra-labels","101","2623829","0.0-38.0-1.0-0.0","56062","4B","conjoined","man","","","W2 and M4 are arguing with each other","argue3","rating_causation","{""Q0"":3}","[0]","M4 started an argument with W2","W2 started an argument with M4"
"1531.2549999216571","","","survey-likert-extra-labels","102","2625367","0.0-38.0-2.0","56062","4B","conjoined","man","","","W2 and M4 are arguing with each other","argue3","rating_volition","{""Q0"":3}","[0]","M4 wanted to argue with W2","W2 wanted to argue with M4"
"null","Luke and Jane are shouting at each other","","html-keyboard-response","103","2627371","0.0-39.0-0.0","56062","4B","conjoined","man","","null","M2 and W4 are shouting at each other","shout3","sentence","","","",""
"53545.8599999547","","","survey-likert-extra-labels","104","2680923","0.0-39.0-1.0-0.0","56062","4B","conjoined","man","","","M2 and W4 are shouting at each other","shout3","rating_causation","{""Q0"":3}","[0]","W4 shouted at M2 first","M2 shouted at W4 first"
