"rt","stimulus","button_pressed","trial_type","trial_index","time_elapsed","internal_node_id","subject","list","condition","ppt_gender","url","key_press","sentence_type","verb","test_part","responses","question_order","left_part","right_part"
"1307","","","survey-likert-extra-labels","110","355673","0.0-41.0-2.0","70603","1A","conjoined","man","","","W3 and M1 are touching each other","touch3","rating_volition","{""Q0"":3}","[0]","W3 wanted to touch M1","M1 wanted to touch W3"
"2084","","","survey-likert-extra-labels","111","357761","0.0-41.0-3.0-0.0","70603","1A","conjoined","man","","","W3 and M1 are touching each other","touch3","rating_causation","{""Q0"":3}","[0]","W3 asked to touch M1","M1 asked to touch W3"
"null","Jane is teaching Dave","","html-keyboard-response","112","359764","0.0-42.0-0.0","70603","1A","conjoined","man","","null","W2 is teaching M4","teach","sentence","","","",""
"6546","","","survey-likert-extra-labels","113","366315","0.0-42.0-1.0-0.0","70603","1A","conjoined","man","","","W2 is teaching M4","teach","rating_causation","{""Q0"":5}","[0]","W2 is learning from M4","M4 is learning from W2"
"4499","","","survey-likert-extra-labels","114","370818","0.0-42.0-2.0","70603","1A","conjoined","man","","","W2 is teaching M4","teach","rating_volition","{""Q0"":1}","[0]","W2 is educating M4","M4 is educating W2"
"null","Fred and Ruth are flirting with each other","","html-keyboard-response","115","372821","0.0-43.0-0.0","70603","1A","conjoined","man","","null","M3 and W1 are flirting with each other","flirt4","sentence","","","",""
"2842","","","survey-likert-extra-labels","116","375665","0.0-43.0-1.0-0.0","70603","1A","conjoined","man","","","M3 and W1 are flirting with each other","flirt4","rating_causation","{""Q0"":3}","[0]","M3 started flirting with W1 first","W1 started flirting with M3 first"
"1342","","","survey-likert-extra-labels","117","377010","0.0-43.0-2.0","70603","1A","conjoined","man","","","M3 and W1 are flirting with each other","flirt4","rating_volition","{""Q0"":3}","[0]","M3 wanted to flirt with W1","W1 wanted to flirt with M3"
"null","Beth and Jane are fighting each other","","html-keyboard-response","118","379011","0.0-44.0-0.0","70603","1A","conjoined","man","","null","W4 and W2 are fighting each other","fight1","sentence","","","",""
"1693","","","survey-likert-extra-labels","119","380705","0.0-44.0-2.0","70603","1A","conjoined","man","","","W4 and W2 are fighting each other","fight1","rating_volition","{""Q0"":3}","[0]","W2 wanted to fight W4","W4 wanted to fight W2"
"1197","","","survey-likert-extra-labels","120","381905","0.0-44.0-3.0-0.0","70603","1A","conjoined","man","","","W4 and W2 are fighting each other","fight1","rating_causation","{""Q0"":3}","[0]","W2 started the fight with W4","W4 started the fight with W2"
"null","Jane and Beth are flirting with each other","","html-keyboard-response","121","383909","0.0-45.0-0.0","70603","1A","conjoined","man","","null","W2 and W4 are flirting with each other","flirt1","sentence","","","",""
"1771","","","survey-likert-extra-labels","122","385682","0.0-45.0-1.0-0.0","70603","1A","conjoined","man","","","W2 and W4 are flirting with each other","flirt1","rating_causation","{""Q0"":3}","[0]","W2 started flirting with W4 first","W4 started flirting with W2 first"
"1300","","","survey-likert-extra-labels","123","386985","0.0-45.0-2.0","70603","1A","conjoined","man","","","W2 and W4 are flirting with each other","flirt1","rating_volition","{""Q0"":3}","[0]","W2 wanted to flirt with W4","W4 wanted to flirt with W2"
"null","Beth and Mike are kissing each other","","html-keyboard-response","124","388988","0.0-46.0-0.0","70603","1A","conjoined","man","","null","W4 and M2 are kissing each other","kiss3","sentence","","","",""
"1628","","","survey-likert-extra-labels","125","390617","0.0-46.0-1.0-0.0","70603","1A","conjoined","man","","","W4 and M2 are kissing each other","kiss3","rating_causation","{""Q0"":3}","[0]","M2 asked to kiss W4","W4 asked to kiss M2"
"2125","","","survey-likert-extra-labels","126","392745","0.0-46.0-2.0","70603","1A","conjoined","man","","","W4 and M2 are kissing each other","kiss3","rating_volition","{""Q0"":3}","[0]","M2 wanted to kiss W4","W4 wanted to kiss M2"
"null","Beth and Mike are arguing with each other","","html-keyboard-response","127","394748","0.0-47.0-0.0","70603","1A","conjoined","man","","null","W4 and M2 are arguing with each other","argue4","sentence","","","",""
"1195","","","survey-likert-extra-labels","128","395946","0.0-47.0-1.0-0.0","70603","1A","conjoined","man","","","W4 and M2 are arguing with each other","argue4","rating_causation","{""Q0"":3}","[0]","M2 started an argument with W4","W4 started an argument with M2"
"3252","","","survey-likert-extra-labels","129","399201","0.0-47.0-2.0","70603","1A","conjoined","man","","","W4 and M2 are arguing with each other","argue4","rating_volition","{""Q0"":3}","[0]","M2 wanted to argue with W4","W4 wanted to argue with M2"
"null","Kate and Luke are playing with each other","","html-keyboard-response","130","401204","0.0-48.0-0.0","70603","1A","conjoined","man","","null","W3 and M1 are playing with each other","play4","sentence","","","",""
"1059","","","survey-likert-extra-labels","131","402265","0.0-48.0-1.0-0.0","70603","1A","conjoined","man","","","W3 and M1 are playing with each other","play4","rating_causation","{""Q0"":3}","[0]","W3 asked to play with M1","M1 asked to play with W3"
"1805","","","survey-likert-extra-labels","132","404073","0.0-48.0-2.0","70603","1A","conjoined","man","","","W3 and M1 are playing with each other","play4","rating_volition","{""Q0"":3}","[0]","W3 wanted to play with M1","M1 wanted to play with W3"
"null","Ruth is chasing Kate","","html-keyboard-response","133","406075","0.0-49.0-0.0","70603","1A","conjoined","man","","null","W1 is chasing W3","chase","sentence","","","",""
"7084","","","survey-likert-extra-labels","134","413161","0.0-49.0-1.0-0.0","70603","1A","conjoined","man","","","W1 is chasing W3","chase","rating_causation","{""Q0"":5}","[0]","W1 is running away from W3","W3 is running away from W1"
"9662","","","survey-likert-extra-labels","135","422825","0.0-49.0-2.0","70603","1A","conjoined","man","","","W1 is chasing W3","chase","rating_volition","{""Q0"":1}","[0]","W1 is behind W3","W3 is behind W1"
"null","Ruth and Fred are marrying each other","","html-keyboard-response","136","424827","0.0-50.0-0.0","70603","1A","conjoined","man","","null","W1 and M3 are marrying each other","marry3","sentence","","","",""
"1060","","","survey-likert-extra-labels","137","425889","0.0-50.0-1.0-0.0","70603","1A","conjoined","man","","","W1 and M3 are marrying each other","marry3","rating_causation","{""Q0"":3}","[0]","M3 asked to marry W1","W1 asked to marry M3"
"1581","","","survey-likert-extra-labels","138","427473","0.0-50.0-2.0","70603","1A","conjoined","man","","","W1 and M3 are marrying each other","marry3","rating_volition","{""Q0"":3}","[0]","M3 wanted to marry W1","W1 wanted to marry M3"
"null","Luke and Fred are dancing with each other","","html-keyboard-response","139","429475","0.0-51.0-0.0","70603","1A","conjoined","man","","null","M1 and M3 are dancing with each other","dance2","sentence","","","",""
"1796","","","survey-likert-extra-labels","140","431274","0.0-51.0-1.0-0.0","70603","1A","conjoined","man","","","M1 and M3 are dancing with each other","dance2","rating_causation","{""Q0"":3}","[0]","M1 asked M3 to dance","M3 asked M1 to dance"
"1644","","","survey-likert-extra-labels","141","432921","0.0-51.0-2.0","70603","1A","conjoined","man","","","M1 and M3 are dancing with each other","dance2","rating_volition","{""Q0"":3}","[0]","M1 wanted to dance with M3","M3 wanted to dance with M1"
"null","Jane and Beth are touching each other","","html-keyboard-response","142","434924","0.0-52.0-0.0","70603","1A","conjoined","man","","null","W2 and W4 are touching each other","touch1","sentence","","","",""
"1204","","","survey-likert-extra-labels","143","436129","0.0-52.0-1.0-0.0","70603","1A","conjoined","man","","","W2 and W4 are touching each other","touch1","rating_causation","{""Q0"":3}","[0]","W2 asked to touch W4","W4 asked to touch W2"
"1845","","","survey-likert-extra-labels","144","437977","0.0-52.0-2.0","70603","1A","conjoined","man","","","W2 and W4 are touching each other","touch1","rating_volition","{""Q0"":3}","[0]","W2 wanted to touch W4","W4 wanted to touch W2"
"null","Jane is carrying Beth","","html-keyboard-response","145","439980","0.0-53.0-0.0","70603","1A","conjoined","man","","null","W2 is carrying W4","carry","sentence","","","",""
"3468","","","survey-likert-extra-labels","146","443449","0.0-53.0-1.0-0.0","70603","1A","conjoined","man","","","W2 is carrying W4","carry","rating_causation","{""Q0"":1}","[0]","W2 is being moved by W4","W4 is being moved by W2"
"5838","","","survey-likert-extra-labels","147","449289","0.0-53.0-2.0","70603","1A","conjoined","man","","","W2 is carrying W4","carry","rating_volition","{""Q0"":5}","[0]","W2 is transporting W4","W4 is transporting W2"
"null","Kate and Ruth are kissing each other","","html-keyboard-response","148","451291","0.0-54.0-0.0","70603","1A","conjoined","man","","null","W3 and W1 are kissing each other","kiss1","sentence","","","",""
"2493","","","survey-likert-extra-labels","149","453785","0.0-54.0-1.0-0.0","70603","1A","conjoined","man","","","W3 and W1 are kissing each other","kiss1","rating_causation","{""Q0"":3}","[0]","W1 asked to kiss W3","W3 asked to kiss W1"
"2470","","","survey-likert-extra-labels","150","456257","0.0-54.0-2.0","70603","1A","conjoined","man","","","W3 and W1 are kissing each other","kiss1","rating_volition","{""Q0"":3}","[0]","W1 wanted to kiss W3","W3 wanted to kiss W1"
"2989","<p>Thank you for completing that task.</p><p>The final part of this session is a short questionnaire.</p><p>Press Continue.</p>","0","html-button-response","151","459249","0.0-55.0","70603","1A","conjoined","man","","","","","","","","",""
"35689","","","survey-text","152","495948","0.0-56.0","70603","1A","conjoined","man","","","","","demographics","{""Q0"":""44"",""Q1"":""English"",""Q2"":""English"",""Q3"":""England"",""Q4"":""British"",""Q5"":""White"",""Q6"":""Male""}","","",""
"1833","<p>Have you lived in the UK for the last 5 years or more?</p>","0","html-button-response","153","497785","0.0-57.0","70603","1A","conjoined","man","","","","","fiveyears","","","",""
"13352","","","survey-text","154","512145","0.0-58.0","70603","1A","conjoined","man","","","","","worker_id","{""Q0"":""5872d1aaa205a90001e7f3a4""}","","",""
"6322","","","external-html","155","518529","0.0-59.0","70603","1A","conjoined","man","debrief.html","","","","","","","",""
